the presidents who was negative named the impossible and chinese englishmen,1
the emperor who was smaller pushed the uncertainty and scary exile,0
the mariner who was uncertain scorched the smart and offensive parisians,1
the spectators who was fourth spared the uncertain and overwhelmed barbarian,0
the writers who was funny spared the slick and unexpected lecturer,0
the defendant who was offensive hated the icy and uncredited emperors,1
the sucker who was imprisoned saved the federal and unconscious mariner,0
the barbarian who was imperial mailed the unnecessary and smaller violinist,0
the lover who was oldest taxed the foul and free sucker,0
the shrinks who was notorious masked the imperial and foul spectator,0
the husband who was swift perceived the oldest and frozen homosexual,0
the president who was older drenched the unnamed and usual merchant,0
the exile who was smart deluged the imprisoned and improved  islamists,1
the loyalists who was scots taught the swift and foul president,0
the governors who was impressive immersed the clinical and swift mariners,1
the husband who was ugly twirled the future and uncomfortable engineer,0
the mariners who was swift mailed the smaller and odd emperors,1
the exile who was unique bound the foul and odd sucker,0
the exile who was old twirled the iconic and swiss shrinks,1
the exiles who was useful decorated the important and foul vocalists,1
the exiles who was unconscious kicked the smallest and unexpected girlfriends,1
the engineers who was funny fancied the focused and chief girlfriends,1
the fisherman who was unique showed the iconic and swiss technician,0
the loyalist who was orthodox bound the unsuccessful and older fishermen,1
the governor who was organization promised the funny and universal vocalist,0
the barbarians who was older understood the unconscious and smaller exiles,1
the spouses who was negative kicked the organized and unsuccessful lovers,1
the defendants who was criminal envied the important and improved barbarians,1
the technician who was notorious doused the slight and universal spectator,0
the fiance who was oldest addressed the notorious and slim englishman,0
the fiances who was useful liked the impressive and imperial rabbis,1
the loyalist who was slim doused the scientific and smaller martyr,0
the rabbis who was frozen saw the slim and oldest spouse,0
the sergeant who was frustrated admired the small and swiss enthusiasts,1
the parisian who was universal injected the uncertain and critical parisians,1
the fishermen who was unhappy promised the odd and swiss islamist,0
the husbands who was focused carried the unsuccessful and smaller writers,1
the rabbis who was smaller sliced the ukrainian and unsuccessful enthusiasts,1
the exile who was friendly uncovered the notorious and female spouses,1
the speakers who was improved addressed the ugly and imprisoned fisherman,0
the husbands who was organized deluged the usual and orthodox writers,1
the homosexuals who was icy saw the small and smaller rabbi,0
the fishermen who was older admired the fourth and usual barbarian,0
the warlocks who was immortal drenched the unsuccessful and noble islamist,0
the heroes who was iconic dragged the useful and immortal presidents,1
the emperor who was useless blanketed the universal and immortal sergeants,1
the grader who was uncertainty smothered the focused and ukrainian rabbi,0
the  islamists who was future served the unique and organized rabbis,1
the mariners who was small saw the iconic and female lover,0
the boxer who was feminine considered the unique and clinical lecturer,0
the engineer who was nuclear injected the funny and offensive governors,1
the merchant who was slight smothered the official and initial defendants,1
the shrinks who was universal carried the noble and scary governor,0
the boxers who was frustrated charged the irish and overwhelmed girlfriends,1
the programmers who was fourth bathed the scared and unhappy ruler,0
the spouses who was overwhelmed mentioned the imperial and unhappy spectator,0
the enthusiast who was unnecessary bathed the notorious and slim scribes,1
the programmers who was smart blanketed the outstanding and chief sucker,0
the barbarians who was smart bound the uncredited and important sucker,0
the loyalist who was feminine pushed the federal and unhappy enthusiast,0
the writer who was important promised the scottish and oldest scribes,1
the warlock who was friendly addressed the unnamed and ordinary hero,0
the speakers who was swift scorched the criminal and overwhelmed rabbi,0
the writers who was small scorched the slight and odd homosexual,0
the president who was slick doused the old and usual speaker,0
the enthusiasts who was usual judged the unnecessary and overwhelmed spectator,0
the defendants who was old considered the unconscious and clinical writers,1
the emperor who was unhappy concealed the smaller and imperial scribe,0
the lovers who was unnecessary lifted the iconic and unconscious engineer,0
the martyrs who was unnamed dubbed the offensive and uncertain speaker,0
the englishmen who was organization considered the odd and smallest speaker,0
the lover who was official anointed the focused and odd exile,0
the englishman who was critical elected the irish and slim speaker,0
the parisians who was unsuccessful bathed the fresh and unconscious sergeants,1
the defendants who was critical immersed the criminal and official martyr,0
the scribes who was impossible uncovered the immense and frozen defendant,0
the  islamists who was frustrated served the uncomfortable and unconscious boxer,0
the defendants who was noble dragged the uncredited and uncertainty boxer,0
the sergeant who was free saw the useful and unnecessary speaker,0
the spouse who was unnecessary taxed the criminal and frozen vocalists,1
the writers who was organization envied the federal and future merchant,0
the parisian who was funny fined the imperial and uncertainty loyalist,0
the warlocks who was older decorated the iconic and smallest hero,0
the programmer who was female dubbed the unsuccessful and important lovers,1
the martyrs who was imperial dirtied the icy and negative englishmen,1
the lecturers who was frozen found the imprisoned and useful heroes,1
the writer who was iconic kicked the fourth and outstanding rulers,1
the writer who was noble anointed the frozen and immense fiance,0
the fishermen who was scientific saw the smaller and useful parisian,0
the fiance who was foul charged the useful and new islamist,0
the lovers who was unsuccessful fined the impressive and ukrainian barbarians,1
the writer who was swiss cut the frustrated and odd barbarians,1
the scribes who was slick begrudged the oldest and scary programmers,1
the sucker who was fourth rubbed the overwhelmed and feminine barbarian,0
the speaker who was notorious anointed the nuclear and impressive hero,0
the husbands who was official refused the slight and uncertainty sergeants,1
the martyr who was critical fed the swift and future warlock,0
the spouse who was initial liked the frozen and swift englishmen,1
the hero who was imprisoned singed the unique and slick technician,0
the spectators who was irish watched the future and friendly  islamists,1
the programmer who was improved deluged the immense and frustrated sucker,0
the writers who was small contaminated the imperial and organized programmer,0
the engineer who was unsuccessful blanketed the scottish and irish defendants,1
the ruler who was clinical uncovered the friendly and official girlfriend,0
the vocalists who was uncertain fancied the uncredited and outstanding speakers,1
the technicians who was free tainted the ugly and scared programmer,0
the warlocks who was ugly decorated the scots and chief speaker,0
the scribe who was immense fed the federal and organization husband,0
the merchant who was free drenched the uncomfortable and organization scribe,0
the sergeant who was old moved the universal and important enthusiast,0
the merchants who was useless rubbed the fun and initial violinists,1
the engineer who was usual ate the slight and initial merchant,0
the violinists who was notorious perceived the negative and frustrated violinist,0
the emperors who was slim understood the usual and universal grader,0
the martyr who was free restored the notorious and uncomfortable  islamists,1
the grader who was important loved the swift and unexpected enthusiasts,1
the spouse who was old pushed the unnamed and unique president,0
the violinist who was impressive injected the offensive and odd girlfriends,1
the sergeant who was folk taxed the unnecessary and free mariners,1
the husbands who was folk envied the scottish and ordinary mariner,0
the emperors who was slim splashed the outstanding and frozen sergeants,1
the loyalist who was iconic restored the slim and ordinary homosexual,0
the speaker who was old charged the notorious and unhappy hero,0
the mariners who was impossible taxed the icy and imperial hero,0
the fishermen who was frozen spared the ugly and imprisoned scribe,0
the homosexuals who was uncredited revealed the impressive and scottish sucker,0
the programmer who was friendly fed the fourth and unhappy shrinks,1
the programmer who was frozen fined the uncertain and foul lecturer,0
the hero who was new injected the fourth and scottish technician,0
the lecturers who was scots told the orthodox and useful homosexuals,1
the violinist who was unexpected bound the uncomfortable and scots islamist,0
the ruler who was imperial masked the icy and swiss grader,0
the girlfriend who was unhappy blanketed the friendly and foul presidents,1
the rabbis who was offensive hated the orthodox and unnamed merchant,0
the ruler who was criminal devoured the fourth and folk programmers,1
the husband who was immortal saved the overwhelmed and slight president,0
the violinists who was friendly anointed the iconic and focused writer,0
the fiances who was frustrated bathed the useless and universal islamist,0
the mariner who was unexpected dubbed the universal and critical emperor,0
the shrinks who was important forgave the iconic and criminal programmers,1
the rabbis who was free immersed the uncertainty and swiss sucker,0
the ruler who was outstanding tainted the slick and slim fisherman,0
the spectators who was scary bathed the focused and unique sergeants,1
the islamist who was slight smothered the scientific and criminal enthusiast,0
the loyalists who was future anointed the irish and federal writers,1
the fiance who was overwhelmed fed the scientific and nuclear husband,0
the lovers who was useful immersed the immense and uncertainty loyalists,1
the loyalists who was slim taught the unnecessary and useful barbarians,1
the technician who was ukrainian considered the fresh and friendly warlock,0
the barbarian who was fun understood the universal and offensive lecturer,0
the warlock who was overwhelmed named the fourth and ukrainian spectators,1
the barbarians who was official moved the slim and foul lecturer,0
the ruler who was oldest masked the smaller and funny spouses,1
the writer who was universal admired the oldest and uncomfortable rulers,1
the ruler who was iconic exposed the uncertain and odd merchants,1
the governors who was feminine liked the scared and new hero,0
the scribe who was scientific refused the nuclear and impressive warlocks,1
the programmer who was clinical tainted the swiss and official spouse,0
the barbarian who was ukrainian contaminated the notorious and frustrated enthusiasts,1
the rabbi who was universal drenched the chief and orthodox homosexual,0
the emperors who was smaller singed the irish and organized boxer,0
the lover who was unexpected smothered the swiss and organization spectator,0
the shrinks who was scientific refused the impossible and smaller speaker,0
the boxers who was female dubbed the older and future emperors,1
the technicians who was frozen choked the critical and scary rulers,1
the violinists who was impossible named the critical and frustrated barbarian,0
the rulers who was frustrated judged the odd and scared programmers,1
the defendants who was friendly exposed the unexpected and imprisoned englishmen,1
the heroes who was uncertainty contaminated the foul and improved girlfriends,1
the bartender who was usual singed the organized and clinical homosexual,0
the shrink who was focused addressed the uncertain and new rabbi,0
the enthusiast who was free admired the folk and organized rabbi,0
the girlfriend who was chinese revealed the outstanding and ugly technician,0
the scribes who was usual addressed the criminal and funny writers,1
the boxers who was outstanding moved the swiss and fourth programmers,1
the enthusiast who was impossible smothered the overwhelmed and folk warlock,0
the merchants who was slim told the scary and uncredited lecturer,0
the husband who was chinese tainted the uncertain and scots programmer,0
the warlocks who was uncertain forgave the ugly and impressive hero,0
the boxer who was fourth liked the orthodox and iconic warlock,0
the violinist who was swiss bandaged the useless and ukrainian girlfriend,0
the spectators who was scared cleaned the scots and oldest violinist,0
the emperors who was free saved the imprisoned and scientific president,0
the scribe who was official charged the orthodox and criminal defendants,1
the merchants who was unhappy told the overwhelmed and fourth president,0
the homosexuals who was frozen mailed the criminal and friendly presidents,1
the warlock who was free envied the offensive and ordinary parisians,1
the governors who was universal addressed the outstanding and new warlock,0
the homosexual who was important mentioned the ordinary and friendly writers,1
the programmer who was unnecessary smothered the icy and free exiles,1
the hero who was immense splashed the funny and orthodox islamist,0
the spectators who was smaller charged the older and noble vocalists,1
the spectators who was foul choked the uncredited and immortal vocalists,1
the emperor who was female addressed the unconscious and feminine shrinks,1
the suckers who was usual devoured the foul and unnamed spectator,0
the mariners who was immense envied the outstanding and future writer,0
the husband who was imperial injected the unnamed and overwhelmed vocalist,0
the technician who was unnecessary bound the useful and unnamed heroes,1
the bartender who was foul mentioned the future and outstanding grader,0
the sergeant who was imprisoned bound the folk and official mariner,0
the  islamists who was criminal lifted the unhappy and unique writers,1
the warlock who was fresh bandaged the orthodox and icy rulers,1
the technicians who was irish concealed the unhappy and initial englishmen,1
the parisians who was foul taught the nuclear and negative governors,1
the englishman who was unsuccessful suggested the smart and unexpected engineer,0
the sergeants who was frozen contaminated the clinical and unnecessary grader,0
the violinist who was fourth pushed the critical and small fishermen,1
the shrinks who was small decorated the slick and ugly loyalists,1
the graders who was fun dragged the unnecessary and scared loyalist,0
the emperors who was scientific understood the feminine and notorious violinist,0
the spectator who was improved charged the uncertain and slim barbarians,1
the emperor who was ukrainian washed the unexpected and offensive exile,0
the vocalists who was organized moved the noble and unsuccessful rabbis,1
the spectator who was critical envied the noble and unnecessary suckers,1
the  islamists who was swift dirtied the ugly and frustrated violinist,0
the heroes who was iconic lifted the female and uncredited hero,0
the programmers who was small bandaged the future and overwhelmed presidents,1
the ruler who was oldest mentioned the uncredited and scots shrinks,1
the fisherman who was free burned the noble and unconscious lovers,1
the hero who was irish stained the negative and uncertain merchant,0
the homosexual who was oldest exposed the clinical and orthodox shrinks,1
the enthusiasts who was offensive saved the folk and fun shrink,0
the violinist who was ukrainian forgave the universal and noble programmer,0
the lecturers who was negative liked the federal and noble hero,0
the emperor who was scottish dragged the critical and immense rulers,1
the barbarians who was clinical washed the unsuccessful and federal speakers,1
the merchant who was chinese fancied the impossible and feminine scribe,0
the barbarians who was slick told the scottish and federal sergeant,0
the merchants who was unnamed watched the noble and important husband,0
the martyrs who was outstanding pushed the nuclear and federal merchant,0
the writers who was ukrainian named the smart and unsuccessful ruler,0
the hero who was foul blanketed the slick and old warlock,0
the programmers who was odd devoured the icy and unhappy  islamists,1
the martyr who was unnamed anointed the universal and criminal heroes,1
the parisian who was new injected the odd and small writer,0
the homosexuals who was important lifted the unnecessary and frozen writer,0
the homosexual who was oldest loved the ugly and useful barbarians,1
the sucker who was small sliced the iconic and oldest parisians,1
the engineer who was noble moved the impressive and official writer,0
the shrink who was unhappy immersed the free and organized husbands,1
the englishmen who was irish admired the initial and female scribes,1
the loyalist who was fresh named the initial and chinese enthusiast,0
the speakers who was scared sliced the immense and notorious spectators,1
the sergeants who was critical spared the scared and scientific sucker,0
the boxers who was smallest mentioned the scots and scary warlock,0
the warlock who was usual singed the scary and orthodox martyrs,1
the husbands who was smaller moved the overwhelmed and future homosexual,0
the spouses who was outstanding immersed the chinese and offensive barbarian,0
the bartender who was foul admired the folk and iconic warlocks,1
the emperor who was focused devoured the uncertainty and feminine fishermen,1
the mariner who was new ate the icy and impossible scribes,1
the writer who was important stained the scientific and noble boxers,1
the islamist who was oldest liked the clinical and ukrainian sucker,0
the heroes who was focused tainted the unconscious and smaller husbands,1
the barbarians who was swiss revealed the funny and old enthusiast,0
the hero who was new singed the chinese and oldest homosexuals,1
the speakers who was focused dubbed the icy and noble husband,0
the lecturers who was foul begrudged the slight and chinese lecturer,0
the defendants who was organization fined the usual and feminine lecturers,1
the sucker who was swiss carried the folk and outstanding speakers,1
the boxer who was fourth dirtied the friendly and uncertain sucker,0
the spectator who was free fined the immense and important loyalists,1
the sergeant who was initial burned the important and improved fisherman,0
the lovers who was fun understood the ugly and useless fishermen,1
the governors who was organization labeled the unique and feminine husband,0
the exiles who was initial uncovered the free and organized scribe,0
the homosexuals who was federal carpeted the ukrainian and improved rabbi,0
the heroes who was initial showed the slick and foul vocalist,0
the engineers who was usual kicked the uncertain and oldest governor,0
the girlfriends who was slim watched the uncomfortable and imperial fiance,0
the violinists who was smart labeled the focused and nuclear ruler,0
the homosexual who was orthodox saved the slick and oldest sergeants,1
the barbarian who was unconscious twirled the uncredited and unnamed spectators,1
the scribe who was useless suggested the universal and official lovers,1
the suckers who was funny dubbed the critical and swift sergeants,1
the girlfriend who was federal told the outstanding and smart boxers,1
the loyalists who was smallest pushed the universal and impressive defendant,0
the scribes who was immortal kicked the offensive and future writers,1
the sucker who was older named the impossible and swiss mariner,0
the heroes who was free blanketed the folk and unhappy merchant,0
the defendants who was unexpected mailed the organization and unnecessary exiles,1
the writers who was chinese blanketed the orthodox and iconic programmer,0
the heroes who was unsuccessful smothered the unnecessary and chief barbarian,0
the suckers who was organized taught the immense and new engineer,0
the mariners who was imperial told the funny and small suckers,1
the homosexual who was negative choked the swiss and critical programmer,0
the lecturer who was free choked the universal and smart lecturers,1
the suckers who was free cut the smart and organized shrinks,1
the loyalists who was ugly elected the slick and organized parisians,1
the enthusiast who was uncertain named the older and federal parisians,1
the defendant who was nuclear drenched the swift and ukrainian speakers,1
the hero who was scientific admired the ordinary and odd spectators,1
the technician who was usual exposed the chinese and uncomfortable grader,0
the merchant who was future lifted the scientific and smart girlfriend,0
the barbarian who was unsuccessful injected the iconic and female merchant,0
the fiance who was scared choked the irish and fourth parisian,0
the mariners who was focused bound the outstanding and frustrated sucker,0
the fisherman who was free cut the unnecessary and imprisoned programmers,1
the lecturers who was fresh dubbed the oldest and outstanding sergeants,1
the warlock who was small twirled the future and outstanding defendants,1
the girlfriends who was improved forgave the frustrated and uncredited barbarians,1
the girlfriend who was smallest revealed the friendly and feminine warlocks,1
the boxers who was fun found the fresh and female heroes,1
the girlfriend who was unnecessary smothered the critical and unique girlfriends,1
the husbands who was friendly cleaned the folk and unconscious violinists,1
the spouse who was useful charged the imperial and notorious loyalist,0
the mariner who was foul considered the slick and immense parisians,1
the sucker who was ordinary lifted the fourth and useless boxer,0
the girlfriends who was orthodox bound the small and usual defendant,0
the shrink who was smart stained the feminine and focused parisians,1
the spectator who was frustrated begrudged the offensive and uncertain boxers,1
the  islamists who was unique promised the immortal and uncertain barbarian,0
the writer who was imprisoned saw the female and chinese lovers,1
the vocalists who was chinese dragged the scared and slight sergeants,1
the rabbi who was immortal considered the female and slim rulers,1
the fisherman who was foul liked the nuclear and old president,0
the islamist who was overwhelmed decorated the unnecessary and iconic parisians,1
the speakers who was slick sliced the unhappy and chinese scribe,0
the barbarians who was fresh bandaged the scary and friendly programmer,0
the husband who was swift lifted the chinese and fresh exile,0
the violinist who was focused scorched the useful and organization emperors,1
the homosexual who was clinical dirtied the overwhelmed and odd warlocks,1
the parisians who was iconic loved the unnamed and improved barbarians,1
the shrink who was critical smothered the new and overwhelmed rabbi,0
the governors who was critical spared the iconic and uncertain martyrs,1
the violinists who was uncomfortable mentioned the older and criminal enthusiast,0
the lecturer who was notorious revealed the overwhelmed and funny heroes,1
the sucker who was scottish taxed the icy and negative rabbis,1
the lecturer who was scared dragged the scots and fun warlock,0
the violinist who was usual taxed the scientific and important mariners,1
the grader who was unhappy appointed the unnamed and fourth speaker,0
the presidents who was unexpected injected the friendly and impossible fiances,1
the suckers who was oldest tipped the fun and unconscious graders,1
the fiance who was future uncovered the fourth and slight speakers,1
the writers who was unsuccessful named the icy and new speaker,0
the fisherman who was offensive loved the universal and impressive spouses,1
the parisians who was old carpeted the official and notorious writers,1
the heroes who was imprisoned bandaged the fourth and uncomfortable martyr,0
the boxer who was uncertain tipped the clinical and unhappy programmers,1
the rabbi who was fun anointed the nuclear and official vocalist,0
the mariners who was scottish named the small and female husbands,1
the spectators who was immortal found the imprisoned and notorious defendant,0
the merchants who was useful watched the orthodox and odd writer,0
the exile who was slick saw the odd and scientific president,0
the engineers who was fun loved the odd and initial sergeant,0
the husbands who was fresh cut the slim and scared violinist,0
the rabbis who was foul loved the uncertainty and ukrainian fishermen,1
the violinist who was unsuccessful masked the overwhelmed and fun parisian,0
the engineers who was immortal restored the impossible and usual violinist,0
the girlfriend who was odd carpeted the fourth and unconscious fiance,0
the hero who was smaller washed the nuclear and useful exile,0
the writer who was slight injected the slim and negative ruler,0
the fishermen who was unnamed uncovered the imperial and useful enthusiast,0
the warlock who was irish rubbed the iconic and initial exile,0
the defendant who was small concealed the unconscious and scared sergeant,0
