the lovers who was feminine burned the uncertain and improved shrink,0
the presidents who was fresh deluged the old and initial hero,0
the sergeant who was official sliced the slim and impressive mariners,1
the enthusiasts who was new addressed the iconic and smaller technician,0
the shrinks who was feminine masked the chinese and unhappy parisian,0
the warlock who was improved charged the nuclear and swift exile,0
the mariners who was organized anointed the offensive and negative fiance,0
the warlocks who was fresh devoured the uncertainty and fourth enthusiasts,1
the martyr who was unexpected injected the slight and foul barbarians,1
the boxer who was new decorated the chief and unnecessary scribe,0
the spouses who was frustrated appointed the improved and organized englishman,0
the technician who was imprisoned cleaned the older and overwhelmed violinist,0
the barbarian who was oldest dubbed the frustrated and uncertain merchant,0
the shrinks who was noble carpeted the fresh and clinical grader,0
the warlock who was notorious burned the outstanding and irish governors,1
the enthusiast who was swift dragged the uncertain and funny rabbis,1
the boxers who was smallest admired the immortal and ugly technicians,1
the spectator who was swiss splashed the female and scottish parisians,1
the barbarians who was uncredited bound the important and nuclear girlfriend,0
the graders who was immense appointed the universal and scary speakers,1
the homosexuals who was uncertainty decorated the slick and irish governor,0
the violinist who was organization cut the outstanding and frozen speaker,0
the spectators who was initial told the icy and scary graders,1
the boxers who was unhappy mentioned the female and fourth fishermen,1
the spectator who was uncertainty stained the overwhelmed and immortal graders,1
the fishermen who was slight smothered the iconic and new hero,0
the lovers who was nuclear charged the imperial and unique shrinks,1
the exiles who was outstanding tipped the ugly and organization fisherman,0
the sergeants who was uncomfortable exposed the universal and odd heroes,1
the technician who was overwhelmed concealed the funny and smaller girlfriend,0
the technician who was criminal spared the scared and smart martyrs,1
the lovers who was immense ate the smaller and slick exile,0
the grader who was important saw the smallest and scared homosexuals,1
the merchants who was unnamed mentioned the unhappy and uncomfortable defendants,1
the lecturers who was scientific addressed the iconic and small scribe,0
the homosexual who was uncredited restored the icy and criminal merchant,0
the governor who was focused considered the uncredited and criminal technicians,1
the defendants who was new served the federal and critical homosexual,0
the enthusiast who was fun showed the old and scots presidents,1
the warlock who was important moved the folk and female enthusiasts,1
the technician who was oldest splashed the smallest and offensive englishman,0
the warlocks who was critical washed the organization and clinical barbarians,1
the governors who was imprisoned smothered the outstanding and noble loyalists,1
the boxers who was smaller appointed the universal and chief lovers,1
the enthusiasts who was uncertain found the focused and swift scribe,0
the englishman who was outstanding deluged the offensive and scottish governors,1
the barbarian who was useless injected the outstanding and slight homosexuals,1
the islamist who was fun mailed the imperial and slight girlfriend,0
the programmer who was smart deluged the scary and usual mariners,1
the rulers who was ugly begrudged the old and negative warlocks,1
the technicians who was unnecessary considered the frustrated and federal loyalists,1
the vocalists who was overwhelmed tainted the focused and chief scribes,1
the governors who was orthodox promised the frustrated and universal engineer,0
the president who was useful glimpsed the fourth and unnamed grader,0
the barbarian who was fun kicked the fresh and iconic rabbis,1
the technician who was scared promised the ordinary and immortal merchants,1
the speaker who was scientific promised the future and organized defendants,1
the boxers who was focused dubbed the chinese and icy programmer,0
the writer who was important pushed the nuclear and oldest exile,0
the spouses who was unconscious taught the slight and unhappy enthusiasts,1
the mariners who was offensive blanketed the uncredited and future graders,1
the grader who was free exposed the frozen and female merchants,1
the exiles who was small dirtied the noble and frozen shrinks,1
the  islamists who was impossible uncovered the unnamed and chinese enthusiasts,1
the merchants who was scared served the scary and universal loyalist,0
the mariners who was focused glimpsed the negative and uncomfortable violinists,1
the bartender who was important addressed the criminal and immortal enthusiasts,1
the homosexual who was fresh mentioned the odd and slight programmers,1
the shrinks who was irish ate the organization and unconscious boxer,0
the emperor who was unconscious kicked the immense and unhappy scribes,1
the emperor who was organization deluged the icy and federal enthusiasts,1
the sergeants who was scots glimpsed the outstanding and irish lovers,1
the violinists who was uncredited burned the older and improved husband,0
the governor who was unique cut the odd and initial exile,0
the rabbis who was icy taxed the foul and fun governor,0
the scribes who was chinese kicked the smallest and fresh martyrs,1
the rabbis who was notorious ate the uncomfortable and frozen mariners,1
the shrink who was offensive cut the scots and organization engineers,1
the warlocks who was old bandaged the nuclear and overwhelmed mariners,1
the fishermen who was useful charged the oldest and swiss  islamists,1
the loyalist who was notorious dragged the smaller and odd spectator,0
the emperor who was frustrated tainted the overwhelmed and federal boxers,1
the engineers who was ugly lifted the folk and unnamed governors,1
the programmer who was scots contaminated the universal and uncertainty englishmen,1
the spouse who was useless dubbed the folk and swift speaker,0
the lover who was noble dubbed the slight and unconscious warlocks,1
the scribe who was foul burned the scared and immense englishmen,1
the president who was criminal bandaged the slim and uncertain merchant,0
the exile who was icy bandaged the swift and uncredited presidents,1
the mariners who was older kicked the funny and swift girlfriend,0
the barbarians who was unexpected blanketed the odd and unnecessary rabbis,1
the programmers who was scared appointed the unconscious and unnamed technician,0
the sergeants who was critical deluged the chief and frozen heroes,1
the englishmen who was chief singed the uncertain and old fisherman,0
the englishman who was negative glimpsed the noble and small lover,0
the boxers who was frustrated pushed the ordinary and oldest scribes,1
the writer who was official taxed the scots and scottish loyalists,1
the lecturer who was clinical anointed the smart and oldest homosexual,0
the merchant who was focused refused the clinical and imprisoned merchants,1
the bartender who was iconic exposed the unsuccessful and criminal mariners,1
the englishmen who was nuclear served the irish and universal spouses,1
the lovers who was imprisoned judged the federal and slim englishman,0
the warlocks who was initial begrudged the impossible and scientific enthusiast,0
the martyr who was free watched the smallest and notorious enthusiasts,1
the mariner who was nuclear perceived the odd and ukrainian barbarian,0
the exile who was unexpected splashed the frustrated and nuclear technicians,1
the fiance who was universal begrudged the slim and swiss rulers,1
the ruler who was organization choked the old and fun parisian,0
the englishmen who was chinese uncovered the uncertain and important rabbis,1
the warlocks who was fresh rubbed the slick and irish suckers,1
the sucker who was unexpected stained the critical and scottish writers,1
the martyrs who was critical scorched the initial and fourth heroes,1
the writer who was organization immersed the future and frustrated boxers,1
the spouse who was imperial hated the uncertain and smallest defendant,0
the mariners who was folk moved the scots and old grader,0
the fiance who was useful dragged the iconic and immense englishman,0
the engineers who was impossible hated the smaller and old lover,0
the parisians who was slim tainted the irish and clinical speakers,1
the spectator who was icy cut the friendly and unconscious spectators,1
the mariners who was initial mentioned the friendly and unexpected emperors,1
the scribe who was uncertainty dubbed the useless and swift writers,1
the homosexuals who was scottish dubbed the imperial and organized violinists,1
the warlocks who was old carpeted the unexpected and frustrated martyr,0
the parisian who was impressive immersed the nuclear and uncredited loyalists,1
the girlfriend who was ugly devoured the focused and uncredited englishmen,1
the sergeants who was slight tipped the overwhelmed and frozen englishman,0
the heroes who was older bound the fresh and uncertainty englishmen,1
the defendant who was uncertain fed the focused and future hero,0
the islamist who was irish pushed the impressive and orthodox  islamists,1
the emperor who was female considered the scientific and iconic technician,0
the mariner who was imperial decorated the improved and small shrinks,1
the sucker who was offensive saved the useless and free fiance,0
the vocalist who was uncertain found the scots and impressive programmer,0
the speaker who was useful twirled the unique and federal warlock,0
the programmer who was unnecessary bound the focused and future fisherman,0
the barbarian who was negative watched the useless and ordinary  islamists,1
the lovers who was smallest labeled the overwhelmed and notorious shrink,0
the vocalist who was ukrainian sliced the organized and funny merchants,1
the technicians who was slim saved the scientific and ugly vocalist,0
the boxer who was critical bandaged the ordinary and odd warlocks,1
the fiance who was oldest loved the funny and nuclear martyr,0
the martyrs who was organization charged the uncertainty and smallest exiles,1
the fishermen who was slight fed the irish and immense sucker,0
the spectator who was unnecessary begrudged the imprisoned and overwhelmed hero,0
the suckers who was ugly washed the odd and ukrainian scribes,1
the speaker who was free smothered the useless and fresh merchant,0
the president who was future concealed the impossible and improved barbarians,1
the sergeant who was uncertainty lifted the important and improved heroes,1
the shrinks who was fun tipped the impossible and new sergeant,0
the rulers who was universal named the organization and unsuccessful merchants,1
the parisians who was critical singed the female and negative spouses,1
the fishermen who was impossible devoured the scary and useful rabbis,1
the governor who was federal cut the uncredited and notorious parisians,1
the engineers who was female glimpsed the new and useful loyalist,0
the sucker who was official cleaned the odd and negative lover,0
the governor who was ukrainian judged the swift and oldest programmers,1
the heroes who was older doused the unique and improved englishmen,1
the rabbis who was offensive named the uncomfortable and slight mariners,1
the engineer who was offensive liked the scared and friendly technicians,1
the warlocks who was official fined the chinese and swift sergeant,0
the heroes who was funny named the ukrainian and uncertain programmers,1
the mariners who was nuclear stained the folk and irish grader,0
the exiles who was critical singed the smart and scottish mariners,1
the fiances who was outstanding taught the federal and folk scribe,0
the barbarian who was unexpected uncovered the icy and notorious enthusiasts,1
the writer who was scientific taxed the organized and female merchants,1
the engineer who was uncertain uncovered the frustrated and swiss suckers,1
the suckers who was ukrainian lifted the swift and immortal fiances,1
the girlfriend who was folk taxed the swiss and noble barbarian,0
the rabbis who was important told the unconscious and future fisherman,0
the heroes who was smaller stained the icy and useful husband,0
the martyrs who was feminine cleaned the orthodox and unsuccessful mariner,0
the exile who was ugly restored the nuclear and organized vocalist,0
the exiles who was smart blanketed the outstanding and irish suckers,1
the lecturer who was icy glimpsed the immense and organization fishermen,1
the sergeant who was useful admired the scots and criminal heroes,1
the shrinks who was scary appointed the immortal and swiss sergeant,0
the barbarians who was critical fancied the ukrainian and fresh defendants,1
the lover who was slim mentioned the swift and unique rulers,1
the husband who was immortal concealed the odd and federal grader,0
the shrinks who was oldest hated the slick and uncomfortable scribe,0
the merchants who was impossible showed the swiss and funny violinist,0
the girlfriends who was fresh loved the initial and oldest writers,1
the rulers who was scary cleaned the criminal and clinical martyrs,1
the shrink who was organization injected the swift and scientific englishmen,1
the merchant who was scientific appointed the swiss and frustrated spouse,0
the shrink who was frozen mentioned the scary and iconic warlock,0
the merchant who was unnecessary addressed the uncredited and scary programmer,0
the defendants who was important devoured the uncertain and critical spouses,1
the mariners who was improved cleaned the uncredited and swift barbarian,0
the speaker who was immense labeled the official and frozen hero,0
the mariners who was unhappy tipped the free and usual homosexuals,1
the speaker who was foul cut the offensive and useful fishermen,1
the rabbi who was unique saved the swift and notorious martyrs,1
the fiances who was overwhelmed stained the chief and oldest martyrs,1
the husbands who was noble contaminated the foul and future exile,0
the writers who was uncertain carpeted the smallest and feminine violinists,1
the engineers who was smart spared the funny and ugly husbands,1
the president who was useless lifted the outstanding and notorious emperors,1
the enthusiast who was slim dragged the ordinary and orthodox governors,1
the technicians who was impossible cleaned the slight and irish scribe,0
the spouse who was unexpected tainted the smart and iconic writer,0
the parisian who was negative dirtied the chinese and unexpected mariner,0
the speakers who was focused carpeted the swiss and organized mariners,1
the vocalist who was swift twirled the ordinary and oldest englishman,0
the spectators who was uncomfortable lifted the scary and female programmer,0
the bartender who was uncredited addressed the folk and fourth sergeant,0
the bartender who was useless drenched the future and scared speaker,0
the sergeants who was organization mentioned the fourth and offensive grader,0
the suckers who was impressive smothered the notorious and female homosexuals,1
the enthusiast who was ukrainian taxed the smallest and imprisoned warlocks,1
the programmers who was improved hated the scots and female suckers,1
the violinists who was scots begrudged the overwhelmed and usual bartender,0
the englishman who was critical showed the orthodox and organized programmers,1
the rabbis who was notorious tainted the future and imprisoned writer,0
the writers who was federal admired the unhappy and slight barbarian,0
the boxers who was usual burned the funny and focused spouse,0
the parisian who was unnecessary blanketed the unsuccessful and scientific loyalist,0
the homosexual who was smaller liked the chinese and uncertain defendant,0
the islamist who was immense saw the unsuccessful and nuclear emperors,1
the sucker who was feminine mentioned the unique and noble parisian,0
the homosexual who was critical cut the unsuccessful and scientific mariners,1
the defendant who was unexpected moved the focused and ukrainian programmer,0
the suckers who was slight watched the odd and iconic warlock,0
the spouses who was useless taxed the organization and useful sergeant,0
the hero who was uncredited concealed the irish and chinese lecturers,1
the spectators who was critical sliced the offensive and fresh boxers,1
the technician who was uncertainty restored the iconic and slight spouse,0
the engineer who was slim doused the female and organized suckers,1
the engineers who was smart choked the chief and chinese enthusiasts,1
the speakers who was fresh fed the uncomfortable and official martyr,0
the rabbi who was unique revealed the oldest and irish spectator,0
the emperor who was negative addressed the offensive and orthodox violinist,0
the presidents who was old served the impossible and future president,0
the programmer who was uncertainty blanketed the scary and useful writer,0
the husbands who was offensive blanketed the slick and smaller scribe,0
the sergeants who was initial admired the slight and frustrated enthusiasts,1
the exiles who was official begrudged the imprisoned and unsuccessful grader,0
the heroes who was unconscious taught the uncertain and impressive programmers,1
the sergeants who was small labeled the fourth and scientific scribe,0
the lecturers who was orthodox charged the organization and scottish violinists,1
the husband who was uncomfortable drenched the smaller and focused mariner,0
the sergeants who was scared suggested the unconscious and impossible grader,0
the mariner who was universal served the unique and offensive spouse,0
the husbands who was smaller immersed the critical and slick rabbi,0
the merchant who was immortal choked the free and official englishmen,1
the technician who was outstanding burned the uncertain and imperial merchants,1
the governor who was folk restored the immense and imprisoned fishermen,1
the writers who was improved twirled the orthodox and unnecessary technicians,1
the technician who was scots envied the unexpected and new grader,0
the emperor who was usual singed the unexpected and frozen exile,0
the boxers who was ordinary contaminated the old and ugly warlocks,1
the martyrs who was unsuccessful cleaned the unexpected and swiss vocalists,1
the rulers who was improved elected the criminal and older martyr,0
the spouse who was nuclear pushed the ukrainian and oldest graders,1
the warlock who was folk showed the outstanding and improved engineer,0
the fiances who was notorious taught the ukrainian and new fiance,0
the programmers who was iconic considered the icy and unique barbarian,0
the merchant who was focused promised the unnamed and unconscious martyr,0
the speakers who was important drenched the slight and unsuccessful englishmen,1
the enthusiasts who was impossible fancied the unnamed and useful parisian,0
the exiles who was offensive showed the initial and fourth scribe,0
the  islamists who was impossible immersed the feminine and organization shrink,0
the fiance who was unhappy spared the folk and negative writer,0
the sergeants who was slight envied the ukrainian and important writer,0
the emperors who was smart promised the chief and immortal parisians,1
the engineers who was fresh suggested the icy and funny graders,1
the loyalist who was uncomfortable concealed the scary and federal homosexual,0
the spectator who was outstanding lifted the fourth and usual president,0
the writers who was focused carpeted the organized and chinese graders,1
the fishermen who was critical charged the odd and notorious fiances,1
the violinists who was new forgave the criminal and useless merchant,0
the fiance who was important fined the scary and slight spouse,0
the suckers who was odd forgave the unnamed and future spectator,0
the englishmen who was folk bathed the odd and unconscious martyrs,1
the rabbi who was fourth rubbed the immortal and smallest shrinks,1
the exile who was feminine considered the critical and swift writers,1
the governors who was free saved the ordinary and scots rabbi,0
the hero who was icy sliced the federal and impressive spouses,1
the girlfriend who was immense found the impossible and fresh engineer,0
the speaker who was odd pushed the oldest and ugly suckers,1
the president who was uncertainty deluged the irish and universal barbarian,0
the scribe who was oldest dirtied the smaller and chief sergeant,0
the ruler who was uncertain scorched the improved and oldest lecturer,0
the merchant who was imprisoned labeled the fun and orthodox lover,0
the barbarians who was focused hated the folk and female merchants,1
the sucker who was new told the feminine and unhappy mariner,0
the spectators who was female uncovered the scottish and uncomfortable boxer,0
the emperors who was overwhelmed stained the new and uncertainty spectators,1
the warlocks who was smallest stained the imprisoned and scots parisians,1
the loyalist who was outstanding loved the older and slim warlock,0
the spectator who was important charged the immense and chief sergeant,0
the suckers who was useless smothered the immortal and important speaker,0
the hero who was focused watched the overwhelmed and useful scribe,0
the rulers who was uncomfortable addressed the feminine and smallest homosexuals,1
the programmers who was future begrudged the iconic and scared exile,0
the writer who was organization choked the noble and friendly fishermen,1
the rabbi who was fresh ate the chinese and nuclear engineers,1
the exile who was orthodox considered the odd and notorious barbarians,1
the scribe who was female appointed the chief and smart president,0
the presidents who was scientific mailed the slick and small emperor,0
the girlfriend who was irish dragged the negative and new defendants,1
the programmers who was ukrainian injected the unnamed and icy fisherman,0
the lecturers who was nuclear masked the small and immortal writer,0
the girlfriend who was focused refused the scared and initial programmer,0
the defendants who was iconic showed the unconscious and friendly president,0
the hero who was smaller restored the uncomfortable and criminal violinist,0
the exile who was friendly promised the fourth and overwhelmed husband,0
the engineers who was unexpected immersed the icy and scottish speaker,0
the vocalists who was fourth carpeted the oldest and unhappy governors,1
the heroes who was new showed the slick and scientific merchant,0
the engineer who was clinical anointed the swiss and small defendants,1
the scribe who was smallest doused the ugly and initial husbands,1
the heroes who was future immersed the fresh and swiss mariners,1
the merchants who was unnecessary injected the outstanding and notorious spouses,1
the engineers who was ordinary charged the scottish and fun englishmen,1
the fiances who was icy understood the unconscious and friendly heroes,1
the enthusiast who was negative stained the organization and orthodox grader,0
the warlock who was impressive cut the uncredited and unexpected mariner,0
the warlocks who was impressive addressed the useful and unexpected vocalist,0
the hero who was old begrudged the nuclear and funny engineers,1
the martyr who was oldest served the uncertain and fun sergeant,0
the programmers who was iconic immersed the funny and unnamed merchants,1
the rulers who was slick saved the slight and frozen sergeants,1
the englishmen who was chief washed the icy and orthodox islamist,0
the suckers who was female smothered the scots and future merchants,1
the emperor who was frustrated labeled the immense and clinical spouse,0
the programmers who was iconic dirtied the small and unnamed husband,0
the writers who was swiss washed the federal and iconic governors,1
the enthusiasts who was unique spared the critical and older fiances,1
the president who was focused liked the irish and icy rulers,1
the islamist who was fourth exposed the initial and uncomfortable parisians,1
the loyalist who was uncredited appointed the nuclear and critical defendant,0
the lecturer who was foul masked the nuclear and fun emperors,1
the writer who was negative injected the slick and clinical rabbi,0
the enthusiast who was smaller decorated the ukrainian and unnecessary spouses,1
the defendants who was smart pushed the fresh and outstanding rabbi,0
the sucker who was impossible rubbed the usual and unconscious girlfriend,0
the graders who was small rubbed the unsuccessful and orthodox heroes,1
the mariner who was old bandaged the unhappy and notorious spouse,0
the sucker who was friendly scorched the organization and official vocalist,0
the homosexuals who was important fed the oldest and uncredited  islamists,1
the husbands who was uncertain fancied the foul and new writer,0
the girlfriend who was impossible bathed the important and overwhelmed lover,0
the sergeants who was immortal cut the free and scary spouse,0
the heroes who was uncertainty saved the folk and universal lecturers,1
the enthusiast who was useful glimpsed the uncredited and oldest exile,0
the exiles who was friendly refused the frustrated and female enthusiasts,1
the homosexual who was chief decorated the unsuccessful and usual violinist,0
the girlfriends who was unconscious judged the nuclear and scientific sucker,0
the martyrs who was noble refused the fun and female violinists,1
the shrink who was important twirled the fun and unconscious enthusiast,0
the mariner who was improved devoured the useful and initial lecturer,0
the lover who was outstanding pushed the fresh and unique warlocks,1
