the emperors who was impossible forgave the useless and negative rulers,1
the governor who was ukrainian forgave the chief and organized barbarian,0
the warlocks who was unsuccessful fined the offensive and scary spectators,1
the sergeants who was slick decorated the universal and future martyr,0
the englishmen who was old forgave the smallest and future parisians,1
the girlfriend who was unexpected labeled the unique and imprisoned merchants,1
the defendant who was clinical uncovered the frustrated and immortal vocalists,1
the engineer who was fourth devoured the smart and criminal islamist,0
the sergeant who was critical loved the older and unhappy sucker,0
the spectators who was older forgave the swift and imprisoned bartender,0
the scribes who was immense judged the overwhelmed and ordinary shrinks,1
the loyalists who was useful tainted the noble and scottish vocalists,1
the violinist who was notorious pushed the scary and outstanding technician,0
the islamist who was slim blanketed the frozen and impressive girlfriend,0
the technician who was swiss considered the scary and initial governors,1
the enthusiasts who was orthodox found the federal and iconic vocalist,0
the englishmen who was criminal saw the outstanding and nuclear writers,1
the girlfriends who was critical bandaged the unconscious and scots merchant,0
the merchant who was impossible carpeted the frozen and useless homosexuals,1
the exiles who was irish cut the slight and frustrated exile,0
the boxers who was uncredited deluged the overwhelmed and older fisherman,0
the shrink who was usual concealed the fun and offensive spectators,1
the exile who was focused watched the imprisoned and odd englishman,0
the boxer who was slick perceived the negative and odd scribe,0
the lovers who was iconic moved the unsuccessful and fresh sucker,0
the scribe who was useful liked the scary and offensive parisian,0
the homosexual who was overwhelmed carried the offensive and scientific fiance,0
the defendant who was universal promised the free and unexpected enthusiast,0
the martyrs who was chief mailed the odd and unconscious speaker,0
the mariners who was important taxed the funny and usual mariner,0
the warlock who was uncertainty saw the criminal and uncredited sergeants,1
the husband who was improved contaminated the smart and unhappy parisians,1
the lovers who was criminal mentioned the frustrated and nuclear martyrs,1
the warlocks who was ordinary judged the uncertain and slight barbarian,0
the fisherman who was uncredited ate the fun and scared fiances,1
the warlock who was uncertainty fancied the focused and unconscious vocalists,1
the violinist who was ordinary appointed the notorious and free husbands,1
the governor who was female watched the unnecessary and impressive girlfriend,0
the fisherman who was unnamed blanketed the criminal and chinese parisians,1
the spouses who was fun dragged the slight and chinese lover,0
the suckers who was uncertain named the smaller and usual fiance,0
the warlock who was offensive immersed the unique and smart husband,0
the hero who was slim found the impossible and imprisoned spectator,0
the enthusiast who was frustrated contaminated the female and organized mariners,1
the technicians who was old sliced the frozen and female defendants,1
the parisians who was ukrainian taxed the impossible and folk exile,0
the engineers who was icy splashed the uncredited and fun lecturer,0
the lecturer who was uncertainty taught the smallest and critical fisherman,0
the programmer who was scared contaminated the official and nuclear defendant,0
the sergeants who was notorious mentioned the scots and unsuccessful lecturer,0
the programmer who was fourth refused the scottish and outstanding heroes,1
the girlfriends who was chief mailed the smaller and chinese heroes,1
the technicians who was chief watched the impressive and unexpected shrink,0
the merchants who was uncredited promised the organized and female ruler,0
the writer who was impressive perceived the nuclear and scared boxer,0
the loyalist who was organized splashed the critical and ugly suckers,1
the rabbis who was older cleaned the outstanding and scots speaker,0
the ruler who was offensive smothered the new and critical lecturers,1
the emperor who was slight perceived the imperial and useful lecturers,1
the englishman who was organization smothered the older and useless rulers,1
the englishmen who was improved injected the organization and scots  islamists,1
the engineers who was scary begrudged the swift and new loyalist,0
the speaker who was funny dragged the fun and irish graders,1
the programmer who was unnamed understood the smart and outstanding violinist,0
the scribes who was clinical glimpsed the irish and uncomfortable mariners,1
the parisians who was uncredited cut the immortal and funny writers,1
the husband who was critical taught the outstanding and clinical governor,0
the programmer who was unnamed blanketed the scientific and uncredited grader,0
the exile who was friendly injected the noble and unnecessary sergeant,0
the lover who was focused moved the nuclear and female sergeant,0
the heroes who was initial charged the universal and immense englishman,0
the homosexuals who was frustrated found the ugly and outstanding graders,1
the martyrs who was ukrainian revealed the chief and scots emperor,0
the shrink who was universal fed the organized and swiss rabbi,0
the loyalists who was future deluged the important and slick merchants,1
the exiles who was critical sliced the old and overwhelmed sergeants,1
the scribes who was folk dubbed the frustrated and unconscious lover,0
the emperors who was imprisoned carried the unsuccessful and uncomfortable merchant,0
the graders who was smaller fancied the uncomfortable and old lover,0
the scribes who was older labeled the friendly and scottish spectator,0
the girlfriend who was scary rubbed the federal and imperial sergeants,1
the rulers who was ordinary revealed the imprisoned and older barbarian,0
the emperor who was organization appointed the federal and frozen loyalists,1
the exiles who was unsuccessful elected the frustrated and unhappy sergeant,0
the girlfriends who was offensive watched the feminine and new husband,0
the mariners who was fresh elected the odd and smaller martyr,0
the scribe who was slim choked the free and scottish hero,0
the spectator who was scared tainted the slick and official writer,0
the suckers who was orthodox concealed the clinical and ugly hero,0
the englishmen who was federal washed the imperial and oldest rulers,1
the spectator who was fresh taxed the funny and small lovers,1
the spectators who was ordinary showed the overwhelmed and orthodox parisian,0
the merchants who was scottish dragged the improved and useless exiles,1
the rabbis who was frustrated stained the outstanding and official grader,0
the ruler who was future blanketed the oldest and impossible suckers,1
the violinists who was organized forgave the initial and foul enthusiasts,1
the enthusiasts who was uncomfortable fined the smart and slight sergeant,0
the vocalists who was smaller concealed the uncredited and funny martyrs,1
the lecturer who was swift dragged the ukrainian and slight speakers,1
the governor who was important splashed the slim and critical rulers,1
the fishermen who was small envied the negative and fun rabbis,1
the  islamists who was frozen admired the swiss and iconic programmer,0
the sucker who was unconscious revealed the scared and imprisoned warlocks,1
the technicians who was scary promised the unsuccessful and uncertain heroes,1
the shrink who was iconic showed the impressive and offensive rabbis,1
the president who was scary tainted the foul and organized scribes,1
the enthusiast who was clinical refused the feminine and free warlock,0
the heroes who was old saved the scary and organized husbands,1
the shrinks who was overwhelmed bathed the unexpected and free homosexual,0
the rulers who was criminal revealed the smaller and federal lover,0
the rabbi who was organization suggested the slim and iconic merchants,1
the vocalist who was feminine refused the foul and swift spectators,1
the grader who was organized scorched the chief and unexpected islamist,0
the sergeant who was ukrainian showed the free and iconic husband,0
the englishman who was uncertainty dubbed the unsuccessful and outstanding scribes,1
the sucker who was old cut the iconic and smaller heroes,1
the violinist who was smaller twirled the imperial and scottish scribes,1
the englishmen who was critical restored the impressive and nuclear vocalists,1
the emperors who was irish moved the useless and scary hero,0
the spectator who was scottish rubbed the uncertain and impressive hero,0
the loyalist who was unexpected suggested the scared and focused writer,0
the president who was future doused the smaller and improved lovers,1
the girlfriends who was swift revealed the scary and female husband,0
the loyalist who was unexpected labeled the immortal and feminine mariner,0
the presidents who was overwhelmed tainted the immense and swift fiances,1
the vocalists who was uncomfortable sliced the smart and federal scribes,1
the martyrs who was outstanding exposed the friendly and smaller writers,1
the speakers who was uncertain saw the overwhelmed and ukrainian girlfriends,1
the fishermen who was swiss exposed the ukrainian and funny  islamists,1
the spectators who was iconic cleaned the ordinary and folk parisians,1
the scribes who was outstanding burned the nuclear and impossible exile,0
the islamist who was useful immersed the imperial and scientific husband,0
the mariners who was oldest spared the iconic and orthodox vocalists,1
the engineer who was ukrainian sliced the nuclear and organization loyalist,0
the grader who was irish rubbed the impressive and iconic spouses,1
the writers who was free admired the overwhelmed and scientific enthusiast,0
the sergeants who was important burned the negative and smart loyalist,0
the warlock who was useful understood the swiss and unexpected islamist,0
the parisians who was chinese deluged the immense and scary suckers,1
the sergeants who was friendly blanketed the scottish and imprisoned emperor,0
the fiance who was scottish carpeted the immense and chinese fishermen,1
the programmers who was unhappy restored the uncomfortable and frustrated president,0
the writers who was odd anointed the small and female fisherman,0
the engineers who was smallest showed the fresh and ugly speaker,0
the scribes who was smallest splashed the noble and critical programmers,1
the fishermen who was imprisoned liked the unnecessary and swift englishmen,1
the spectator who was swift cut the frozen and smaller martyrs,1
the ruler who was notorious decorated the federal and swift loyalist,0
the parisians who was impossible carpeted the orthodox and important emperor,0
the violinist who was unconscious cut the uncertain and older loyalist,0
the englishman who was slight scorched the slim and swiss rabbis,1
the martyrs who was organized promised the odd and folk mariners,1
the islamist who was outstanding lifted the notorious and offensive shrink,0
the sergeant who was future watched the irish and unique  islamists,1
the technicians who was immense deluged the orthodox and immortal fiance,0
the merchant who was swiss cleaned the ukrainian and scary suckers,1
the barbarian who was frustrated fined the unexpected and scientific suckers,1
the governor who was slick scorched the fourth and swiss martyrs,1
the lovers who was unnamed singed the uncomfortable and outstanding merchant,0
the  islamists who was critical kicked the oldest and improved engineers,1
the homosexuals who was slight suggested the uncertain and old parisian,0
the lovers who was smart tainted the unnecessary and useful parisians,1
the graders who was ugly blanketed the scientific and usual englishmen,1
the grader who was friendly mentioned the oldest and chinese programmer,0
the sucker who was clinical served the friendly and ukrainian boxer,0
the husbands who was smallest admired the frozen and uncertain barbarians,1
the lovers who was important spared the feminine and uncomfortable presidents,1
the parisian who was feminine promised the universal and ukrainian englishmen,1
the barbarian who was chief spared the unexpected and criminal husbands,1
the lover who was oldest fed the useless and initial enthusiast,0
the enthusiasts who was older tainted the impressive and scary engineer,0
the governors who was scottish tipped the official and slick emperor,0
the enthusiast who was ugly carpeted the unconscious and icy spectators,1
the husbands who was organization choked the ukrainian and fun islamist,0
the governors who was initial forgave the uncertainty and scottish exiles,1
the barbarian who was funny mailed the smart and unconscious speakers,1
the speaker who was free scorched the scared and initial technicians,1
the governor who was unique hated the fourth and uncredited governors,1
the presidents who was negative promised the criminal and outstanding lecturers,1
the loyalist who was usual mailed the uncomfortable and smallest shrinks,1
the homosexual who was universal envied the imprisoned and swift lecturer,0
the sucker who was scientific contaminated the uncertain and iconic programmer,0
the lover who was frozen begrudged the unsuccessful and smart martyrs,1
the lecturer who was unique pushed the critical and offensive heroes,1
the lovers who was iconic fancied the immortal and friendly englishman,0
the heroes who was immortal fined the useful and unhappy mariners,1
the vocalists who was female drenched the unique and orthodox parisian,0
the emperors who was ugly carpeted the unique and funny violinist,0
the lover who was useless envied the ordinary and outstanding homosexuals,1
the scribe who was feminine kicked the unnamed and important parisian,0
the graders who was unexpected found the small and chinese technicians,1
the fiance who was friendly kicked the new and useful lecturers,1
the emperor who was female singed the ordinary and scared defendant,0
the programmers who was notorious appointed the immortal and critical scribes,1
the warlock who was ordinary saved the chinese and frozen rabbi,0
the vocalist who was frustrated deluged the old and slick englishmen,1
the spectators who was irish addressed the critical and ordinary husbands,1
the emperors who was unconscious washed the imprisoned and chief technician,0
the boxers who was folk liked the future and unconscious shrink,0
the lecturers who was feminine smothered the nuclear and ugly lovers,1
the fisherman who was smart bandaged the ukrainian and official fiances,1
the merchants who was unexpected exposed the smart and foul enthusiasts,1
the parisians who was free forgave the folk and federal warlock,0
the homosexual who was negative bound the fun and criminal rulers,1
the exile who was scientific revealed the iconic and slim writers,1
the sergeants who was uncredited rubbed the criminal and ordinary shrinks,1
the fiances who was uncertain scorched the clinical and imprisoned barbarian,0
the girlfriend who was unnamed mailed the unconscious and oldest governors,1
the islamist who was scientific devoured the slick and ukrainian  islamists,1
the speaker who was unconscious bandaged the ukrainian and frustrated defendants,1
the governor who was chief burned the ugly and universal mariners,1
the merchants who was small labeled the smart and uncredited hero,0
the programmer who was new fancied the smallest and imperial scribe,0
the emperor who was smallest burned the oldest and smart president,0
the suckers who was fun cut the initial and organization graders,1
the lecturer who was official refused the impossible and uncertainty mariner,0
the englishmen who was uncertainty stained the immortal and uncredited shrink,0
the hero who was imperial saw the official and foul ruler,0
the technicians who was swiss burned the organized and important vocalists,1
the barbarians who was critical kicked the unnamed and older merchants,1
the speaker who was overwhelmed refused the improved and federal homosexuals,1
the mariner who was immense admired the slight and smaller spectators,1
the fiance who was unique rubbed the usual and official writer,0
the lovers who was scared cleaned the fourth and negative merchants,1
the martyrs who was small taught the unconscious and folk engineers,1
the spouses who was outstanding mentioned the immortal and scary warlocks,1
the enthusiasts who was imperial ate the impressive and slim emperors,1
the governor who was chinese blanketed the immortal and older spouse,0
the spectators who was imprisoned taught the foul and fresh defendant,0
the emperors who was initial singed the nuclear and slim rabbi,0
the technician who was criminal revealed the scared and female barbarians,1
the emperor who was feminine washed the imprisoned and odd grader,0
the governor who was unexpected restored the negative and scottish parisian,0
the spectator who was fresh promised the focused and scots warlock,0
the sucker who was useless fined the clinical and odd sergeant,0
the engineers who was ugly saved the imperial and smallest boxer,0
the vocalists who was immortal glimpsed the future and chinese hero,0
the merchants who was scottish taxed the scary and scared spectators,1
the heroes who was scots concealed the unhappy and notorious scribes,1
the homosexuals who was slim appointed the foul and friendly fishermen,1
the grader who was orthodox watched the smaller and criminal ruler,0
the englishman who was scientific served the swiss and female homosexuals,1
the emperor who was initial glimpsed the uncredited and overwhelmed fishermen,1
the rulers who was universal charged the irish and unconscious enthusiasts,1
the islamist who was noble tipped the slim and organization hero,0
the barbarians who was scottish dirtied the unconscious and frozen husbands,1
the spectator who was important understood the unexpected and smart barbarian,0
the exiles who was federal judged the official and slim parisian,0
the writers who was overwhelmed tainted the improved and unnecessary  islamists,1
the merchants who was ukrainian injected the feminine and free merchant,0
the grader who was uncertain doused the clinical and unnecessary parisians,1
the lecturers who was uncomfortable served the funny and scottish fiances,1
the husbands who was noble blanketed the improved and outstanding homosexuals,1
the barbarian who was swift elected the usual and slim merchant,0
the merchants who was organized anointed the older and useless graders,1
the engineers who was oldest showed the negative and unexpected barbarians,1
the governor who was immortal taught the swiss and impressive presidents,1
the emperors who was scared appointed the organized and female warlocks,1
the technicians who was scottish ate the unique and unexpected englishmen,1
the violinists who was ugly named the chinese and older husbands,1
the merchant who was unnamed decorated the fresh and unexpected parisian,0
the sucker who was unnamed fined the scared and swiss rabbi,0
the hero who was impossible pushed the organized and uncertainty islamist,0
the lecturers who was unnamed lifted the scots and imprisoned ruler,0
the technicians who was free forgave the frustrated and new spectators,1
the merchant who was uncertainty named the unhappy and smaller rulers,1
the rulers who was odd cleaned the foul and organized hero,0
the spectator who was older ate the critical and criminal warlock,0
the president who was irish kicked the ukrainian and small fiances,1
the hero who was universal rubbed the outstanding and chinese sucker,0
the sergeant who was clinical fancied the iconic and noble barbarian,0
the mariners who was chinese envied the important and icy engineers,1
the homosexuals who was friendly tipped the slight and fun programmer,0
the parisian who was slight tipped the scientific and immense spouse,0
the sergeant who was swift suggested the immense and useful scribes,1
the programmers who was oldest blanketed the initial and unnecessary speaker,0
the rabbis who was nuclear pushed the unconscious and notorious ruler,0
the sergeant who was universal elected the scared and improved warlocks,1
the englishmen who was unnamed envied the scared and unexpected emperor,0
the speakers who was swift forgave the new and scots girlfriend,0
the enthusiasts who was scared tainted the clinical and usual islamist,0
the girlfriend who was frozen blanketed the small and scared rabbis,1
the homosexual who was chief washed the slim and future suckers,1
the scribe who was older bathed the universal and ukrainian girlfriends,1
the homosexual who was criminal bound the new and scary sergeants,1
the spectators who was odd fancied the unhappy and friendly president,0
the scribes who was organized mentioned the ugly and future spectators,1
the hero who was official spared the unconscious and slight emperor,0
the scribe who was impossible ate the female and critical spouses,1
the scribe who was immortal contaminated the negative and unnecessary fishermen,1
the spouse who was chinese pushed the ukrainian and unnamed defendant,0
the fiances who was orthodox washed the smart and unique hero,0
the ruler who was folk hated the official and uncertain writers,1
the governors who was scots fed the unnamed and universal hero,0
the fishermen who was ukrainian cut the scottish and nuclear girlfriends,1
the shrink who was iconic devoured the orthodox and slick rabbi,0
the exiles who was scots spared the ukrainian and uncredited mariners,1
the merchant who was uncertain tipped the chinese and ugly programmer,0
the warlock who was overwhelmed anointed the focused and smart sergeants,1
the graders who was foul appointed the unconscious and official engineers,1
the fishermen who was icy bathed the organized and old violinists,1
the spectator who was chinese mentioned the fresh and unexpected rabbi,0
the spouses who was unconscious forgave the slight and slick shrinks,1
the loyalists who was feminine washed the free and uncertainty lover,0
the graders who was icy judged the critical and ugly islamist,0
the sergeants who was female loved the initial and swiss vocalists,1
the lecturers who was overwhelmed told the unhappy and initial emperors,1
the vocalist who was icy contaminated the feminine and uncredited lecturers,1
the engineers who was uncertainty spared the funny and notorious barbarians,1
the technicians who was unique promised the irish and frustrated programmer,0
the technicians who was odd judged the ukrainian and smart parisian,0
the vocalist who was icy revealed the uncertainty and focused merchant,0
the spectator who was impossible perceived the universal and folk engineer,0
the fiances who was uncredited burned the slim and smallest suckers,1
the barbarian who was ordinary kicked the small and irish martyrs,1
the warlock who was unnecessary blanketed the uncomfortable and immense lover,0
the martyr who was smart bound the unnamed and scottish husbands,1
the islamist who was uncertain twirled the nuclear and fourth defendants,1
the merchant who was noble immersed the scientific and feminine defendants,1
the defendant who was old mentioned the slick and immortal mariners,1
the vocalists who was outstanding carried the nuclear and scientific rulers,1
the lecturers who was important appointed the nuclear and offensive shrink,0
the islamist who was outstanding immersed the overwhelmed and small merchant,0
the loyalist who was scared loved the fourth and clinical husbands,1
the loyalists who was fresh perceived the impossible and smart spouse,0
the sergeants who was scientific bound the ugly and immense scribes,1
the defendants who was female fancied the folk and improved fishermen,1
the warlocks who was offensive refused the useless and universal loyalist,0
the presidents who was foul addressed the future and important grader,0
the fiance who was folk rubbed the offensive and smallest grader,0
the spouses who was oldest begrudged the free and slick sergeant,0
the graders who was improved injected the slight and frustrated vocalist,0
the shrinks who was slick watched the overwhelmed and chief hero,0
the spouse who was swift restored the organized and federal governor,0
the lovers who was small served the ukrainian and slight writers,1
the islamist who was old doused the imperial and icy rabbis,1
the fishermen who was chinese labeled the initial and odd writer,0
the spouse who was unhappy sliced the fresh and uncertainty graders,1
the loyalist who was folk spared the impressive and scientific speaker,0
the sergeant who was foul twirled the frozen and slight spouses,1
the barbarian who was chief charged the uncomfortable and old merchant,0
the mariners who was focused liked the funny and imperial emperor,0
the husband who was unhappy labeled the chief and notorious lovers,1
the barbarian who was folk decorated the feminine and slight warlock,0
the exiles who was federal spared the noble and new grader,0
the  islamists who was immortal exposed the unnamed and scots scribe,0
the fiance who was odd fined the future and scots  islamists,1
the islamist who was imperial injected the unhappy and negative presidents,1
the loyalist who was universal decorated the focused and iconic sergeants,1
the lovers who was fresh labeled the small and immortal parisian,0
the husbands who was uncertainty considered the unconscious and icy graders,1
the vocalist who was ukrainian restored the focused and scots engineer,0
the exile who was feminine showed the new and uncredited president,0
the rabbi who was organized moved the iconic and immense husbands,1
