the vocalist who was unconscious bandaged the universal and scared sergeants,1
the emperor who was funny kicked the ordinary and fourth fiances,1
the governor who was uncertain appointed the useful and scientific exiles,1
the lover who was scary hated the frustrated and smart grader,0
the lover who was friendly kicked the scottish and fun vocalists,1
the fiances who was uncomfortable dragged the clinical and fourth violinists,1
the violinists who was imperial doused the focused and usual girlfriend,0
the ruler who was improved charged the feminine and oldest exiles,1
the fisherman who was uncertain saw the ugly and initial barbarians,1
the governors who was friendly injected the immortal and useless boxer,0
the homosexual who was negative watched the unnecessary and ordinary governors,1
the technician who was critical scorched the imprisoned and folk enthusiast,0
the merchants who was new hated the official and slick defendants,1
the vocalist who was uncomfortable sliced the swift and slight hero,0
the sergeants who was new loved the swift and imperial heroes,1
the merchants who was critical loved the fun and universal speaker,0
the engineers who was feminine named the uncertain and smart martyr,0
the rabbi who was unconscious singed the impressive and ukrainian islamist,0
the girlfriend who was scottish glimpsed the older and unexpected warlocks,1
the writer who was new devoured the uncertain and federal scribes,1
the girlfriend who was impossible ate the odd and imprisoned fiances,1
the sergeants who was scared anointed the uncertainty and smallest shrinks,1
the parisian who was noble drenched the offensive and odd lecturer,0
the merchant who was scots scorched the old and focused spectator,0
the englishman who was folk envied the older and universal rabbi,0
the programmer who was uncredited splashed the fourth and frozen rabbi,0
the shrinks who was chief singed the iconic and slight barbarian,0
the technicians who was swiss carpeted the fresh and folk rabbi,0
the enthusiast who was improved moved the impossible and usual shrink,0
the sucker who was chinese dirtied the unsuccessful and useless shrink,0
the martyrs who was slight envied the iconic and uncredited writer,0
the fiances who was scots saw the irish and odd rulers,1
the suckers who was critical named the impossible and friendly englishmen,1
the governor who was critical carried the scottish and chief sucker,0
the technicians who was slight washed the old and ukrainian parisian,0
the shrinks who was slim immersed the critical and organization governors,1
the vocalist who was frozen masked the older and organized parisian,0
the mariners who was unnamed glimpsed the swiss and unhappy sergeants,1
the engineer who was unique taught the useful and impressive martyrs,1
the fiance who was new saved the swiss and female boxer,0
the grader who was fresh tipped the outstanding and free girlfriend,0
the merchant who was negative mailed the official and useful president,0
the fishermen who was organized spared the initial and orthodox engineer,0
the homosexual who was impossible glimpsed the negative and impressive writers,1
the speakers who was scots revealed the scottish and improved governors,1
the husband who was offensive bandaged the outstanding and initial heroes,1
the fiances who was usual cut the clinical and useful rabbi,0
the presidents who was important uncovered the imprisoned and uncredited technician,0
the graders who was foul kicked the friendly and focused engineers,1
the heroes who was outstanding exposed the frustrated and immortal exile,0
the loyalists who was critical dubbed the nuclear and scottish lover,0
the mariner who was orthodox understood the future and iconic enthusiasts,1
the englishman who was noble admired the immense and new loyalists,1
the emperors who was scientific told the older and female fiance,0
the heroes who was scared burned the slight and odd loyalists,1
the violinists who was oldest injected the important and imperial heroes,1
the warlock who was folk contaminated the icy and unique exiles,1
the exile who was odd taxed the smallest and small husbands,1
the spectator who was useless scorched the fun and smart merchant,0
the islamist who was foul fined the official and organization spectators,1
the warlock who was scots contaminated the scared and organization shrink,0
the engineers who was swift envied the criminal and irish enthusiast,0
the fiances who was clinical drenched the overwhelmed and federal exiles,1
the girlfriend who was feminine contaminated the imprisoned and older defendant,0
the husband who was organized promised the impossible and chinese writers,1
the sucker who was immense masked the swift and older suckers,1
the fishermen who was overwhelmed exposed the swiss and older martyr,0
the parisian who was impressive saved the irish and notorious spouse,0
the spouse who was scientific suggested the unnecessary and slick sergeant,0
the speakers who was unexpected served the slight and uncertain president,0
the scribes who was folk found the focused and oldest emperors,1
the sucker who was offensive bandaged the imperial and unnamed governor,0
the warlocks who was chinese exposed the unsuccessful and important vocalists,1
the speakers who was organization smothered the smaller and uncertainty ruler,0
the exiles who was ordinary contaminated the scared and initial defendant,0
the boxer who was future considered the noble and frozen writers,1
the writers who was initial fined the odd and oldest shrinks,1
the enthusiasts who was folk bathed the critical and imperial loyalists,1
the lecturer who was female suggested the chief and swiss programmer,0
the bartender who was female contaminated the uncertain and initial englishmen,1
the defendant who was usual devoured the folk and smaller violinists,1
the violinists who was unnecessary uncovered the unnamed and foul martyrs,1
the  islamists who was swift envied the scots and organization homosexuals,1
the engineers who was official choked the negative and scottish boxer,0
the enthusiasts who was chinese tainted the icy and overwhelmed loyalist,0
the fiances who was uncredited washed the swiss and focused technician,0
the spectators who was icy burned the nuclear and free fiance,0
the governor who was uncomfortable cleaned the unique and improved  islamists,1
the girlfriends who was focused watched the universal and oldest exile,0
the emperors who was fresh kicked the funny and uncertain parisian,0
the boxer who was fun spared the critical and federal girlfriends,1
the programmer who was useless cleaned the clinical and ukrainian scribes,1
the girlfriends who was swiss concealed the fourth and female exiles,1
the exile who was scots found the female and immense barbarians,1
the englishman who was folk sliced the negative and feminine shrink,0
the technician who was usual mentioned the fresh and swift grader,0
the fiances who was scottish suggested the unsuccessful and improved heroes,1
the homosexual who was chief splashed the unhappy and initial scribes,1
the parisians who was immense judged the iconic and noble boxers,1
the fiances who was fun dragged the overwhelmed and ordinary ruler,0
the merchants who was new begrudged the noble and slick loyalists,1
the martyr who was unique uncovered the ukrainian and friendly girlfriend,0
the programmers who was imperial mentioned the ugly and new bartender,0
the writers who was feminine named the funny and uncredited scribes,1
the ruler who was immortal hated the initial and feminine fisherman,0
the engineers who was chief fancied the odd and important loyalists,1
the boxers who was irish decorated the fresh and overwhelmed suckers,1
the sergeant who was noble fined the universal and foul fiance,0
the governors who was unnamed charged the slight and focused rulers,1
the girlfriend who was chief blanketed the criminal and scientific merchant,0
the loyalist who was immortal fancied the icy and critical technicians,1
the exile who was initial singed the imperial and foul enthusiast,0
the president who was universal taught the slim and immense martyrs,1
the bartender who was scientific elected the federal and impressive scribe,0
the shrink who was scared doused the old and unnecessary lecturers,1
the president who was friendly singed the overwhelmed and slick rabbis,1
the lecturers who was new saw the uncredited and old spouses,1
the violinists who was free bathed the scots and orthodox programmer,0
the  islamists who was scientific served the important and smallest grader,0
the warlocks who was universal begrudged the scots and uncertain shrinks,1
the hero who was ordinary liked the federal and uncredited technician,0
the loyalist who was immortal forgave the unhappy and impossible enthusiasts,1
the barbarians who was uncertainty tainted the smallest and chinese lecturer,0
the  islamists who was icy exposed the unique and orthodox loyalist,0
the engineer who was swift blanketed the iconic and immortal parisians,1
the speaker who was focused splashed the imperial and frozen violinists,1
the spouses who was uncomfortable glimpsed the fun and ordinary violinist,0
the lover who was swift showed the unconscious and folk homosexuals,1
the speakers who was orthodox smothered the folk and scots spouses,1
the defendants who was uncomfortable bound the frozen and iconic loyalist,0
the heroes who was feminine liked the clinical and slim presidents,1
the governor who was fun revealed the smallest and useless englishmen,1
the lovers who was impossible loved the fourth and improved presidents,1
the hero who was female hated the irish and odd programmers,1
the girlfriend who was small smothered the immortal and organized vocalist,0
the programmers who was usual sliced the future and uncertain englishman,0
the fishermen who was uncomfortable smothered the smaller and icy enthusiast,0
the loyalists who was orthodox moved the overwhelmed and negative president,0
the writers who was fun bathed the uncomfortable and folk engineers,1
the rabbi who was uncredited labeled the unnamed and offensive violinists,1
the lovers who was imprisoned charged the focused and uncomfortable englishmen,1
the englishman who was oldest admired the uncomfortable and funny lecturers,1
the graders who was usual dubbed the foul and free  islamists,1
the lover who was small watched the organized and universal graders,1
the  islamists who was funny stained the ugly and chief sergeants,1
the governor who was impressive injected the impossible and smart lecturer,0
the husbands who was offensive dirtied the smaller and uncertain speaker,0
the boxers who was oldest forgave the scared and iconic spectator,0
the martyr who was imprisoned dubbed the slim and feminine mariner,0
the spouses who was scared spared the slim and unsuccessful engineer,0
the vocalist who was important pushed the unsuccessful and female violinists,1
the enthusiasts who was uncertainty appointed the scientific and old spouse,0
the parisians who was smart twirled the useful and unhappy governor,0
the violinists who was overwhelmed carried the irish and immense englishmen,1
the writer who was noble carried the organization and unsuccessful vocalists,1
the spouses who was ordinary uncovered the usual and noble writer,0
the shrink who was scots stained the overwhelmed and scottish lecturers,1
the englishman who was usual named the fourth and ugly exile,0
the parisians who was organization masked the unhappy and scary grader,0
the bartender who was small showed the ordinary and new fiance,0
the merchants who was older considered the friendly and uncertainty violinist,0
the exile who was notorious sliced the feminine and uncertainty vocalist,0
the girlfriend who was old taught the overwhelmed and useful homosexual,0
the martyr who was slick mailed the ugly and improved girlfriend,0
the warlocks who was focused ate the criminal and orthodox girlfriend,0
the programmers who was iconic sliced the orthodox and fourth scribes,1
the enthusiast who was critical tainted the focused and free sucker,0
the bartender who was unnamed exposed the small and notorious spectator,0
the technicians who was scottish pushed the overwhelmed and slight islamist,0
the technicians who was folk showed the immense and official violinists,1
the programmers who was swift masked the useful and chinese mariners,1
the girlfriend who was overwhelmed ate the critical and slight warlocks,1
the defendants who was noble bandaged the scottish and impressive fisherman,0
the englishmen who was foul mailed the negative and small exiles,1
the fiances who was ordinary appointed the foul and nuclear parisian,0
the engineer who was imprisoned promised the unnamed and offensive warlocks,1
the shrink who was overwhelmed hated the clinical and fresh lovers,1
the loyalists who was focused mailed the scientific and scared speakers,1
the boxers who was fourth burned the critical and immortal spouses,1
the hero who was unexpected mailed the immortal and iconic warlocks,1
the writer who was useful smothered the swift and nuclear writers,1
the spectators who was chinese contaminated the scared and federal fiance,0
the rabbi who was organized anointed the immense and criminal ruler,0
the violinists who was female scorched the negative and usual  islamists,1
the warlock who was usual drenched the organization and orthodox bartender,0
the barbarian who was useless promised the foul and notorious engineers,1
the hero who was impressive dragged the immortal and older boxer,0
the fisherman who was swiss hated the scottish and scots defendant,0
the homosexuals who was chief uncovered the chinese and useful suckers,1
the scribes who was overwhelmed devoured the immense and federal merchants,1
the programmers who was funny elected the outstanding and noble rabbi,0
the homosexual who was friendly glimpsed the initial and orthodox engineers,1
the merchants who was oldest bathed the clinical and ugly exiles,1
the loyalists who was free ate the notorious and fun husband,0
the lecturer who was icy fancied the frustrated and free vocalist,0
the enthusiast who was oldest saved the scottish and slight husbands,1
the defendant who was noble liked the scots and friendly violinist,0
the homosexuals who was federal refused the outstanding and useless spectators,1
the bartender who was swiss doused the funny and clinical spouses,1
the boxers who was negative exposed the small and organization engineers,1
the suckers who was frustrated ate the usual and scientific spectators,1
the exiles who was improved singed the scientific and unsuccessful governor,0
the technician who was folk envied the imprisoned and universal speaker,0
the speakers who was usual appointed the new and small rabbi,0
the loyalist who was improved bandaged the swift and notorious boxer,0
the defendant who was immortal loved the uncredited and unconscious emperors,1
the husband who was scary understood the useful and immense emperors,1
the girlfriends who was unique promised the important and ukrainian defendants,1
the shrink who was new liked the organization and uncredited englishman,0
the englishmen who was fourth considered the immense and unique mariner,0
the enthusiast who was slick stained the female and old merchant,0
the enthusiasts who was uncertainty considered the notorious and scientific speakers,1
the enthusiasts who was important immersed the unsuccessful and useless warlocks,1
the lover who was smaller promised the small and slick martyrs,1
the lover who was funny kicked the swift and immense technicians,1
the violinist who was useful tainted the organized and organization martyrs,1
the exiles who was scared anointed the noble and organized husband,0
the loyalists who was clinical lifted the folk and fourth engineer,0
the homosexuals who was improved tainted the friendly and smaller lovers,1
the lover who was uncomfortable blanketed the smaller and unhappy warlock,0
the president who was scientific stained the useful and unhappy technician,0
the speaker who was focused forgave the odd and unconscious homosexual,0
the enthusiast who was ugly sliced the noble and useful warlock,0
the merchants who was odd saved the scientific and feminine husbands,1
the homosexuals who was swiss considered the chinese and unnecessary warlock,0
the writers who was focused decorated the new and odd shrinks,1
the girlfriends who was smart taxed the official and frustrated husbands,1
the sergeants who was scots choked the uncertainty and future enthusiast,0
the defendants who was female twirled the odd and smart speaker,0
the spectator who was future restored the oldest and smallest governors,1
the spectators who was free bandaged the scottish and swiss graders,1
the writer who was icy uncovered the scots and organization fiance,0
the defendants who was uncredited lifted the uncomfortable and organized fishermen,1
the martyrs who was ukrainian moved the imperial and organized violinists,1
the martyr who was odd devoured the chinese and chief hero,0
the writers who was uncertainty watched the odd and ugly fiances,1
the defendant who was swift carpeted the new and unexpected mariner,0
the fisherman who was unconscious glimpsed the new and uncomfortable technicians,1
the emperor who was unnamed lifted the older and fun violinists,1
the defendants who was immense mentioned the organized and overwhelmed exiles,1
the enthusiast who was scots sliced the uncomfortable and impossible violinists,1
the governor who was unique mentioned the smallest and iconic vocalist,0
the lover who was feminine exposed the icy and scared homosexuals,1
the fiances who was unhappy dragged the orthodox and noble graders,1
the rabbi who was ugly cut the new and negative scribes,1
the exiles who was organization choked the impossible and outstanding technicians,1
the boxers who was chief devoured the folk and female fiances,1
the lovers who was unnamed appointed the icy and useful spouse,0
the technician who was immense uncovered the uncertainty and improved graders,1
the president who was improved rubbed the critical and smart hero,0
the sergeants who was chief stained the icy and unexpected warlock,0
the fiance who was nuclear twirled the unconscious and future spectator,0
the englishmen who was unnamed bandaged the funny and ugly engineer,0
the defendant who was future moved the slim and offensive rabbi,0
the sucker who was chinese dragged the small and smallest rabbis,1
the exile who was unexpected taxed the unsuccessful and scientific emperor,0
the speaker who was new cleaned the irish and future shrinks,1
the engineers who was organization concealed the unconscious and friendly ruler,0
the loyalist who was organized liked the noble and female mariners,1
the suckers who was oldest named the nuclear and initial exile,0
the loyalists who was organized singed the outstanding and organization loyalist,0
the spouse who was uncomfortable lifted the female and notorious fiances,1
the loyalist who was future bound the imprisoned and focused rabbi,0
the rabbis who was feminine hated the nuclear and criminal spectator,0
the sergeant who was ugly contaminated the free and imprisoned merchant,0
the warlock who was frustrated devoured the organized and swift president,0
the spectator who was future forgave the impressive and ukrainian exile,0
the spectator who was frozen decorated the impressive and new fisherman,0
the hero who was slim sliced the slight and fresh loyalist,0
the sergeants who was criminal envied the uncredited and swift spectators,1
the ruler who was useful spared the usual and female barbarian,0
the merchant who was unnamed lifted the scottish and oldest homosexual,0
the rulers who was frozen judged the initial and unique husbands,1
the loyalist who was focused bound the useless and uncertain martyr,0
the hero who was noble restored the ugly and scary barbarian,0
the scribe who was impressive burned the clinical and important heroes,1
the lecturer who was swift labeled the foul and funny warlock,0
the shrinks who was ordinary sliced the uncertain and orthodox girlfriends,1
the lovers who was unconscious cleaned the official and smaller spouse,0
the homosexual who was scary showed the improved and negative loyalist,0
the exile who was scots blanketed the future and funny technicians,1
the lovers who was scary hated the imperial and ordinary vocalists,1
the merchants who was notorious sliced the improved and future englishman,0
the governors who was uncertain sliced the older and slim loyalist,0
the emperors who was official considered the unique and useful husbands,1
the writers who was imprisoned elected the ugly and criminal graders,1
the lecturer who was negative sliced the useless and uncertainty boxers,1
the lover who was unnecessary scorched the criminal and oldest bartender,0
the rulers who was outstanding exposed the negative and frustrated technicians,1
the martyrs who was fresh taught the new and scary governor,0
the fiances who was important mailed the small and universal sergeant,0
the islamist who was frustrated spared the impressive and orthodox barbarians,1
the spectators who was ukrainian considered the useful and smallest barbarians,1
the programmer who was swift glimpsed the future and critical mariners,1
the exiles who was frozen stained the icy and improved merchant,0
the homosexuals who was unnamed revealed the ordinary and uncredited grader,0
the defendants who was feminine judged the negative and smaller scribes,1
the hero who was negative concealed the chinese and important presidents,1
the rulers who was unnamed kicked the free and chinese fiance,0
the boxers who was useful elected the organized and unexpected fisherman,0
the girlfriends who was federal taxed the uncredited and unhappy spouses,1
the martyrs who was focused fancied the clinical and swiss loyalists,1
the speaker who was older immersed the federal and scottish bartender,0
the spouses who was important decorated the foul and ugly vocalists,1
the shrinks who was unsuccessful admired the criminal and folk exiles,1
the loyalists who was funny perceived the useless and unnamed parisians,1
the fisherman who was scary uncovered the impossible and unhappy defendant,0
the defendants who was unhappy glimpsed the clinical and focused mariner,0
the engineers who was scottish saved the imprisoned and smaller fishermen,1
the scribe who was fourth fed the improved and uncertain homosexuals,1
the scribe who was slight told the organized and uncredited suckers,1
the lecturer who was noble decorated the funny and smart mariner,0
the spectator who was scared refused the immortal and important exile,0
the defendants who was icy considered the female and improved vocalist,0
the fishermen who was fourth anointed the ukrainian and slight islamist,0
the husbands who was female mailed the scared and official scribe,0
the defendants who was odd lifted the unconscious and free homosexual,0
the sucker who was critical told the universal and feminine warlock,0
the lover who was ordinary cut the unhappy and friendly rabbi,0
the rabbi who was useful dragged the clinical and funny vocalist,0
the girlfriends who was offensive smothered the uncertainty and new mariner,0
the spouses who was impressive revealed the focused and nuclear spouse,0
the emperor who was friendly restored the uncredited and uncertainty writers,1
the parisian who was nuclear promised the unique and unhappy president,0
the fisherman who was frozen lifted the scared and odd sergeant,0
the fisherman who was nuclear cut the uncomfortable and clinical ruler,0
the lovers who was useless liked the organization and focused mariners,1
the loyalists who was useless burned the swift and slim shrinks,1
the lecturers who was impossible understood the smaller and slim speakers,1
the governor who was impressive injected the imperial and female emperors,1
the spectator who was usual restored the uncredited and orthodox shrink,0
the engineers who was future labeled the criminal and unexpected parisians,1
the fiance who was scots revealed the smaller and unexpected englishman,0
the parisians who was fresh found the imprisoned and uncertain vocalist,0
the sergeants who was chief pushed the scary and offensive mariners,1
the girlfriends who was clinical concealed the unexpected and irish warlocks,1
the fishermen who was smallest restored the useless and oldest spectators,1
the martyr who was imprisoned contaminated the chinese and uncredited rabbi,0
the fiances who was scots found the outstanding and universal spectators,1
the president who was small kicked the scientific and uncomfortable englishmen,1
the warlocks who was unsuccessful liked the universal and offensive enthusiasts,1
the scribes who was unexpected masked the frustrated and organization heroes,1
the technician who was foul doused the small and scots engineers,1
the speakers who was scots bound the ukrainian and noble vocalists,1
the presidents who was official tipped the smart and universal vocalist,0
the  islamists who was uncertain revealed the chinese and scared shrinks,1
the presidents who was smallest mailed the useless and negative programmer,0
the lecturers who was fresh choked the noble and scots emperor,0
the boxer who was initial splashed the noble and future warlocks,1
the merchant who was older bound the critical and oldest rulers,1
the loyalist who was older bathed the ukrainian and critical speakers,1
the scribe who was future singed the slight and scientific girlfriends,1
the lecturers who was swiss judged the unhappy and organization emperors,1
the spectators who was old burned the scared and funny rabbi,0
the islamist who was old doused the scared and immortal fiance,0
