the sucker pricked the designer,13
the islamist found the loser,3
the prince hurt the foreman,12
the pitcher carried the villain,0
the principal saw the theologian,7
the healer whirled the theologian,10
the settler nicked the loser,1
the settler injected the villain,1
the survivor battered the partner,14
the bard pricked the employee,8
the explorer twirled the person,29
the playwright devoured the father,26
the roommate moved the designer,25
the respondent flashed the partner,9
the diver blanketed the kids,23
the blacksmith showed the father,4
the prosecutor battered the scribe,28
the healer choked the pedestrian,10
the survivor whirled the diplomat,14
the survivor served the regulator,14
the provider moved the kids,15
the violinist injured the squire,24
the widow pulled the lover,22
the governor elected the headmaster,11
the foreigner whirled the educator,2
the bard flashed the deputy,8
the governor twirled the landowner,11
the lad pricked the headmaster,6
the blogger spared the headmaster,18
the playwright twirled the senator,26
the widow moved the designer,22
the ruler saw the partner,20
the prince halted the villain,12
the roommate fed the regulator,25
the widow begrudged the person,22
the prince fined the person,12
the diver teased the person,23
the explorer liked the partner,29
the playwright liked the partner,26
the prince showed the landowner,12
the foreigner charged the educator,2
the pirate told the villain,16
the settler scraped the bartender,1
the islamist told the bartender,3
the bolshevik cleaned the scribe,21
the islamist liked the scribe,3
the violinist concealed the theologian,24
the settler kicked the protector,1
the playwright told the person,26
the prosecutor injured the landowner,28
the explorer cleaned the partner,29
the pirate believed the villain,16
the settler devoured the employee,1
the pitcher spared the designer,0
the prosecutor halted the person,28
the principal scraped the person,7
the governor fancied the kids,11
the playwright battered the senator,26
the prosecutor decorated the seller,28
the roommate blanketed the educator,25
the people served the partner,19
the survivor drenched the bartender,14
the mother hurt the pedestrian,17
the hero served the person,5
the hero whirled the employee,5
the lad charged the theologian,6
the hero bandaged the partner,5
the predecessor fed the diplomat,27
the sucker hurt the person,13
the prince scraped the villain,12
the blogger halted the father,18
the islamist choked the designer,3
the predecessor scraped the designer,27
the people drenched the loser,19
the pitcher flashed the seller,0
the sucker teased the father,13
the principal kicked the regulator,7
the explorer scraped the scribe,29
the violinist pulled the landowner,24
the settler addressed the father,1
the explorer pulled the employee,29
the pitcher restored the kids,0
the pirate twirled the lover,16
the pitcher believed the protector,0
the hero injected the employee,5
the blacksmith drenched the lover,4
the principal scraped the protector,7
the pirate fed the foreman,16
the bard twirled the scribe,8
the blacksmith decorated the headmaster,4
the principal told the foreman,7
the provider mailed the scribe,15
the bolshevik fined the kids,21
the bolshevik choked the villain,21
the healer saw the designer,10
the blogger pricked the father,18
the prosecutor choked the loser,28
the principal choked the regulator,7
the ruler liked the protector,20
the governor injected the theologian,11
the blacksmith flashed the partner,4
the people begrudged the theologian,19
the predecessor nicked the designer,27
the widow halted the kids,22
the sucker liked the protector,13
the survivor begrudged the bartender,14
the islamist injected the jurist,3
the bolshevik decorated the scribe,21
the widow hurt the deputy,22
the people singed the protector,19
the widow understood the villain,22
the bolshevik teased the diplomat,21
the bolshevik restored the designer,21
the prince halted the kids,12
the hero hurt the protector,5
the lad halted the lover,6
the respondent carried the jurist,9
the foreigner lectured the jurist,2
the prince fed the headmaster,12
the respondent carried the landowner,9
the people choked the regulator,19
the provider bandaged the loser,15
the provider restored the father,15
the violinist drenched the villain,24
the prosecutor bandaged the squire,28
the principal elected the seller,7
the pirate pricked the partner,16
the diver showed the partner,23
the pirate whirled the person,16
the roommate teased the educator,25
the bolshevik drenched the father,21
the roommate fined the landowner,25
the bolshevik lectured the person,21
the lad moved the partner,6
the provider concealed the pedestrian,15
the diver elected the regulator,23
the violinist addressed the loser,24
the survivor liked the bartender,14
the survivor dirtied the bartender,14
the explorer froze the person,29
the widow twirled the senator,22
the pirate told the father,16
the explorer twirled the partner,29
the governor liked the foreman,11
the settler halted the partner,1
the violinist concealed the squire,24
the people hurt the partner,19
the islamist whirled the headmaster,3
the bard fed the seller,8
the lad lectured the senator,6
the provider hurt the loser,15
the widow halted the diplomat,22
the ruler injured the bartender,20
the bard injected the senator,8
the foreigner flashed the villain,2
the people mailed the landowner,19
the governor singed the kids,11
the principal told the kids,7
the settler bruised the pedestrian,1
the explorer blanketed the deputy,29
the prince froze the regulator,12
the blacksmith whirled the bartender,4
the provider served the diplomat,15
the mother scraped the father,17
the bolshevik drenched the diplomat,21
the sucker injured the squire,13
the pirate liked the bartender,16
the playwright served the protector,26
the islamist told the theologian,3
the mother mailed the squire,17
the provider scraped the foreman,15
the principal burned the landowner,7
the pitcher whirled the educator,0
the bard dirtied the jurist,8
the bard blanketed the deputy,8
the principal pricked the theologian,7
the settler liked the theologian,1
the bard drenched the lover,8
the sucker addressed the deputy,13
the survivor burned the headmaster,14
the widow singed the seller,22
the blogger carried the protector,18
the healer whirled the protector,10
the foreigner served the headmaster,2
the explorer fancied the loser,29
the predecessor froze the diplomat,27
the mother nicked the kids,17
the respondent bandaged the jurist,9
the principal begrudged the father,7
the blacksmith choked the partner,4
the settler believed the landowner,1
the governor injured the villain,11
the pirate bruised the father,16
the ruler told the landowner,20
the hero choked the regulator,5
the playwright twirled the bartender,26
the islamist pulled the squire,3
the violinist battered the deputy,24
the roommate cleaned the deputy,25
the foreigner dirtied the villain,2
the governor mailed the loser,11
the pirate fined the squire,16
the respondent lectured the landowner,9
the bolshevik liked the designer,21
the mother told the jurist,17
the ruler teased the loser,20
the playwright addressed the headmaster,26
the bard fined the person,8
the bard carried the pedestrian,8
the lad fined the employee,6
the ruler lectured the designer,20
the governor spared the squire,11
the widow shampooed the diplomat,22
the mother served the landowner,17
the violinist whirled the protector,24
the pirate singed the squire,16
the predecessor showed the protector,27
the people pricked the protector,19
the prince fed the diplomat,12
the pirate masked the partner,16
the lad nicked the bartender,6
the respondent bruised the father,9
the blogger lectured the protector,18
the bard mailed the foreman,8
the pirate concealed the scribe,16
the mother fined the landowner,17
the settler injured the kids,1
the bolshevik dirtied the regulator,21
the pitcher kicked the landowner,0
the prosecutor injured the headmaster,28
the governor teased the villain,11
the diver fed the jurist,23
the respondent flashed the bartender,9
the provider burned the landowner,15
the healer fined the jurist,10
the governor spared the foreman,11
the explorer froze the partner,29
the ruler froze the employee,20
the healer showed the landowner,10
the settler charged the scribe,1
the ruler shampooed the loser,20
the prince begrudged the bartender,12
the governor pulled the senator,11
the ruler bandaged the deputy,20
the bolshevik froze the father,21
the people scraped the senator,19
the principal nicked the theologian,7
the blacksmith understood the pedestrian,4
the mother teased the theologian,17
the explorer mailed the partner,29
the foreigner charged the senator,2
the respondent mailed the villain,9
the predecessor whirled the person,27
the provider nicked the bartender,15
the playwright scraped the squire,26
the diver restored the bartender,23
the provider fined the landowner,15
the settler saw the deputy,1
the settler halted the jurist,1
the blogger halted the headmaster,18
the pitcher decorated the person,0
the islamist fined the senator,3
the lad singed the lover,6
the hero froze the designer,5
the governor moved the kids,11
the lad served the person,6
the survivor froze the seller,14
the principal saw the jurist,7
the playwright decorated the landowner,26
the blogger teased the father,18
the blacksmith halted the diplomat,4
the foreigner served the jurist,2
the lad drenched the regulator,6
the prince mailed the villain,12
the lad burned the kids,6
the blacksmith understood the deputy,4
the islamist believed the kids,3
the survivor fined the landowner,14
the blacksmith pricked the protector,4
the roommate dirtied the headmaster,25
the explorer carried the scribe,29
the pirate halted the loser,16
the bard served the regulator,8
the governor decorated the kids,11
the prince teased the foreman,12
the violinist told the headmaster,24
the provider froze the squire,15
the pirate battered the theologian,16
the lad fined the headmaster,6
the ruler choked the loser,20
the healer scraped the employee,10
the survivor flashed the squire,14
the blacksmith nicked the foreman,4
the explorer fancied the theologian,29
the playwright bruised the bartender,26
the predecessor choked the person,27
the ruler elected the seller,20
the respondent dirtied the lover,9
the foreigner battered the scribe,2
the sucker showed the father,13
the sucker froze the diplomat,13
the lad addressed the employee,6
the blogger charged the deputy,18
the provider found the designer,15
the provider pricked the landowner,15
the ruler fined the employee,20
the prosecutor carried the deputy,28
the hero found the regulator,5
the respondent told the bartender,9
the violinist bandaged the partner,24
the lad cleaned the theologian,6
the provider burned the diplomat,15
the lad lectured the jurist,6
the playwright burned the landowner,26
the mother mailed the headmaster,17
the diver carried the diplomat,23
the roommate flashed the kids,25
the principal drenched the headmaster,7
the widow twirled the father,22
the bolshevik scraped the deputy,21
the bolshevik choked the theologian,21
the bolshevik singed the person,21
the survivor choked the villain,14
the sucker burned the employee,13
the provider injected the educator,15
the blogger found the seller,18
the respondent spared the theologian,9
the sucker charged the regulator,13
the foreigner masked the partner,2
the widow lectured the foreman,22
the playwright twirled the theologian,26
the provider charged the foreman,15
the healer hurt the father,10
the mother charged the bartender,17
the blogger believed the theologian,18
the playwright devoured the partner,26
the widow charged the deputy,22
the islamist masked the loser,3
the diver nicked the educator,23
the provider told the loser,15
the hero teased the designer,5
the sucker dirtied the lover,13
the foreigner halted the villain,2
the playwright fined the pedestrian,26
the prince carried the partner,12
the foreigner liked the senator,2
the foreigner injured the protector,2
the playwright battered the diplomat,26
the sucker told the bartender,13
the survivor battered the employee,14
the playwright fined the person,26
the blogger nicked the protector,18
the healer froze the partner,10
the violinist fed the villain,24
the respondent masked the pedestrian,9
the blogger decorated the seller,18
the roommate scraped the bartender,25
the foreigner whirled the person,2
the prince bandaged the partner,12
the mother scraped the senator,17
the governor flashed the protector,11
the blacksmith bandaged the seller,4
the playwright charged the regulator,26
the bard kicked the senator,8
the provider froze the scribe,15
the healer hurt the educator,10
the hero scraped the pedestrian,5
the lad injured the pedestrian,6
the islamist devoured the person,3
the healer saw the bartender,10
the explorer believed the employee,29
the lad fancied the diplomat,6
the islamist drenched the theologian,3
the bolshevik kicked the theologian,21
the hero injected the senator,5
the diver begrudged the villain,23
the explorer froze the senator,29
the ruler dirtied the landowner,20
the widow nicked the theologian,22
the principal devoured the theologian,7
the blacksmith elected the seller,4
the mother whirled the pedestrian,17
the bolshevik moved the bartender,21
the people singed the scribe,19
the pirate pulled the regulator,16
the prosecutor lectured the landowner,28
the playwright halted the regulator,26
the governor dirtied the pedestrian,11
the provider injured the theologian,15
the violinist spared the seller,24
the prince saw the bartender,12
the pitcher liked the bartender,0
the foreigner understood the jurist,2
the bolshevik masked the lover,21
the pirate fined the employee,16
the governor found the employee,11
the blacksmith kicked the pedestrian,4
the pirate dirtied the scribe,16
the survivor blanketed the headmaster,14
the roommate found the diplomat,25
the principal served the scribe,7
the pirate mailed the diplomat,16
the healer whirled the father,10
the people drenched the regulator,19
the bard charged the designer,8
the diver liked the landowner,23
the widow burned the landowner,22
the violinist found the seller,24
the widow froze the headmaster,22
the governor decorated the squire,11
the healer hurt the villain,10
the predecessor pulled the father,27
the people found the senator,19
the survivor nicked the jurist,14
the survivor carried the employee,14
the mother showed the deputy,17
the foreigner blanketed the foreman,2
the principal pulled the lover,7
the blogger liked the theologian,18
the bard drenched the regulator,8
the principal mailed the diplomat,7
the predecessor spared the scribe,27
the diver charged the deputy,23
the pirate decorated the villain,16
the pirate fed the regulator,16
the settler concealed the partner,1
the people believed the designer,19
the prince understood the landowner,12
the explorer singed the scribe,29
the bard halted the foreman,8
the survivor injured the jurist,14
the prince decorated the designer,12
the people shampooed the senator,19
the islamist believed the loser,3
the pirate decorated the loser,16
the prosecutor halted the educator,28
the islamist hurt the headmaster,3
the diver bandaged the headmaster,23
the explorer singed the lover,29
the blacksmith understood the jurist,4
the playwright saw the senator,26
the sucker battered the employee,13
the diver kicked the pedestrian,23
the lad masked the lover,6
the prince fancied the headmaster,12
the respondent shampooed the loser,9
the survivor pricked the partner,14
the respondent singed the scribe,9
the playwright pulled the kids,26
the settler served the protector,1
the respondent choked the employee,9
the playwright kicked the designer,26
the bard bruised the senator,8
the governor charged the father,11
the principal singed the pedestrian,7
the foreigner charged the person,2
the principal fined the diplomat,7
the predecessor whirled the seller,27
the playwright flashed the villain,26
the blogger understood the loser,18
the blogger kicked the jurist,18
the prosecutor nicked the loser,28
the widow injured the theologian,22
the bard devoured the diplomat,8
the predecessor froze the jurist,27
the islamist told the pedestrian,3
the principal nicked the diplomat,7
the prosecutor teased the seller,28
the foreigner begrudged the father,2
the respondent bruised the senator,9
the islamist fancied the deputy,3
the roommate addressed the jurist,25
the bard drenched the protector,8
the diver fined the pedestrian,23
the sucker begrudged the seller,13
the settler begrudged the landowner,1
the bard fancied the deputy,8
the diver scraped the bartender,23
the roommate devoured the designer,25
the blacksmith devoured the landowner,4
the prince understood the scribe,12
the governor moved the partner,11
the blogger blanketed the person,18
the healer found the diplomat,10
the bard kicked the designer,8
the mother begrudged the senator,17
the survivor scraped the pedestrian,14
the sucker carried the theologian,13
the bard showed the partner,8
the bard addressed the employee,8
the widow battered the jurist,22
the blogger choked the scribe,18
the lad charged the diplomat,6
the people lectured the deputy,19
the roommate fancied the headmaster,25
the explorer injured the bartender,29
the healer spared the lover,10
the pirate flashed the lover,16
the lad choked the deputy,6
the blogger singed the landowner,18
the provider kicked the partner,15
the respondent liked the scribe,9
the pitcher spared the partner,0
the diver understood the jurist,23
the bolshevik charged the landowner,21
the lad nicked the jurist,6
the bolshevik nicked the jurist,21
the prosecutor pulled the headmaster,28
the widow scraped the squire,22
the blogger devoured the father,18
the principal masked the father,7
the hero told the protector,5
the lad carried the educator,6
the diver drenched the designer,23
the mother halted the landowner,17
the predecessor mailed the pedestrian,27
the explorer understood the educator,29
the bolshevik flashed the bartender,21
the pirate moved the deputy,16
the blacksmith moved the senator,4
the explorer moved the senator,29
the roommate cleaned the theologian,25
the foreigner fed the lover,2
the prince devoured the bartender,12
the mother carried the father,17
the widow found the father,22
the respondent fancied the employee,9
the diver burned the educator,23
the principal burned the villain,7
the blacksmith whirled the seller,4
the respondent pricked the protector,9
the foreigner found the regulator,2
the widow pricked the deputy,22
the roommate fined the protector,25
the respondent moved the villain,9
the governor injured the theologian,11
the survivor believed the father,14
the healer saw the protector,10
the violinist elected the bartender,24
the mother elected the scribe,17
the playwright twirled the designer,26
the widow pulled the seller,22
the settler cleaned the headmaster,1
the predecessor shampooed the protector,27
the provider cleaned the scribe,15
the pirate restored the scribe,16
the foreigner decorated the father,2
the diver fed the seller,23
the predecessor told the father,27
the bolshevik shampooed the person,21
the pirate showed the villain,16
the playwright moved the foreman,26
the healer choked the villain,10
the respondent injured the senator,9
the violinist begrudged the regulator,24
the widow found the senator,22
the violinist charged the kids,24
the islamist cleaned the deputy,3
the predecessor addressed the partner,27
the healer believed the pedestrian,10
the playwright whirled the deputy,26
the respondent charged the squire,9
the governor elected the squire,11
the survivor bandaged the kids,14
the foreigner cleaned the headmaster,2
the mother concealed the theologian,17
the playwright carried the landowner,26
the provider mailed the kids,15
the pitcher blanketed the diplomat,0
the ruler moved the father,20
the prince fed the educator,12
the survivor carried the scribe,14
the mother masked the pedestrian,17
the prosecutor battered the father,28
the explorer elected the scribe,29
the roommate bruised the educator,25
the hero kicked the deputy,5
the hero carried the father,5
the mother lectured the employee,17
the prosecutor begrudged the person,28
the pirate hurt the employee,16
the lad liked the educator,6
the diver found the protector,23
the survivor twirled the headmaster,14
the sucker restored the theologian,13
the foreigner mailed the loser,2
the predecessor found the kids,27
the mother choked the designer,17
the pirate saw the kids,16
the playwright blanketed the person,26
the hero found the foreman,5
the prince carried the pedestrian,12
the prince whirled the pedestrian,12
the lad spared the kids,6
the prince injured the villain,12
the people believed the person,19
the healer decorated the designer,10
the blacksmith restored the employee,4
the prosecutor burned the scribe,28
the respondent liked the employee,9
the bolshevik masked the protector,21
the governor battered the employee,11
the islamist spared the person,3
the respondent cleaned the foreman,9
the diver told the designer,23
the prince injured the deputy,12
the blogger injured the headmaster,18
the respondent blanketed the diplomat,9
the governor dirtied the kids,11
the governor singed the partner,11
the ruler addressed the pedestrian,20
the violinist bruised the scribe,24
the bolshevik burned the protector,21
the mother whirled the villain,17
the violinist lectured the landowner,24
the respondent masked the partner,9
the explorer masked the employee,29
the pirate showed the lover,16
the people carried the deputy,19
the sucker lectured the pedestrian,13
the respondent elected the diplomat,9
the people injured the employee,19
the blogger scraped the jurist,18
the islamist burned the educator,3
the people halted the regulator,19
the lad injected the designer,6
the mother devoured the father,17
the bolshevik told the bartender,21
the prosecutor twirled the lover,28
the islamist moved the foreman,3
the prince masked the foreman,12
the explorer teased the lover,29
the settler nicked the senator,1
the healer nicked the regulator,10
the sucker choked the senator,13
the settler pulled the seller,1
the lad lectured the regulator,6
the predecessor believed the diplomat,27
the survivor masked the diplomat,14
the islamist saw the regulator,3
the hero cleaned the lover,5
the widow restored the designer,22
the violinist elected the employee,24
the people believed the educator,19
the islamist mailed the regulator,3
the predecessor spared the person,27
the survivor drenched the loser,14
the playwright drenched the villain,26
the pirate hurt the protector,16
the ruler spared the person,20
the blacksmith teased the person,4
the predecessor begrudged the bartender,27
the people burned the diplomat,19
the ruler understood the kids,20
the prince bandaged the pedestrian,12
the blacksmith pulled the educator,4
the healer fancied the scribe,10
the roommate lectured the theologian,25
the violinist fed the seller,24
the principal found the lover,7
the principal decorated the educator,7
the islamist believed the scribe,3
the mother decorated the seller,17
the lad saw the employee,6
the settler carried the villain,1
the mother shampooed the designer,17
the violinist spared the father,24
the governor bruised the kids,11
the provider begrudged the senator,15
the settler froze the lover,1
the bolshevik showed the educator,21
the survivor burned the senator,14
the people froze the headmaster,19
the provider saw the squire,15
the governor spared the regulator,11
the bolshevik pricked the regulator,21
the explorer restored the partner,29
the widow pricked the pedestrian,22
the mother decorated the lover,17
the blacksmith elected the headmaster,4
the respondent fancied the scribe,9
the governor liked the senator,11
the governor liked the bartender,11
the respondent addressed the jurist,9
the healer blanketed the lover,10
the governor restored the educator,11
the provider saw the theologian,15
the diver found the senator,23
the violinist shampooed the father,24
the foreigner burned the villain,2
the provider halted the theologian,15
the respondent teased the employee,9
the principal bandaged the partner,7
the blogger battered the landowner,18
the healer lectured the villain,10
the explorer whirled the theologian,29
the widow begrudged the father,22
the provider moved the seller,15
the prosecutor hurt the father,28
the bolshevik battered the squire,21
the prince spared the landowner,12
the sucker froze the educator,13
the pitcher cleaned the regulator,0
the prince bandaged the father,12
the bolshevik believed the jurist,21
the explorer shampooed the lover,29
the settler saw the seller,1
the explorer choked the father,29
the diver fed the headmaster,23
the governor showed the jurist,11
the roommate believed the bartender,25
the healer kicked the loser,10
the widow charged the scribe,22
the blacksmith spared the headmaster,4
the prosecutor told the foreman,28
the diver devoured the loser,23
the bard mailed the bartender,8
the ruler fed the senator,20
the survivor decorated the scribe,14
the lad singed the headmaster,6
the pitcher elected the protector,0
the pirate believed the educator,16
the predecessor shampooed the deputy,27
