the pitcher choked the landowner,0
the healer twirled the diplomat,10
the blacksmith found the deputy,4
the prince moved the loser,12
the lad devoured the jurist,6
the pirate moved the protector,16
the mother dirtied the person,17
the survivor believed the regulator,14
the widow blanketed the lover,22
the roommate dirtied the seller,25
the pitcher injured the scribe,0
the violinist masked the employee,24
the pirate singed the theologian,16
the bard liked the regulator,8
the diver cleaned the regulator,23
the survivor drenched the partner,14
the foreigner lectured the foreman,2
the widow begrudged the squire,22
the survivor saw the theologian,14
the principal understood the landowner,7
the blacksmith singed the person,4
the bard drenched the partner,8
the violinist restored the theologian,24
the mother decorated the kids,17
the widow pricked the regulator,22
the sucker flashed the deputy,13
the widow flashed the seller,22
the explorer found the villain,29
the blogger twirled the jurist,18
the mother drenched the regulator,17
the blogger whirled the jurist,18
the respondent addressed the diplomat,9
the hero singed the protector,5
the people fancied the theologian,19
the bolshevik injured the designer,21
the settler moved the headmaster,1
the roommate blanketed the designer,25
the widow dirtied the landowner,22
the healer halted the loser,10
the settler masked the pedestrian,1
the explorer begrudged the landowner,29
the prince hurt the regulator,12
the widow lectured the villain,22
the bolshevik flashed the seller,21
the explorer teased the headmaster,29
the diver addressed the educator,23
the principal bruised the lover,7
the sucker halted the lover,13
the diver masked the kids,23
the pitcher bruised the kids,0
the governor begrudged the partner,11
the sucker found the regulator,13
the pirate froze the headmaster,16
the healer saw the father,10
the sucker cleaned the foreman,13
the bard twirled the lover,8
the governor bandaged the designer,11
the principal injected the bartender,7
the roommate understood the employee,25
the blacksmith shampooed the foreman,4
the people carried the diplomat,19
the people injured the bartender,19
the bolshevik moved the senator,21
the ruler elected the jurist,20
the hero decorated the diplomat,5
the diver burned the seller,23
the blogger mailed the foreman,18
the pirate choked the pedestrian,16
the diver pricked the partner,23
the prince froze the lover,12
the violinist liked the scribe,24
the roommate addressed the headmaster,25
the principal froze the loser,7
the foreigner told the foreman,2
the bolshevik served the educator,21
the principal concealed the squire,7
the blogger cleaned the headmaster,18
the pitcher cleaned the landowner,0
the widow believed the regulator,22
the predecessor fed the senator,27
the islamist shampooed the headmaster,3
the prosecutor singed the deputy,28
the bard cleaned the father,8
the prince told the kids,12
the people shampooed the loser,19
the provider told the person,15
the widow choked the person,22
the hero nicked the kids,5
the governor concealed the loser,11
the pitcher burned the kids,0
the violinist pricked the diplomat,24
the respondent decorated the regulator,9
the predecessor concealed the regulator,27
the blogger dirtied the protector,18
the people found the jurist,19
the bolshevik nicked the landowner,21
the diver scraped the protector,23
the sucker fed the deputy,13
the people singed the designer,19
the predecessor decorated the employee,27
the lad charged the deputy,6
the survivor halted the person,14
the principal halted the landowner,7
the bard moved the deputy,8
the pitcher bruised the designer,0
the survivor liked the employee,14
the blacksmith choked the employee,4
the predecessor fed the partner,27
the bard devoured the seller,8
the people teased the educator,19
the predecessor bruised the partner,27
the widow masked the protector,22
the respondent addressed the bartender,9
the pitcher flashed the squire,0
the predecessor lectured the lover,27
the bolshevik bandaged the foreman,21
the settler hurt the theologian,1
the people pulled the landowner,19
the explorer nicked the protector,29
the blogger burned the headmaster,18
the principal found the senator,7
the mother decorated the scribe,17
the survivor found the pedestrian,14
the foreigner pricked the loser,2
the playwright restored the headmaster,26
the prosecutor mailed the bartender,28
the violinist halted the pedestrian,24
the bard singed the employee,8
the widow pulled the deputy,22
the ruler dirtied the seller,20
the diver singed the employee,23
the bard addressed the educator,8
the pitcher froze the kids,0
the foreigner masked the seller,2
the islamist begrudged the senator,3
the playwright liked the loser,26
the islamist decorated the loser,3
the pirate begrudged the foreman,16
the islamist cleaned the father,3
the predecessor showed the regulator,27
the pitcher blanketed the scribe,0
the settler choked the kids,1
the people fined the loser,19
the playwright hurt the villain,26
the prince cleaned the father,12
the predecessor kicked the foreman,27
the foreigner moved the headmaster,2
the lad singed the squire,6
the widow fed the father,22
the playwright blanketed the regulator,26
the mother decorated the pedestrian,17
the survivor twirled the jurist,14
the prince pulled the partner,12
the provider shampooed the foreman,15
the healer carried the scribe,10
the violinist begrudged the theologian,24
the blacksmith flashed the diplomat,4
the people singed the seller,19
the prosecutor believed the jurist,28
the pitcher burned the educator,0
the healer teased the lover,10
the diver halted the kids,23
the diver restored the kids,23
the mother choked the employee,17
the pitcher burned the squire,0
the prosecutor kicked the seller,28
the bard addressed the kids,8
the settler liked the kids,1
the sucker spared the foreman,13
the bolshevik injected the deputy,21
the principal concealed the villain,7
the hero lectured the foreman,5
the widow found the diplomat,22
the blacksmith injected the squire,4
the principal masked the lover,7
the mother spared the senator,17
the playwright burned the jurist,26
the sucker decorated the diplomat,13
the foreigner carried the villain,2
the healer carried the foreman,10
the diver injected the partner,23
the hero believed the protector,5
the islamist froze the headmaster,3
the explorer cleaned the squire,29
the bolshevik kicked the bartender,21
the healer carried the protector,10
the respondent pricked the squire,9
the bolshevik concealed the seller,21
the diver singed the educator,23
the pitcher fed the seller,0
the healer bandaged the theologian,10
the violinist flashed the educator,24
the settler mailed the theologian,1
the predecessor bandaged the senator,27
the hero concealed the villain,5
the explorer told the squire,29
the lad froze the lover,6
the mother injured the foreman,17
the mother pulled the kids,17
the diver masked the senator,23
the blacksmith understood the regulator,4
the principal concealed the seller,7
the blacksmith devoured the scribe,4
the mother blanketed the diplomat,17
the widow halted the educator,22
the predecessor shampooed the father,27
the blacksmith saw the regulator,4
the widow restored the squire,22
the roommate charged the headmaster,25
the pitcher scraped the father,0
the ruler believed the villain,20
the explorer injected the deputy,29
the foreigner twirled the scribe,2
the violinist singed the lover,24
the pirate bruised the partner,16
the sucker believed the senator,13
the principal mailed the squire,7
the mother fancied the deputy,17
the blacksmith burned the jurist,4
the playwright fed the person,26
the sucker decorated the senator,13
the sucker understood the educator,13
the survivor teased the kids,14
the diver nicked the regulator,23
the diver pricked the seller,23
the roommate singed the pedestrian,25
the principal moved the educator,7
the ruler begrudged the jurist,20
the ruler spared the landowner,20
the ruler served the jurist,20
the respondent injected the bartender,9
the settler carried the employee,1
the prosecutor carried the villain,28
the prosecutor fancied the foreman,28
the ruler shampooed the deputy,20
the hero scraped the landowner,5
the mother showed the kids,17
the foreigner showed the scribe,2
the islamist lectured the headmaster,3
the blogger burned the partner,18
the violinist found the scribe,24
the settler shampooed the pedestrian,1
the widow carried the senator,22
the violinist blanketed the senator,24
the survivor pulled the regulator,14
the bard told the deputy,8
the violinist found the lover,24
the diver halted the pedestrian,23
the diver singed the deputy,23
the survivor burned the scribe,14
the widow elected the person,22
the bard carried the landowner,8
the settler choked the loser,1
the provider addressed the jurist,15
the playwright elected the kids,26
the blogger hurt the kids,18
the pitcher teased the lover,0
the explorer carried the bartender,29
the islamist twirled the person,3
the principal blanketed the father,7
the people concealed the theologian,19
the settler decorated the headmaster,1
the foreigner scraped the lover,2
the playwright shampooed the foreman,26
the explorer kicked the person,29
the blacksmith battered the designer,4
the predecessor bandaged the employee,27
the roommate fancied the designer,25
the islamist mailed the diplomat,3
the pitcher masked the jurist,0
the explorer bruised the person,29
the prosecutor liked the loser,28
the lad twirled the designer,6
the roommate twirled the headmaster,25
the prosecutor elected the squire,28
the roommate addressed the loser,25
the survivor spared the senator,14
the foreigner restored the seller,2
the explorer drenched the jurist,29
the predecessor served the educator,27
the blogger told the person,18
the survivor teased the scribe,14
the principal fined the villain,7
the survivor lectured the pedestrian,14
the sucker pricked the educator,13
the governor pricked the scribe,11
the pirate flashed the foreman,16
the mother decorated the jurist,17
the hero decorated the landowner,5
the lad flashed the senator,6
the bolshevik kicked the designer,21
the blacksmith spared the regulator,4
the prosecutor saw the father,28
the sucker charged the person,13
the bolshevik bandaged the person,21
the bard mailed the employee,8
the respondent moved the regulator,9
the foreigner hurt the seller,2
the settler concealed the regulator,1
the prince kicked the partner,12
the lad pulled the senator,6
the ruler singed the regulator,20
the sucker cleaned the employee,13
the blacksmith bandaged the designer,4
the mother pulled the senator,17
the provider begrudged the educator,15
the settler scraped the jurist,1
the explorer battered the bartender,29
the people lectured the landowner,19
the settler moved the scribe,1
the survivor fed the kids,14
the pirate spared the regulator,16
the people masked the regulator,19
the blogger believed the pedestrian,18
the foreigner saw the educator,2
the healer bruised the jurist,10
the mother masked the bartender,17
the playwright mailed the villain,26
the mother liked the kids,17
the settler battered the loser,1
the islamist decorated the employee,3
the roommate restored the person,25
the survivor believed the educator,14
the governor fancied the villain,11
the blogger charged the senator,18
the islamist injured the designer,3
the ruler saw the kids,20
the provider blanketed the protector,15
the roommate kicked the pedestrian,25
the foreigner spared the foreman,2
the survivor believed the designer,14
the mother injected the partner,17
the pitcher burned the foreman,0
the bard elected the regulator,8
the healer pricked the protector,10
the predecessor singed the deputy,27
the blogger cleaned the regulator,18
the blogger believed the deputy,18
the healer drenched the seller,10
the principal devoured the jurist,7
the bolshevik restored the loser,21
the blogger fed the deputy,18
the mother bruised the senator,17
the predecessor dirtied the jurist,27
the ruler teased the pedestrian,20
the healer singed the squire,10
the principal whirled the deputy,7
the foreigner bruised the loser,2
the blogger injected the squire,18
the prince blanketed the landowner,12
the provider carried the seller,15
the lad showed the regulator,6
the islamist nicked the father,3
the bard restored the deputy,8
the playwright elected the landowner,26
the principal halted the foreman,7
the widow injured the deputy,22
the ruler injured the protector,20
the bard pulled the deputy,8
the blacksmith shampooed the designer,4
the settler singed the deputy,1
the settler bandaged the designer,1
the people scraped the designer,19
the mother addressed the villain,17
the provider pricked the protector,15
the predecessor battered the person,27
the foreigner decorated the lover,2
the hero bandaged the seller,5
the sucker singed the seller,13
the foreigner injured the person,2
the islamist blanketed the foreman,3
the bard masked the educator,8
the bard halted the pedestrian,8
the explorer drenched the headmaster,29
the provider told the partner,15
the widow begrudged the diplomat,22
the prosecutor hurt the scribe,28
the prince understood the protector,12
the pitcher dirtied the kids,0
the predecessor charged the protector,27
the pitcher believed the loser,0
the predecessor carried the employee,27
the widow singed the landowner,22
the violinist restored the bartender,24
the blogger froze the regulator,18
the mother teased the kids,17
the lad teased the designer,6
the principal carried the diplomat,7
the predecessor served the senator,27
the lad shampooed the foreman,6
the settler moved the designer,1
the bard froze the headmaster,8
the mother fined the designer,17
the explorer fined the loser,29
the widow saw the pedestrian,22
the ruler served the lover,20
the settler shampooed the loser,1
the diver halted the protector,23
the lad charged the headmaster,6
the people showed the person,19
the blogger spared the theologian,18
the blogger bandaged the theologian,18
the prosecutor injected the theologian,28
the principal elected the diplomat,7
the widow teased the landowner,22
the explorer scraped the senator,29
the mother singed the senator,17
the healer moved the father,10
the healer injured the diplomat,10
the predecessor injured the villain,27
the playwright bruised the squire,26
the respondent understood the kids,9
the settler choked the partner,1
the playwright served the foreman,26
the explorer flashed the educator,29
the explorer drenched the pedestrian,29
the people battered the employee,19
the provider choked the foreman,15
the provider twirled the scribe,15
the playwright masked the kids,26
the pitcher bandaged the father,0
the playwright teased the father,26
the explorer begrudged the loser,29
the hero shampooed the bartender,5
the diver elected the father,23
the ruler showed the squire,20
the roommate fed the partner,25
the diver pricked the person,23
the predecessor dirtied the protector,27
the ruler lectured the regulator,20
the survivor battered the bartender,14
the blacksmith fined the partner,4
the healer fined the headmaster,10
the blogger lectured the seller,18
the mother restored the partner,17
the bolshevik kicked the regulator,21
the roommate choked the squire,25
the blacksmith saw the villain,4
the blogger singed the headmaster,18
the governor cleaned the bartender,11
the healer halted the villain,10
the bolshevik believed the diplomat,21
the explorer shampooed the squire,29
the sucker nicked the landowner,13
the governor battered the theologian,11
the predecessor decorated the theologian,27
the prince spared the villain,12
the principal lectured the bartender,7
the governor singed the landowner,11
the prosecutor charged the partner,28
the blogger whirled the protector,18
the prosecutor blanketed the employee,28
the diver battered the villain,23
the ruler injected the partner,20
the pitcher whirled the diplomat,0
the bolshevik begrudged the educator,21
the bolshevik spared the partner,21
the mother choked the person,17
the provider pulled the bartender,15
the people hurt the kids,19
the respondent concealed the father,9
the islamist elected the loser,3
the bolshevik nicked the loser,21
the diver restored the villain,23
the pitcher bruised the headmaster,0
the prince devoured the landowner,12
the ruler flashed the headmaster,20
the foreigner understood the protector,2
the blacksmith bandaged the headmaster,4
the hero battered the person,5
the explorer fined the foreman,29
the islamist charged the lover,3
the roommate fancied the lover,25
the roommate pulled the bartender,25
the prosecutor shampooed the theologian,28
the playwright understood the kids,26
the lad served the educator,6
the lad begrudged the villain,6
the prince drenched the employee,12
the sucker fancied the seller,13
the explorer saw the theologian,29
the mother hurt the employee,17
the survivor fancied the deputy,14
the survivor kicked the bartender,14
the lad fed the bartender,6
the explorer hurt the theologian,29
the blogger charged the partner,18
the governor drenched the bartender,11
the survivor twirled the protector,14
the hero told the headmaster,5
the pitcher pulled the villain,0
the principal drenched the designer,7
the lad injected the pedestrian,6
the hero bruised the bartender,5
the explorer bruised the diplomat,29
the predecessor concealed the deputy,27
the diver singed the theologian,23
the pirate pulled the partner,16
the sucker understood the headmaster,13
the playwright burned the theologian,26
the survivor fancied the regulator,14
the blacksmith bandaged the regulator,4
the pirate mailed the educator,16
the widow choked the landowner,22
the blogger begrudged the diplomat,18
the blogger teased the landowner,18
the survivor battered the seller,14
the bolshevik halted the foreman,21
the ruler froze the deputy,20
the playwright found the landowner,26
the prince battered the father,12
the prosecutor injected the diplomat,28
the widow spared the father,22
the ruler carried the seller,20
the principal liked the deputy,7
the roommate dirtied the person,25
the explorer restored the theologian,29
the mother masked the partner,17
the pitcher found the headmaster,0
the ruler bruised the landowner,20
the prince saw the squire,12
the governor lectured the theologian,11
the islamist battered the deputy,3
the healer blanketed the foreman,10
the healer pricked the pedestrian,10
the predecessor addressed the father,27
the foreigner pricked the partner,2
the respondent fed the educator,9
the blogger bruised the lover,18
the roommate told the employee,25
the bolshevik liked the father,21
the people devoured the theologian,19
the respondent pricked the senator,9
the mother carried the headmaster,17
the blacksmith carried the bartender,4
the bolshevik showed the person,21
the sucker cleaned the senator,13
the hero halted the employee,5
the pirate carried the bartender,16
the mother saw the bartender,17
the foreigner drenched the designer,2
the principal bandaged the designer,7
the healer froze the educator,10
the violinist found the headmaster,24
the principal decorated the partner,7
the sucker believed the lover,13
the roommate shampooed the pedestrian,25
the provider pricked the deputy,15
the roommate injected the foreman,25
the sucker served the scribe,13
the survivor flashed the kids,14
the settler fed the diplomat,1
the violinist showed the villain,24
the respondent fancied the seller,9
the widow injected the senator,22
the mother dirtied the kids,17
the settler charged the headmaster,1
the islamist whirled the theologian,3
the pitcher devoured the loser,0
the bolshevik showed the loser,21
the foreigner whirled the protector,2
the sucker devoured the landowner,13
the pitcher found the lover,0
the bard found the headmaster,8
the principal twirled the squire,7
the ruler nicked the person,20
the explorer carried the lover,29
the people fancied the seller,19
the lad flashed the villain,6
the prince cleaned the theologian,12
the governor decorated the scribe,11
the pirate bandaged the jurist,16
the foreigner believed the pedestrian,2
the pitcher believed the diplomat,0
the violinist begrudged the designer,24
the blacksmith charged the designer,4
the explorer fancied the educator,29
the survivor told the educator,14
the principal pulled the employee,7
the violinist pulled the senator,24
the widow froze the employee,22
the islamist devoured the educator,3
the provider lectured the jurist,15
the ruler halted the pedestrian,20
the diver scraped the designer,23
the pirate flashed the jurist,16
the diver served the lover,23
the lad addressed the bartender,6
the lad hurt the foreman,6
the hero cleaned the employee,5
the prosecutor showed the pedestrian,28
the islamist shampooed the designer,3
the violinist told the foreman,24
the widow froze the seller,22
the islamist believed the seller,3
the explorer showed the deputy,29
the survivor injected the seller,14
the respondent elected the kids,9
the roommate liked the bartender,25
the prince devoured the partner,12
the widow elected the bartender,22
the lad froze the person,6
the bolshevik teased the seller,21
the survivor bruised the person,14
the predecessor drenched the loser,27
the playwright served the father,26
the diver lectured the bartender,23
the violinist pulled the kids,24
the prosecutor bruised the protector,28
the pitcher twirled the loser,0
the islamist mailed the pedestrian,3
the bolshevik elected the villain,21
the survivor served the foreman,14
the violinist flashed the loser,24
the islamist halted the protector,3
the hero lectured the employee,5
the predecessor liked the lover,27
the violinist pulled the lover,24
the blogger showed the squire,18
the survivor concealed the kids,14
the playwright injected the lover,26
the blogger bandaged the partner,18
the explorer teased the partner,29
the people believed the headmaster,19
the playwright restored the foreman,26
the lad understood the regulator,6
the provider twirled the villain,15
the pirate twirled the protector,16
the explorer moved the jurist,29
the roommate flashed the educator,25
the foreigner saw the kids,2
the provider pricked the villain,15
the islamist served the deputy,3
the ruler masked the educator,20
the hero lectured the diplomat,5
the blogger fined the foreman,18
the respondent masked the person,9
the blogger believed the scribe,18
the roommate fined the diplomat,25
the diver lectured the senator,23
the prosecutor pricked the partner,28
the blacksmith bandaged the landowner,4
the settler battered the partner,1
the prosecutor nicked the educator,28
the diver mailed the pedestrian,23
the violinist saw the deputy,24
the hero nicked the theologian,5
the bolshevik carried the jurist,21
the principal flashed the partner,7
the bolshevik fined the partner,21
the roommate lectured the foreman,25
the survivor drenched the jurist,14
the pirate devoured the seller,16
the blogger pulled the loser,18
the playwright battered the person,26
the prosecutor fined the theologian,28
the respondent battered the regulator,9
the mother elected the headmaster,17
the widow blanketed the diplomat,22
the bolshevik froze the headmaster,21
the mother battered the protector,17
the healer served the foreman,10
the explorer cleaned the deputy,29
the diver injured the designer,23
the settler cleaned the foreman,1
the roommate whirled the seller,25
the bard bandaged the seller,8
the bolshevik masked the partner,21
the provider elected the partner,15
the bard masked the landowner,8
the foreigner carried the employee,2
the widow burned the person,22
the roommate fed the employee,25
the people flashed the jurist,19
the prosecutor drenched the jurist,28
the roommate spared the kids,25
the prosecutor lectured the regulator,28
the foreigner mailed the senator,2
the ruler drenched the loser,20
the pitcher found the villain,0
the mother hurt the kids,17
the hero blanketed the headmaster,5
the bard flashed the bartender,8
the bolshevik showed the regulator,21
the survivor charged the seller,14
the provider flashed the father,15
the settler cleaned the father,1
the diver halted the diplomat,23
the violinist kicked the partner,24
the blogger whirled the deputy,18
the lad bruised the father,6
the islamist decorated the diplomat,3
the healer spared the foreman,10
the prosecutor choked the diplomat,28
the principal elected the educator,7
the principal drenched the regulator,7
the violinist scraped the villain,24
the prosecutor elected the designer,28
the survivor concealed the deputy,14
the principal blanketed the foreman,7
the widow fined the lover,22
the settler restored the designer,1
the hero fined the villain,5
the lad elected the pedestrian,6
the governor served the bartender,11
the playwright charged the employee,26
the lad pricked the deputy,6
the governor injected the seller,11
the principal fed the partner,7
the blogger shampooed the theologian,18
the settler teased the scribe,1
the foreigner injured the bartender,2
the people served the father,19
the prince carried the theologian,12
the predecessor showed the villain,27
the survivor devoured the scribe,14
the lad devoured the deputy,6
the survivor twirled the theologian,14
the pirate singed the scribe,16
the respondent shampooed the regulator,9
the playwright battered the pedestrian,26
