the prosecutor begrudged the theologian,28
the bard restored the regulator,8
the sucker pulled the designer,13
the predecessor blanketed the senator,27
the bard showed the seller,8
the principal fined the senator,7
the playwright liked the deputy,26
the governor addressed the regulator,11
the islamist pulled the scribe,3
the bolshevik masked the scribe,21
the respondent blanketed the villain,9
the lad scraped the regulator,6
the islamist understood the kids,3
the predecessor injected the theologian,27
the lad battered the protector,6
the bolshevik restored the pedestrian,21
the predecessor halted the squire,27
the predecessor showed the employee,27
the provider shampooed the villain,15
the settler drenched the partner,1
the bard pulled the loser,8
the diver mailed the squire,23
the violinist whirled the designer,24
the islamist scraped the theologian,3
the survivor fancied the bartender,14
the hero bandaged the person,5
the explorer shampooed the person,29
the survivor kicked the scribe,14
the respondent injected the landowner,9
the governor lectured the father,11
the roommate charged the landowner,25
the ruler understood the educator,20
the islamist hurt the lover,3
the sucker twirled the jurist,13
the roommate found the employee,25
the bolshevik believed the pedestrian,21
the provider fined the squire,15
the sucker cleaned the lover,13
the pirate scraped the employee,16
the playwright elected the squire,26
the prince froze the squire,12
the prince concealed the employee,12
the prince teased the seller,12
the provider scraped the landowner,15
the roommate nicked the lover,25
the foreigner pricked the educator,2
the lad decorated the foreman,6
the principal lectured the squire,7
the widow fed the employee,22
the bolshevik devoured the theologian,21
the provider concealed the regulator,15
the people showed the father,19
the respondent kicked the partner,9
the provider burned the kids,15
the bard blanketed the scribe,8
the provider twirled the foreman,15
the mother fined the loser,17
the pitcher saw the senator,0
the blogger kicked the deputy,18
the prince restored the lover,12
the settler mailed the villain,1
the provider bruised the villain,15
the mother injured the protector,17
the lad concealed the lover,6
the healer teased the protector,10
the widow bandaged the foreman,22
the diver injected the regulator,23
the settler charged the lover,1
the mother injected the employee,17
the foreigner halted the father,2
the blogger masked the seller,18
the respondent showed the theologian,9
the bolshevik dirtied the squire,21
the islamist served the villain,3
the bard restored the scribe,8
the prosecutor bandaged the senator,28
the prince fined the headmaster,12
the roommate cleaned the seller,25
the governor injured the senator,11
the respondent concealed the person,9
the ruler kicked the senator,20
the respondent served the regulator,9
the settler choked the foreman,1
the governor understood the landowner,11
the settler decorated the jurist,1
the violinist choked the seller,24
the hero devoured the jurist,5
the settler understood the designer,1
the ruler fed the protector,20
the violinist teased the father,24
the healer showed the educator,10
the pirate elected the villain,16
the bolshevik shampooed the protector,21
the prince choked the theologian,12
the survivor blanketed the lover,14
the bard injured the pedestrian,8
the sucker found the squire,13
the governor twirled the employee,11
the bolshevik understood the bartender,21
the playwright bandaged the regulator,26
the ruler spared the loser,20
the provider devoured the scribe,15
the respondent bandaged the deputy,9
the explorer bandaged the senator,29
the bard devoured the jurist,8
the violinist fined the deputy,24
the bolshevik decorated the father,21
the playwright scraped the designer,26
the playwright nicked the squire,26
the hero told the squire,5
the sucker concealed the foreman,13
the principal pulled the headmaster,7
the sucker decorated the scribe,13
the settler nicked the educator,1
the survivor found the educator,14
the ruler singed the landowner,20
the blogger saw the kids,18
the explorer concealed the senator,29
the provider saw the landowner,15
the pirate injured the pedestrian,16
the provider concealed the villain,15
the governor injected the foreman,11
the violinist devoured the diplomat,24
the blogger pulled the squire,18
the bard elected the jurist,8
the lad devoured the partner,6
the people told the lover,19
the provider begrudged the pedestrian,15
the provider believed the squire,15
the survivor spared the diplomat,14
the explorer injected the lover,29
the pitcher injured the kids,0
the bard fined the diplomat,8
the survivor elected the foreman,14
the islamist mailed the educator,3
the survivor nicked the foreman,14
the bard twirled the diplomat,8
the blacksmith showed the loser,4
the people fined the headmaster,19
the violinist cleaned the educator,24
the people scraped the father,19
the people dirtied the loser,19
the healer pulled the diplomat,10
the survivor moved the jurist,14
the widow burned the theologian,22
the respondent hurt the seller,9
the foreigner found the person,2
the blogger restored the educator,18
the islamist found the theologian,3
the prince froze the seller,12
the lad decorated the deputy,6
the governor dirtied the father,11
the foreigner devoured the foreman,2
the playwright nicked the seller,26
the bolshevik bruised the person,21
the roommate mailed the jurist,25
the lad carried the partner,6
the sucker fined the jurist,13
the people carried the theologian,19
the people concealed the jurist,19
the blogger bruised the headmaster,18
the respondent bruised the theologian,9
the mother masked the squire,17
the mother flashed the loser,17
the healer froze the diplomat,10
the sucker pulled the deputy,13
the governor pricked the protector,11
the hero believed the landowner,5
the ruler twirled the bartender,20
the sucker told the landowner,13
the diver moved the senator,23
the explorer liked the jurist,29
the prince spared the jurist,12
the people fed the person,19
the healer fed the pedestrian,10
the bolshevik whirled the seller,21
the settler blanketed the father,1
the pirate served the deputy,16
the mother begrudged the scribe,17
the prosecutor served the jurist,28
the healer charged the senator,10
the diver cleaned the diplomat,23
the foreigner restored the jurist,2
the lad lectured the loser,6
the provider dirtied the designer,15
the bolshevik dirtied the pedestrian,21
the playwright nicked the villain,26
the prosecutor cleaned the pedestrian,28
the healer scraped the kids,10
the ruler burned the person,20
the survivor fancied the designer,14
the ruler begrudged the employee,20
the foreigner flashed the person,2
the blacksmith teased the theologian,4
the hero twirled the diplomat,5
the healer bandaged the foreman,10
the settler devoured the deputy,1
the survivor froze the deputy,14
the islamist lectured the seller,3
the people devoured the seller,19
the ruler hurt the loser,20
the pitcher begrudged the designer,0
the diver addressed the jurist,23
the prosecutor charged the regulator,28
the blacksmith dirtied the loser,4
the widow choked the squire,22
the violinist whirled the kids,24
the provider injured the regulator,15
the governor addressed the employee,11
the hero fancied the person,5
the explorer liked the squire,29
the diver spared the protector,23
the prince nicked the lover,12
the provider burned the loser,15
the hero teased the person,5
the bolshevik cleaned the lover,21
the governor pulled the headmaster,11
the governor injured the foreman,11
the pitcher fined the deputy,0
the islamist fed the landowner,3
the provider froze the father,15
the people decorated the villain,19
the mother decorated the deputy,17
the prince nicked the partner,12
the survivor devoured the educator,14
the hero charged the foreman,5
the survivor addressed the landowner,14
the settler pulled the father,1
the lad found the regulator,6
the provider singed the headmaster,15
the mother dirtied the headmaster,17
the hero concealed the scribe,5
the bolshevik fined the pedestrian,21
the sucker burned the scribe,13
the playwright fined the landowner,26
the playwright moved the senator,26
the healer flashed the father,10
the violinist froze the senator,24
the explorer understood the seller,29
the playwright understood the bartender,26
the explorer injected the jurist,29
the prince fed the foreman,12
the people burned the jurist,19
the pirate choked the person,16
the explorer spared the person,29
the pirate concealed the landowner,16
the sucker saw the scribe,13
the predecessor pulled the protector,27
the governor fed the deputy,11
the playwright bandaged the squire,26
the hero saw the person,5
the prosecutor spared the designer,28
the ruler fed the employee,20
the roommate masked the scribe,25
the bolshevik cleaned the regulator,21
the lad elected the partner,6
the bard addressed the deputy,8
the principal saw the landowner,7
the diver fined the seller,23
the explorer saw the scribe,29
the violinist carried the lover,24
the provider singed the seller,15
the pitcher devoured the kids,0
the prosecutor served the deputy,28
the survivor begrudged the squire,14
the settler pricked the scribe,1
the survivor twirled the employee,14
the sucker found the jurist,13
the roommate elected the father,25
the healer burned the kids,10
the people whirled the protector,19
the pirate flashed the regulator,16
the roommate moved the kids,25
the islamist carried the kids,3
the blacksmith moved the loser,4
the blacksmith restored the father,4
the pitcher halted the headmaster,0
the predecessor liked the father,27
the people singed the deputy,19
the governor cleaned the deputy,11
the mother mailed the educator,17
the bard decorated the person,8
the hero saw the pedestrian,5
the violinist concealed the kids,24
the islamist fancied the educator,3
the prince kicked the diplomat,12
the people pulled the kids,19
the blacksmith bruised the protector,4
the ruler bandaged the protector,20
the predecessor halted the deputy,27
the explorer saw the designer,29
the hero nicked the villain,5
the explorer masked the villain,29
the healer fancied the foreman,10
the diver concealed the deputy,23
the ruler whirled the foreman,20
the pitcher dirtied the diplomat,0
the diver injured the educator,23
the respondent concealed the jurist,9
the widow told the diplomat,22
the pitcher begrudged the seller,0
the islamist fed the loser,3
the sucker pulled the loser,13
the blogger spared the jurist,18
the principal kicked the educator,7
the predecessor drenched the villain,27
the prosecutor served the pedestrian,28
the mother lectured the jurist,17
the prince choked the landowner,12
the lad showed the designer,6
the prince lectured the landowner,12
the healer twirled the headmaster,10
the healer charged the landowner,10
the foreigner elected the bartender,2
the diver kicked the protector,23
the bolshevik charged the headmaster,21
the respondent injected the diplomat,9
the lad pricked the person,6
the violinist fined the lover,24
the bolshevik mailed the senator,21
the roommate begrudged the loser,25
the mother drenched the seller,17
the playwright begrudged the protector,26
the ruler served the bartender,20
the explorer shampooed the loser,29
the healer devoured the diplomat,10
the people teased the deputy,19
the ruler halted the theologian,20
the widow masked the villain,22
the explorer masked the landowner,29
the people devoured the loser,19
the ruler burned the senator,20
the lad understood the father,6
the respondent believed the diplomat,9
the bolshevik whirled the educator,21
the pirate liked the diplomat,16
the healer told the seller,10
the diver addressed the protector,23
the bolshevik twirled the senator,21
the foreigner spared the bartender,2
the foreigner restored the scribe,2
the bard understood the person,8
the widow carried the scribe,22
the people shampooed the landowner,19
the sucker carried the seller,13
the pitcher shampooed the scribe,0
the blacksmith lectured the lover,4
the people dirtied the seller,19
the islamist fined the regulator,3
the blacksmith dirtied the regulator,4
the mother fined the partner,17
the blacksmith fined the protector,4
the bolshevik battered the designer,21
the blogger elected the scribe,18
the pitcher kicked the jurist,0
the foreigner nicked the father,2
the provider decorated the kids,15
the prosecutor elected the headmaster,28
the foreigner elected the lover,2
the governor choked the person,11
the provider cleaned the lover,15
the diver told the employee,23
the playwright moved the diplomat,26
the survivor flashed the headmaster,14
the bolshevik found the regulator,21
the playwright battered the deputy,26
the lad believed the scribe,6
the bard scraped the pedestrian,8
the provider choked the pedestrian,15
the pirate bandaged the father,16
the prince battered the loser,12
the sucker singed the headmaster,13
the people whirled the educator,19
the roommate fined the loser,25
the sucker whirled the jurist,13
the bolshevik whirled the diplomat,21
the violinist scraped the foreman,24
the roommate dirtied the squire,25
the hero understood the kids,5
the bolshevik flashed the designer,21
the principal injected the father,7
the violinist carried the squire,24
the bard pulled the partner,8
the playwright served the employee,26
the lad halted the deputy,6
the explorer hurt the bartender,29
the sucker concealed the employee,13
the explorer scraped the designer,29
the playwright shampooed the employee,26
the settler injured the father,1
the foreigner mailed the squire,2
the roommate hurt the diplomat,25
the diver fined the person,23
the prosecutor carried the foreman,28
the survivor saw the protector,14
the pirate served the designer,16
the settler dirtied the jurist,1
the pirate concealed the pedestrian,16
the sucker liked the villain,13
the healer cleaned the employee,10
the mother pricked the kids,17
the pitcher elected the employee,0
the foreigner drenched the jurist,2
the bard bandaged the deputy,8
the lad decorated the squire,6
the survivor froze the partner,14
the predecessor concealed the seller,27
the people found the loser,19
the provider whirled the headmaster,15
the respondent halted the designer,9
the blacksmith told the loser,4
the widow bruised the theologian,22
the blacksmith halted the scribe,4
the blogger drenched the foreman,18
the roommate spared the senator,25
the violinist told the designer,24
the blacksmith drenched the educator,4
the respondent liked the regulator,9
the ruler injured the educator,20
the explorer whirled the person,29
the survivor twirled the pedestrian,14
the foreigner elected the theologian,2
the prosecutor froze the squire,28
the mother fancied the person,17
the predecessor addressed the lover,27
the roommate liked the diplomat,25
the mother halted the headmaster,17
the blacksmith injured the deputy,4
the foreigner cleaned the loser,2
the bolshevik addressed the educator,21
the foreigner masked the protector,2
the mother flashed the theologian,17
the bard moved the foreman,8
the explorer served the person,29
the governor pulled the foreman,11
the prince restored the loser,12
the blogger elected the lover,18
the pirate served the foreman,16
the playwright concealed the father,26
the governor hurt the squire,11
the lad fancied the pedestrian,6
the lad fancied the partner,6
the bolshevik told the villain,21
the sucker showed the senator,13
the prince believed the father,12
the violinist carried the villain,24
the mother addressed the educator,17
the foreigner teased the seller,2
the survivor elected the diplomat,14
the islamist spared the jurist,3
the pirate injured the headmaster,16
the roommate teased the loser,25
the hero liked the pedestrian,5
the predecessor served the kids,27
the healer shampooed the person,10
the islamist understood the lover,3
the sucker served the diplomat,13
the sucker fined the diplomat,13
the pirate battered the protector,16
the provider bruised the designer,15
the pirate pricked the villain,16
the widow carried the employee,22
the blogger masked the partner,18
the sucker understood the designer,13
the people moved the squire,19
the bolshevik told the loser,21
the islamist restored the regulator,3
the settler believed the designer,1
the blogger told the educator,18
the bard flashed the scribe,8
the islamist addressed the landowner,3
the blogger kicked the squire,18
the ruler fancied the father,20
the respondent believed the deputy,9
the playwright addressed the educator,26
the pirate believed the pedestrian,16
the playwright scraped the landowner,26
the explorer halted the theologian,29
the violinist shampooed the regulator,24
the prince kicked the bartender,12
the predecessor fancied the lover,27
the lad concealed the regulator,6
the islamist lectured the designer,3
the respondent pricked the bartender,9
the bard flashed the regulator,8
the bolshevik choked the landowner,21
the pirate lectured the bartender,16
the survivor decorated the senator,14
the explorer liked the protector,29
the ruler kicked the diplomat,20
the blacksmith bandaged the foreman,4
the hero drenched the person,5
the provider shampooed the pedestrian,15
the islamist saw the diplomat,3
the respondent masked the theologian,9
the bard halted the headmaster,8
the predecessor fancied the father,27
the islamist drenched the designer,3
the bolshevik believed the squire,21
the playwright mailed the employee,26
the bolshevik hurt the loser,21
the mother cleaned the employee,17
the explorer decorated the person,29
the prince blanketed the squire,12
the principal bandaged the squire,7
the diver dirtied the regulator,23
the respondent froze the protector,9
the bard showed the employee,8
the playwright lectured the person,26
the governor cleaned the jurist,11
the sucker injured the headmaster,13
the sucker carried the father,13
the lad liked the partner,6
the violinist elected the foreman,24
the provider scraped the loser,15
the settler hurt the kids,1
the pirate concealed the theologian,16
the predecessor singed the headmaster,27
the widow told the villain,22
the foreigner told the landowner,2
the healer fancied the loser,10
the widow saw the deputy,22
the islamist addressed the theologian,3
the sucker found the villain,13
the islamist restored the lover,3
the lad injected the deputy,6
the pirate believed the kids,16
the predecessor burned the father,27
the violinist teased the senator,24
the hero froze the senator,5
the lad masked the kids,6
the bard pulled the protector,8
the governor kicked the landowner,11
the prince begrudged the person,12
the bard told the scribe,8
the foreigner injured the educator,2
the playwright spared the foreman,26
the mother injected the educator,17
the healer drenched the landowner,10
the playwright kicked the pedestrian,26
the ruler addressed the jurist,20
the prosecutor bruised the loser,28
the explorer elected the jurist,29
the respondent fined the educator,9
the prince scraped the protector,12
the predecessor drenched the lover,27
the pirate dirtied the person,16
the governor believed the bartender,11
the blogger addressed the designer,18
the hero devoured the foreman,5
the governor injured the squire,11
the blogger halted the squire,18
the people battered the educator,19
the provider pulled the employee,15
the prosecutor bruised the person,28
the blogger understood the person,18
the bard lectured the educator,8
the explorer understood the employee,29
the predecessor drenched the foreman,27
the respondent pricked the partner,9
the blogger froze the deputy,18
the hero shampooed the partner,5
the bard kicked the theologian,8
the diver showed the educator,23
the playwright believed the deputy,26
the principal teased the bartender,7
the pirate hurt the landowner,16
the people drenched the lover,19
the bard decorated the headmaster,8
the healer whirled the seller,10
the blacksmith fed the villain,4
the healer fined the foreman,10
the lad fancied the father,6
the governor fancied the lover,11
the playwright flashed the regulator,26
the prince singed the person,12
the bolshevik dirtied the scribe,21
the healer devoured the educator,10
the provider decorated the scribe,15
the provider lectured the scribe,15
the survivor fed the senator,14
the roommate devoured the landowner,25
the prince carried the protector,12
the pitcher addressed the headmaster,0
the blacksmith halted the educator,4
the islamist halted the kids,3
the ruler carried the employee,20
the explorer moved the scribe,29
the playwright understood the landowner,26
the prince teased the scribe,12
the prosecutor lectured the person,28
the healer told the foreman,10
the violinist whirled the jurist,24
the prosecutor cleaned the senator,28
the predecessor burned the pedestrian,27
the explorer elected the regulator,29
the roommate bandaged the kids,25
the prince elected the regulator,12
the respondent carried the senator,9
the survivor injured the seller,14
the predecessor concealed the jurist,27
the respondent spared the employee,9
the blogger teased the kids,18
the prince dirtied the landowner,12
the survivor bandaged the headmaster,14
the hero fined the squire,5
the violinist injured the educator,24
the widow begrudged the employee,22
the provider charged the headmaster,15
the people fed the landowner,19
the survivor fined the educator,14
the healer spared the loser,10
the bard twirled the villain,8
the violinist singed the person,24
the pitcher spared the pedestrian,0
the sucker charged the theologian,13
the ruler dirtied the scribe,20
the violinist charged the person,24
the diver scraped the deputy,23
the prosecutor devoured the loser,28
the pirate masked the lover,16
the pirate elected the landowner,16
the healer saw the lover,10
the violinist charged the employee,24
the explorer flashed the loser,29
the survivor singed the diplomat,14
the roommate charged the educator,25
the explorer told the pedestrian,29
the mother believed the seller,17
the survivor liked the jurist,14
the hero kicked the foreman,5
the roommate injured the kids,25
the lad blanketed the lover,6
the governor moved the protector,11
the lad choked the senator,6
the violinist singed the seller,24
the prince carried the bartender,12
the blacksmith scraped the designer,4
the foreigner singed the seller,2
the blacksmith saw the partner,4
the mother teased the educator,17
the explorer lectured the diplomat,29
the respondent saw the theologian,9
the principal saw the lover,7
the principal hurt the partner,7
the bard twirled the father,8
the lad decorated the educator,6
the prince spared the senator,12
the widow told the landowner,22
the roommate elected the kids,25
the respondent teased the person,9
the islamist injured the villain,3
the diver bandaged the squire,23
the governor froze the lover,11
the bolshevik choked the squire,21
the sucker shampooed the bartender,13
the pitcher halted the senator,0
the sucker burned the educator,13
the provider fancied the deputy,15
the mother lectured the diplomat,17
the sucker drenched the regulator,13
the bard pulled the pedestrian,8
the settler pricked the villain,1
the roommate spared the theologian,25
the explorer restored the senator,29
the roommate addressed the deputy,25
the governor decorated the regulator,11
the diver blanketed the foreman,23
the ruler drenched the headmaster,20
the widow bandaged the protector,22
the pitcher injected the deputy,0
the governor charged the pedestrian,11
the blogger battered the pedestrian,18
the lad drenched the employee,6
the governor burned the headmaster,11
the principal hurt the regulator,7
the respondent told the landowner,9
the respondent moved the pedestrian,9
the governor flashed the jurist,11
the roommate carried the designer,25
the respondent kicked the lover,9
the ruler understood the diplomat,20
the pirate carried the lover,16
the principal fancied the seller,7
the settler scraped the kids,1
the predecessor liked the employee,27
the lad liked the seller,6
the people pricked the pedestrian,19
the diver lectured the kids,23
the prince flashed the bartender,12
the people concealed the squire,19
the governor injected the villain,11
the lad cleaned the squire,6
the islamist dirtied the father,3
the predecessor liked the landowner,27
the hero decorated the employee,5
the blacksmith flashed the lover,4
the respondent dirtied the jurist,9
the sucker pricked the person,13
the settler nicked the scribe,1
the foreigner twirled the father,2
the lad restored the foreman,6
the explorer hurt the person,29
the ruler decorated the jurist,20
the governor teased the theologian,11
the prince charged the bartender,12
the diver mailed the scribe,23
the governor pricked the headmaster,11
the diver bandaged the kids,23
the pirate spared the lover,16
the sucker understood the landowner,13
the pirate injected the loser,16
the diver fancied the scribe,23
the pitcher begrudged the senator,0
the sucker elected the loser,13
the hero fancied the jurist,5
the playwright kicked the protector,26
the predecessor dirtied the seller,27
the roommate liked the protector,25
the people carried the employee,19
the hero scraped the loser,5
the hero devoured the regulator,5
the pitcher understood the foreman,0
the foreigner kicked the senator,2
the blogger told the father,18
the diver bandaged the pedestrian,23
