the blogger twirled the bartender,18
the roommate mailed the educator,25
the islamist halted the scribe,3
the prince froze the landowner,12
the survivor spared the designer,14
the mother whirled the squire,17
the principal twirled the seller,7
the respondent burned the theologian,9
the blacksmith fed the deputy,4
the blogger teased the foreman,18
the ruler found the scribe,20
the islamist flashed the educator,3
the pirate showed the father,16
the healer moved the bartender,10
the blacksmith froze the loser,4
the bard found the landowner,8
the healer carried the senator,10
the governor kicked the kids,11
the predecessor charged the loser,27
the bard found the pedestrian,8
the widow served the person,22
the respondent nicked the partner,9
the mother served the seller,17
the prosecutor begrudged the foreman,28
the violinist dirtied the villain,24
the predecessor teased the landowner,27
the sucker served the person,13
the bard pricked the designer,8
the provider whirled the lover,15
the provider liked the theologian,15
the survivor bruised the villain,14
the healer twirled the landowner,10
the pirate dirtied the regulator,16
the healer singed the foreman,10
the settler restored the pedestrian,1
the mother pulled the lover,17
the roommate singed the deputy,25
the ruler liked the theologian,20
the widow masked the educator,22
the widow teased the educator,22
the mother fined the father,17
the roommate lectured the villain,25
the healer nicked the father,10
the predecessor mailed the partner,27
the sucker battered the regulator,13
the provider believed the kids,15
the pitcher battered the deputy,0
the blacksmith halted the jurist,4
the mother served the diplomat,17
the foreigner flashed the foreman,2
the roommate injured the seller,25
the provider concealed the person,15
the widow charged the protector,22
the widow choked the deputy,22
the people moved the educator,19
the diver injected the seller,23
the explorer restored the protector,29
the mother understood the headmaster,17
the bolshevik twirled the kids,21
the governor halted the partner,11
the islamist bruised the seller,3
the blogger addressed the villain,18
the prince whirled the deputy,12
the settler drenched the theologian,1
the explorer battered the deputy,29
the sucker understood the partner,13
the diver flashed the partner,23
the hero restored the landowner,5
the provider bandaged the protector,15
the bolshevik addressed the squire,21
the survivor singed the foreman,14
the prince devoured the jurist,12
the pirate showed the landowner,16
the settler shampooed the kids,1
the survivor showed the headmaster,14
the bard fancied the villain,8
the roommate found the pedestrian,25
the pitcher believed the designer,0
the sucker mailed the lover,13
the predecessor spared the protector,27
the prince halted the deputy,12
the provider cleaned the diplomat,15
the bard singed the villain,8
the playwright choked the senator,26
the mother mailed the seller,17
the mother choked the regulator,17
the blacksmith addressed the protector,4
the widow bandaged the father,22
the lad moved the father,6
the respondent told the regulator,9
the people halted the employee,19
the foreigner twirled the headmaster,2
the prince burned the scribe,12
the mother served the lover,17
the diver blanketed the squire,23
the ruler liked the partner,20
the violinist choked the foreman,24
the principal hurt the jurist,7
the lad blanketed the pedestrian,6
the principal shampooed the protector,7
the bard singed the kids,8
the governor battered the regulator,11
the lad devoured the diplomat,6
the survivor scraped the protector,14
the ruler cleaned the landowner,20
the healer charged the seller,10
the bard carried the father,8
the prince nicked the squire,12
the widow decorated the lover,22
the foreigner froze the regulator,2
the roommate nicked the kids,25
the survivor saw the headmaster,14
the widow addressed the scribe,22
the bolshevik masked the employee,21
the islamist charged the theologian,3
the violinist lectured the loser,24
the mother told the designer,17
the pirate decorated the regulator,16
the explorer begrudged the senator,29
the prince liked the employee,12
the widow froze the lover,22
the bolshevik decorated the seller,21
the sucker blanketed the bartender,13
the mother teased the scribe,17
the foreigner devoured the kids,2
the prince bruised the partner,12
the hero fined the diplomat,5
the settler shampooed the protector,1
the roommate carried the partner,25
the ruler battered the partner,20
the governor singed the lover,11
the pirate decorated the scribe,16
the sucker cleaned the educator,13
the roommate concealed the jurist,25
the hero spared the headmaster,5
the diver fancied the diplomat,23
the ruler mailed the educator,20
the prince hurt the employee,12
the foreigner masked the jurist,2
the ruler burned the designer,20
the respondent cleaned the partner,9
the pitcher restored the loser,0
the bard masked the scribe,8
the sucker restored the kids,13
the sucker fed the foreman,13
the survivor found the designer,14
the principal charged the theologian,7
the roommate restored the pedestrian,25
the bard fed the loser,8
the mother devoured the deputy,17
the mother choked the father,17
the predecessor understood the seller,27
the pitcher restored the employee,0
the principal froze the educator,7
the explorer liked the diplomat,29
the bard carried the headmaster,8
the hero spared the partner,5
the provider understood the scribe,15
the respondent fancied the regulator,9
the bard bruised the headmaster,8
the pitcher lectured the foreman,0
the governor drenched the deputy,11
the blogger masked the person,18
the bolshevik drenched the senator,21
the prince spared the diplomat,12
the governor bandaged the jurist,11
the explorer fancied the pedestrian,29
the roommate flashed the person,25
the respondent believed the regulator,9
the respondent flashed the senator,9
the settler lectured the loser,1
the widow fed the landowner,22
the widow fined the squire,22
the blacksmith injured the headmaster,4
the mother showed the diplomat,17
the principal kicked the designer,7
the mother understood the regulator,17
the blogger fed the lover,18
the bolshevik believed the father,21
the settler singed the regulator,1
the principal halted the employee,7
the prosecutor spared the headmaster,28
the prosecutor mailed the foreman,28
the prince showed the senator,12
the foreigner injected the educator,2
the principal bruised the foreman,7
the blacksmith addressed the regulator,4
the playwright singed the bartender,26
the pirate served the senator,16
the provider cleaned the partner,15
the governor singed the father,11
the blacksmith twirled the villain,4
the people cleaned the diplomat,19
the survivor devoured the lover,14
the blacksmith fined the theologian,4
the explorer dirtied the seller,29
the pitcher pulled the protector,0
the pirate halted the employee,16
the ruler blanketed the person,20
the bard blanketed the foreman,8
the prince charged the pedestrian,12
the bolshevik whirled the partner,21
the bolshevik teased the villain,21
the ruler cleaned the scribe,20
the principal froze the landowner,7
the ruler served the protector,20
the bolshevik scraped the protector,21
the governor masked the landowner,11
the islamist fancied the senator,3
the prosecutor singed the employee,28
the ruler understood the regulator,20
the lad singed the regulator,6
the lad injected the lover,6
the diver moved the employee,23
the blogger choked the senator,18
the pirate injected the senator,16
the bard blanketed the bartender,8
the playwright masked the villain,26
the prince burned the senator,12
the sucker fined the partner,13
the settler fined the scribe,1
the settler bruised the educator,1
the lad liked the bartender,6
the sucker spared the educator,13
the bolshevik devoured the scribe,21
the foreigner served the educator,2
the roommate saw the headmaster,25
the roommate kicked the employee,25
the pitcher injured the squire,0
the bard halted the seller,8
the islamist whirled the villain,3
the settler halted the squire,1
the blogger begrudged the theologian,18
the diver froze the person,23
the people served the kids,19
the people mailed the squire,19
the ruler restored the scribe,20
the explorer told the person,29
the diver bruised the foreman,23
the widow injected the deputy,22
the roommate showed the seller,25
the hero injured the seller,5
the bard restored the employee,8
the prince concealed the headmaster,12
the explorer froze the protector,29
the explorer hurt the landowner,29
the provider dirtied the regulator,15
the respondent restored the theologian,9
the respondent decorated the protector,9
the blogger told the designer,18
the bolshevik blanketed the foreman,21
the governor fined the bartender,11
the people bruised the seller,19
the governor burned the jurist,11
the bard understood the jurist,8
the pirate devoured the deputy,16
the ruler pricked the bartender,20
the hero masked the person,5
the survivor served the employee,14
the respondent fed the partner,9
the diver drenched the educator,23
the principal hurt the designer,7
the survivor concealed the scribe,14
the people pulled the seller,19
the blogger restored the loser,18
the widow flashed the kids,22
the settler lectured the seller,1
the ruler bandaged the scribe,20
the prince singed the employee,12
the blacksmith whirled the theologian,4
the blogger injected the pedestrian,18
the governor mailed the bartender,11
the provider scraped the protector,15
the prince fined the landowner,12
the hero blanketed the bartender,5
the prince blanketed the theologian,12
the settler elected the headmaster,1
the explorer charged the theologian,29
the islamist saw the educator,3
the mother moved the kids,17
the pirate injected the partner,16
the respondent bruised the deputy,9
the predecessor devoured the scribe,27
the mother singed the deputy,17
the predecessor kicked the bartender,27
the ruler twirled the seller,20
the hero begrudged the regulator,5
the survivor understood the senator,14
the playwright concealed the bartender,26
the diver decorated the seller,23
the settler liked the headmaster,1
the explorer believed the kids,29
the bolshevik singed the lover,21
the bard bandaged the loser,8
the bolshevik bandaged the pedestrian,21
the settler kicked the bartender,1
the pirate moved the jurist,16
the explorer twirled the regulator,29
the bolshevik twirled the lover,21
the blacksmith kicked the theologian,4
the violinist hurt the regulator,24
the mother masked the senator,17
the people understood the headmaster,19
the sucker blanketed the senator,13
the healer served the partner,10
the explorer decorated the kids,29
the prosecutor froze the diplomat,28
the hero burned the loser,5
the people pulled the senator,19
the prosecutor teased the villain,28
the governor restored the pedestrian,11
the islamist spared the pedestrian,3
the prince fined the foreman,12
the roommate fed the headmaster,25
the settler bandaged the regulator,1
the mother battered the senator,17
the predecessor froze the foreman,27
the explorer decorated the designer,29
the pirate shampooed the kids,16
the mother choked the kids,17
the lad told the bartender,6
the bolshevik begrudged the protector,21
the principal charged the father,7
the lad teased the kids,6
the foreigner lectured the villain,2
the ruler served the loser,20
the hero kicked the jurist,5
the people blanketed the bartender,19
the prosecutor shampooed the foreman,28
the widow fancied the diplomat,22
the widow halted the jurist,22
the people saw the diplomat,19
the lad saw the jurist,6
the principal believed the diplomat,7
the playwright elected the foreman,26
the healer begrudged the bartender,10
the bolshevik restored the landowner,21
the playwright scraped the senator,26
the violinist devoured the bartender,24
the widow hurt the senator,22
the islamist believed the designer,3
the lad injected the squire,6
the prosecutor devoured the headmaster,28
the sucker decorated the deputy,13
the hero fancied the employee,5
the mother pricked the educator,17
the violinist bandaged the protector,24
the predecessor dirtied the foreman,27
the predecessor moved the bartender,27
the mother pulled the father,17
the ruler masked the designer,20
the ruler told the protector,20
the bolshevik elected the scribe,21
the prince dirtied the foreman,12
the lad burned the seller,6
the islamist found the bartender,3
the ruler mailed the scribe,20
the predecessor shampooed the pedestrian,27
the blacksmith cleaned the headmaster,4
the predecessor moved the diplomat,27
the roommate understood the seller,25
the prosecutor battered the squire,28
the blacksmith singed the headmaster,4
the diver understood the lover,23
the prince twirled the person,12
the roommate concealed the loser,25
the prosecutor bandaged the employee,28
the governor charged the diplomat,11
the mother served the pedestrian,17
the blogger understood the diplomat,18
the prosecutor bandaged the deputy,28
the foreigner understood the loser,2
the pitcher teased the protector,0
the blogger fined the lover,18
the bard froze the scribe,8
the prosecutor scraped the regulator,28
the bolshevik cleaned the bartender,21
the lad devoured the foreman,6
the prince believed the kids,12
the ruler whirled the regulator,20
the blacksmith restored the jurist,4
the governor injured the deputy,11
the mother pulled the loser,17
the pirate injured the partner,16
the ruler cleaned the jurist,20
the diver found the designer,23
the explorer bruised the partner,29
the bard bruised the partner,8
the people froze the protector,19
the ruler carried the foreman,20
the widow shampooed the loser,22
the widow cleaned the designer,22
the roommate flashed the theologian,25
the survivor halted the squire,14
the lad hurt the squire,6
the respondent told the educator,9
the pitcher drenched the father,0
the diver kicked the bartender,23
the governor liked the partner,11
the widow elected the partner,22
the hero blanketed the lover,5
the bard served the educator,8
the governor lectured the senator,11
the lad bruised the squire,6
the mother pulled the deputy,17
the bard mailed the father,8
the settler injured the pedestrian,1
the sucker saw the employee,13
the blacksmith singed the diplomat,4
the predecessor masked the regulator,27
the governor mailed the headmaster,11
the settler dirtied the father,1
the principal whirled the senator,7
the violinist injured the lover,24
the principal believed the jurist,7
the predecessor hurt the bartender,27
the roommate pulled the landowner,25
the blogger dirtied the educator,18
the prosecutor spared the loser,28
the provider choked the villain,15
the bard flashed the senator,8
the governor injected the employee,11
the blogger fined the father,18
the bolshevik froze the jurist,21
the playwright battered the scribe,26
the mother bandaged the landowner,17
the roommate saw the regulator,25
the sucker liked the foreman,13
the prince found the deputy,12
the blacksmith scraped the theologian,4
the hero fined the deputy,5
the playwright froze the bartender,26
the ruler singed the senator,20
the pirate teased the scribe,16
the violinist lectured the theologian,24
the bard whirled the scribe,8
the ruler kicked the jurist,20
the ruler addressed the lover,20
the foreigner burned the squire,2
the hero hurt the lover,5
the lad decorated the senator,6
the provider blanketed the scribe,15
the islamist blanketed the squire,3
the prosecutor carried the jurist,28
the hero liked the designer,5
the playwright believed the landowner,26
the blacksmith mailed the deputy,4
the prosecutor fined the scribe,28
the diver devoured the protector,23
the settler pulled the partner,1
the diver charged the bartender,23
the mother told the scribe,17
the diver lectured the pedestrian,23
the violinist bandaged the person,24
the blogger battered the loser,18
the lad dirtied the loser,6
the diver understood the person,23
the mother kicked the landowner,17
the mother injured the pedestrian,17
the principal cleaned the seller,7
the diver cleaned the jurist,23
the governor moved the squire,11
the people moved the designer,19
the widow elected the scribe,22
the explorer singed the father,29
the provider moved the deputy,15
the survivor begrudged the loser,14
the governor restored the senator,11
the diver twirled the headmaster,23
the healer nicked the theologian,10
the bolshevik saw the protector,21
the playwright addressed the theologian,26
the blacksmith pulled the theologian,4
the pirate bruised the foreman,16
the prosecutor fancied the jurist,28
the governor hurt the partner,11
the predecessor restored the partner,27
the predecessor restored the pedestrian,27
the bolshevik scraped the educator,21
the bard kicked the pedestrian,8
the blacksmith believed the diplomat,4
the prince choked the deputy,12
the sucker carried the pedestrian,13
the foreigner understood the educator,2
the bolshevik fancied the lover,21
the roommate flashed the foreman,25
the diver pulled the employee,23
the bolshevik concealed the designer,21
the survivor concealed the landowner,14
the bolshevik hurt the senator,21
the survivor moved the scribe,14
the provider fined the educator,15
the bolshevik liked the protector,21
the principal masked the pedestrian,7
the diver addressed the loser,23
the islamist battered the senator,3
the prosecutor blanketed the designer,28
the people whirled the regulator,19
the pitcher fancied the jurist,0
the governor twirled the jurist,11
the playwright decorated the squire,26
the prosecutor drenched the father,28
the violinist twirled the partner,24
the bolshevik injected the employee,21
the blogger burned the protector,18
the playwright fancied the educator,26
the settler fed the kids,1
the violinist told the educator,24
the healer choked the jurist,10
the violinist fined the jurist,24
the bard teased the foreman,8
the roommate understood the pedestrian,25
the bard addressed the father,8
the bard fed the regulator,8
the prosecutor restored the diplomat,28
the pitcher spared the headmaster,0
the bard concealed the pedestrian,8
the playwright bruised the scribe,26
the islamist found the senator,3
the survivor elected the headmaster,14
the prince dirtied the diplomat,12
the prosecutor injected the employee,28
the violinist pulled the loser,24
the playwright kicked the kids,26
the respondent served the kids,9
the violinist saw the foreman,24
the predecessor battered the kids,27
the islamist fed the kids,3
the healer understood the seller,10
the hero devoured the educator,5
the violinist devoured the deputy,24
the healer nicked the squire,10
the bard fed the bartender,8
the settler concealed the lover,1
the playwright fed the jurist,26
the bard bandaged the educator,8
the pirate carried the loser,16
the lad scraped the squire,6
the islamist addressed the headmaster,3
the provider fined the partner,15
the diver found the jurist,23
the roommate blanketed the deputy,25
the diver restored the person,23
the predecessor teased the headmaster,27
the people fined the kids,19
the lad bruised the bartender,6
the blogger carried the foreman,18
the healer scraped the landowner,10
the explorer charged the jurist,29
the blacksmith elected the partner,4
the bard froze the jurist,8
the roommate scraped the scribe,25
the roommate injected the regulator,25
the healer twirled the loser,10
the playwright kicked the villain,26
the foreigner bruised the regulator,2
the blogger pulled the jurist,18
the diver teased the kids,23
the prince found the kids,12
the bard elected the kids,8
the foreigner addressed the employee,2
the bolshevik served the squire,21
the blogger injured the regulator,18
the governor twirled the loser,11
the bard fancied the headmaster,8
the roommate shampooed the bartender,25
the foreigner injured the father,2
the respondent injured the partner,9
the predecessor elected the pedestrian,27
the islamist nicked the deputy,3
the predecessor showed the foreman,27
the bolshevik restored the kids,21
the explorer fined the regulator,29
the explorer flashed the theologian,29
the blacksmith showed the pedestrian,4
the pitcher burned the bartender,0
the lad understood the diplomat,6
the sucker showed the deputy,13
the people pricked the villain,19
the islamist decorated the jurist,3
the prince pulled the kids,12
the prince bandaged the employee,12
the prosecutor charged the employee,28
the explorer bandaged the squire,29
the roommate twirled the employee,25
the diver flashed the jurist,23
the blogger pulled the regulator,18
the bard burned the protector,8
the bard injected the diplomat,8
the foreigner elected the pedestrian,2
the blacksmith moved the designer,4
the violinist hurt the lover,24
the survivor lectured the seller,14
the explorer addressed the squire,29
the respondent nicked the deputy,9
the playwright saw the squire,26
the healer devoured the scribe,10
the lad blanketed the loser,6
the islamist mailed the seller,3
the blogger froze the pedestrian,18
the foreigner shampooed the loser,2
the people fed the pedestrian,19
the survivor teased the diplomat,14
the mother singed the seller,17
the pirate mailed the lover,16
the sucker injured the designer,13
the survivor teased the seller,14
the pitcher twirled the kids,0
the widow pricked the villain,22
the people halted the headmaster,19
the provider fined the designer,15
the foreigner bandaged the jurist,2
the survivor kicked the kids,14
the ruler begrudged the deputy,20
the prince froze the employee,12
the roommate believed the senator,25
the survivor battered the foreman,14
the respondent whirled the deputy,9
the pirate pulled the loser,16
the prince moved the employee,12
the diver bandaged the employee,23
the bolshevik pricked the deputy,21
the settler whirled the villain,1
the provider fined the jurist,15
the governor battered the jurist,11
the foreigner injected the landowner,2
the mother twirled the diplomat,17
the people masked the educator,19
the islamist lectured the jurist,3
the pirate teased the regulator,16
the prosecutor kicked the squire,28
the explorer twirled the villain,29
the settler bandaged the jurist,1
the governor battered the headmaster,11
the bolshevik concealed the diplomat,21
the widow fed the diplomat,22
the survivor masked the headmaster,14
the pirate battered the squire,16
the blogger found the protector,18
the explorer masked the pedestrian,29
the bard battered the foreman,8
the foreigner mailed the lover,2
the sucker begrudged the partner,13
the diver cleaned the lover,23
the islamist bandaged the seller,3
the healer froze the regulator,10
the healer mailed the foreman,10
the bolshevik pricked the educator,21
the sucker kicked the landowner,13
the prosecutor told the kids,28
the settler told the headmaster,1
the principal showed the loser,7
the predecessor masked the loser,27
the diver saw the squire,23
the violinist liked the seller,24
the principal believed the father,7
the pirate choked the theologian,16
the healer bruised the kids,10
the explorer begrudged the partner,29
the settler injected the protector,1
the foreigner found the villain,2
the settler found the headmaster,1
the prosecutor saw the partner,28
the bard carried the squire,8
the roommate fancied the theologian,25
the mother choked the villain,17
the mother dirtied the designer,17
the hero hurt the educator,5
the violinist bruised the villain,24
the people pricked the foreman,19
the widow charged the lover,22
the bolshevik told the partner,21
the lad begrudged the seller,6
the ruler masked the senator,20
the survivor twirled the lover,14
the prince fancied the protector,12
the principal charged the squire,7
the mother showed the employee,17
the pirate served the employee,16
the playwright hurt the partner,26
the diver bruised the protector,23
the sucker served the partner,13
the sucker whirled the partner,13
the pitcher addressed the regulator,0
the people understood the villain,19
the healer spared the designer,10
the principal singed the deputy,7
the provider nicked the jurist,15
the respondent liked the squire,9
the people froze the bartender,19
the predecessor served the partner,27
the blacksmith restored the regulator,4
the respondent scraped the theologian,9
the foreigner singed the regulator,2
the diver carried the seller,23
the mother devoured the senator,17
the explorer choked the educator,29
the islamist pulled the regulator,3
the predecessor restored the squire,27
the hero twirled the partner,5
the blogger elected the employee,18
the people charged the villain,19
the principal restored the landowner,7
the explorer cleaned the kids,29
the blogger believed the headmaster,18
the violinist pricked the loser,24
the settler whirled the foreman,1
the provider twirled the squire,15
the foreigner fancied the regulator,2
the people liked the headmaster,19
the pitcher carried the theologian,0
the prince bruised the diplomat,12
the prince kicked the theologian,12
the settler carried the senator,1
the prosecutor pricked the seller,28
the blacksmith shampooed the diplomat,4
the pirate battered the kids,16
the prince restored the pedestrian,12
the respondent liked the pedestrian,9
the islamist kicked the senator,3
the respondent whirled the kids,9
the roommate choked the foreman,25
the survivor whirled the theologian,14
the playwright nicked the diplomat,26
the islamist injured the headmaster,3
