the warlock named the husband,0
the shrink bound the girlfriend,0
the hero fancied the speakers,0
the engineers tainted the vocalist,1
the grader labeled the technicians,0
the homosexuals saw the vocalist,1
the violinists moved the heroes,1
the sucker lifted the shrinks,0
the technician smothered the vocalists,0
the loyalist carried the speakers,0
the emperors immersed the rabbi,1
the emperors singed the martyrs,1
the merchants fancied the shrinks,1
the grader anointed the heroes,0
the graders singed the lover,1
the speakers appointed the homosexual,1
the engineer served the merchants,0
the rabbi watched the vocalists,0
the loyalist found the engineer,0
the barbarian envied the girlfriends,0
the scribes masked the fishermen,1
the violinists cut the loyalist,1
the enthusiast mentioned the fiances,0
the emperor addressed the fiance,0
the emperor addressed the graders,0
the speaker smothered the fiance,0
the scribes pushed the fisherman,1
the lecturers carried the martyrs,1
the president taught the fiances,0
the parisian revealed the fiances,0
the violinist hated the parisian,0
the speaker taxed the spectator,0
the martyrs showed the boxers,1
the emperors twirled the merchants,1
the  islamists concealed the exile,1
the speakers deluged the  islamists,1
the enthusiasts devoured the mariners,1
the vocalists singed the technicians,1
the mariners immersed the merchants,1
the graders splashed the shrinks,1
the englishmen immersed the emperors,1
the spouses taught the warlock,1
the merchant admired the loyalists,0
the hero spared the warlock,0
the barbarians choked the scribes,1
the merchant decorated the bartender,0
the rulers bandaged the englishman,1
the boxer contaminated the exiles,0
the merchant charged the rulers,0
the mariners devoured the technician,1
the defendants saved the sergeant,1
the defendant addressed the emperor,0
the homosexuals liked the husband,1
the boxers admired the englishman,1
the homosexuals spared the martyr,1
the exile anointed the parisians,0
the shrink begrudged the spouses,0
the governors liked the sergeant,1
the heroes addressed the merchants,1
the sergeants carpeted the islamist,1
the bartender promised the martyr,0
the speakers deluged the homosexual,1
the rabbi labeled the spectator,0
the defendants doused the sergeant,1
the shrink forgave the speakers,0
the programmers showed the emperors,1
the heroes perceived the exile,1
the islamist burned the girlfriends,0
the barbarian loved the presidents,0
the warlocks taxed the spectators,1
the englishman anointed the sucker,0
the writers fancied the spectator,1
the violinist refused the speakers,0
the enthusiast loved the mariners,0
the lecturers anointed the engineer,1
the governor watched the barbarian,0
the englishmen cleaned the sucker,1
the spouses watched the loyalist,1
the shrink perceived the loyalists,0
the vocalists suggested the governors,1
the sergeant forgave the lecturer,0
the martyrs decorated the husband,1
the islamist pushed the homosexuals,0
the presidents carpeted the parisian,1
the shrinks cleaned the technician,1
the shrink labeled the grader,0
the vocalist spared the girlfriends,0
the merchant suggested the exiles,0
the sucker saved the heroes,0
the loyalist fancied the englishman,0
the lover envied the president,0
the sergeants fined the vocalists,1
the exiles bound the martyr,1
the sergeant showed the fishermen,0
the sucker injected the loyalist,0
the martyrs appointed the emperors,1
the parisian told the rabbi,0
the homosexuals understood the rabbi,1
the homosexuals lifted the boxer,1
the technician splashed the parisian,0
the mariners considered the suckers,1
the homosexuals moved the suckers,1
the lovers singed the programmer,1
the violinists showed the barbarians,1
the emperors kicked the fishermen,1
the husband spared the president,0
the president saw the governor,0
the graders saved the lecturers,1
the mariners singed the suckers,1
the graders revealed the lover,1
the hero cleaned the programmers,0
the martyrs appointed the enthusiast,1
the fisherman elected the merchant,0
the sergeants bound the merchants,1
the governor bandaged the speaker,0
the warlock judged the mariners,0
the technicians injected the enthusiasts,1
the boxers concealed the emperor,1
the heroes hated the shrink,1
the rabbis mentioned the writer,1
the boxers cut the exiles,1
the ruler singed the fishermen,0
the speakers dubbed the loyalist,1
the violinist perceived the girlfriend,0
the vocalist restored the exiles,0
the lover contaminated the merchant,0
the violinist loved the  islamists,0
the girlfriends envied the  islamists,1
the president dragged the mariner,0
the  islamists told the rulers,1
the sucker saw the spouses,0
the shrinks charged the suckers,1
the suckers contaminated the spouse,1
the merchants blanketed the defendants,1
the exile moved the girlfriend,0
the scribe mailed the boxers,0
the scribe addressed the boxers,0
the merchant singed the englishman,0
the writers showed the governors,1
the president promised the engineer,0
the englishman told the fishermen,0
the barbarians perceived the martyr,1
the lecturers appointed the technicians,1
the martyr choked the spectator,0
the heroes fined the barbarian,1
the grader deluged the emperors,0
the engineer told the suckers,0
the englishman taught the homosexuals,0
the speaker tainted the fiances,0
the grader judged the enthusiast,0
the lecturers spared the parisian,1
the rabbi admired the spectator,0
the speaker masked the boxer,0
the rabbi fed the technician,0
the speaker immersed the husbands,0
the martyr washed the writer,0
the barbarians envied the warlocks,1
the heroes cleaned the barbarians,1
the husband bound the exile,0
the vocalist dubbed the speakers,0
the bartender decorated the presidents,0
the writers bound the vocalists,1
the rulers rubbed the hero,1
the warlock carried the lovers,0
the enthusiast lifted the presidents,0
the englishman fancied the fiances,0
the barbarians fancied the shrink,1
the merchant decorated the husband,0
the exiles found the parisians,1
the lecturer kicked the englishmen,0
the parisian decorated the heroes,0
the spouse told the lovers,0
the merchants devoured the lecturer,1
the bartender addressed the homosexual,0
the exiles promised the parisian,1
the merchants named the parisian,1
the graders addressed the enthusiast,1
the warlock blanketed the englishman,0
the spouse contaminated the mariner,0
the heroes begrudged the spouse,1
the hero exposed the fiances,0
the warlock suggested the spectator,0
the governors immersed the rulers,1
the writers perceived the barbarian,1
the engineers glimpsed the warlock,1
the programmer tipped the fisherman,0
the speaker injected the homosexual,0
the speakers bathed the president,1
the ruler rubbed the islamist,0
the lover singed the fiances,0
the lecturer doused the writers,0
the husband revealed the lover,0
the barbarians choked the fiance,1
the rulers tipped the defendant,1
the heroes scorched the president,1
the spectators addressed the governors,1
the parisian forgave the programmers,0
the sucker restored the barbarians,0
the lover glimpsed the shrinks,0
the emperor saved the spectator,0
the warlocks admired the engineers,1
the fishermen ate the boxers,1
the barbarians liked the violinists,1
the mariners considered the engineers,1
the warlock labeled the girlfriends,0
the ruler understood the islamist,0
the technicians washed the emperor,1
the violinist appointed the loyalists,0
the technicians told the defendant,1
the emperor deluged the emperors,0
the  islamists saved the husbands,1
the spouses spared the husband,1
the engineers burned the presidents,1
the speakers injected the fiance,1
the martyrs elected the fisherman,1
the lecturer fed the boxers,0
the lecturer saved the spouses,0
the defendants bound the shrink,1
the enthusiasts fancied the lecturer,1
the warlock devoured the technicians,0
the technician drenched the violinists,0
the mariners told the lecturers,1
the heroes cleaned the islamist,1
the ruler saw the presidents,0
the violinists glimpsed the enthusiasts,1
the rabbis blanketed the warlocks,1
the shrinks cut the vocalist,1
the lecturers injected the rabbis,1
the vocalist decorated the suckers,0
the rabbi cut the sergeant,0
the sergeants judged the writers,1
the lovers moved the sergeant,1
the rabbis promised the heroes,1
the violinist carpeted the graders,0
the technician decorated the lover,0
the sucker restored the warlock,0
the fiances carpeted the violinist,1
the islamist mentioned the writers,0
the spectator elected the technician,0
the violinist pushed the rulers,0
the loyalists carried the programmers,1
the shrink doused the defendant,0
the mariner doused the ruler,0
the defendants decorated the emperor,1
the violinists bound the heroes,1
the enthusiast burned the shrinks,0
the loyalist elected the hero,0
the girlfriend sliced the sergeants,0
the suckers injected the martyrs,1
the lecturers bandaged the englishmen,1
the spectator immersed the fiance,0
the defendant judged the fishermen,0
the girlfriend tipped the merchant,0
the homosexuals ate the spectator,1
the lover named the islamist,0
the barbarians served the rulers,1
the lovers loved the parisians,1
the enthusiast bound the engineers,0
the ruler dirtied the homosexuals,0
the lecturers taught the speakers,1
the bartender devoured the lecturers,0
the mariners restored the engineers,1
the fiances choked the bartender,1
the sucker singed the barbarians,0
the vocalist bound the rabbi,0
the homosexual judged the barbarians,0
the husbands blanketed the spectators,1
the sergeants masked the loyalist,1
the programmers liked the fishermen,1
the exile concealed the vocalist,0
the programmers found the emperor,1
the spectators decorated the scribe,1
the lover liked the enthusiasts,0
the shrink promised the girlfriends,0
the barbarians sliced the vocalist,1
the rabbis blanketed the scribes,1
the lover begrudged the parisian,0
the programmer dirtied the sergeant,0
the rabbi labeled the husbands,0
the emperor found the barbarians,0
the scribes liked the spouses,1
the rabbis washed the presidents,1
the homosexuals forgave the girlfriend,1
the grader loved the ruler,0
the vocalists cut the rabbis,1
the fishermen considered the lovers,1
the husbands ate the boxer,1
the enthusiasts mailed the writer,1
the sergeants contaminated the heroes,1
the homosexual considered the rabbis,0
the violinist judged the martyr,0
the warlock promised the governors,0
the parisians admired the scribes,1
the boxer considered the merchant,0
the speaker appointed the spectator,0
the loyalist singed the merchant,0
the shrinks concealed the shrink,1
the scribe bathed the lecturer,0
the fiances cleaned the heroes,1
the fiance showed the  islamists,0
the lecturer bathed the loyalist,0
the vocalists understood the ruler,1
the shrink smothered the lecturers,0
the boxers doused the barbarians,1
the parisians anointed the exiles,1
the graders judged the parisian,1
the enthusiast cut the heroes,0
the martyrs addressed the heroes,1
the fiances refused the technicians,1
the spouses found the englishmen,1
the spouses masked the islamist,1
the vocalist refused the technician,0
the sucker fancied the boxers,0
the presidents fancied the enthusiasts,1
the emperor liked the rabbi,0
the programmers taxed the rabbi,1
the suckers uncovered the sergeants,1
the engineers cleaned the speaker,1
the mariners contaminated the husbands,1
the warlocks immersed the husbands,1
the shrink rubbed the speaker,0
the technician splashed the vocalists,0
the fiance understood the loyalists,0
the speakers kicked the girlfriends,1
the exile charged the engineer,0
the sergeant appointed the parisians,0
the speakers dirtied the englishman,1
the rulers told the fiance,1
the enthusiasts watched the sucker,1
the graders contaminated the technician,1
the spectator restored the engineers,0
the technicians spared the girlfriend,1
the spouses appointed the engineer,1
the spectators envied the warlocks,1
the girlfriend doused the enthusiast,0
the sergeants singed the governors,1
the parisian showed the girlfriend,0
the defendant lifted the spouses,0
the mariner suggested the bartender,0
the parisian fancied the warlock,0
the husband masked the parisians,0
the rabbis singed the warlock,1
the rabbis doused the lecturer,1
the speakers fed the exiles,1
the scribes cut the rabbis,1
the emperor hated the englishman,0
the fishermen concealed the  islamists,1
the defendant uncovered the graders,0
the graders named the violinist,1
the englishman spared the president,0
the heroes found the programmers,1
the parisian bandaged the islamist,0
the spouse promised the enthusiasts,0
the spouses judged the shrinks,1
the shrink bathed the programmer,0
the spouse drenched the violinist,0
the loyalists drenched the fiances,1
the writers ate the speakers,1
the emperors ate the graders,1
the speakers deluged the heroes,1
the writer stained the grader,0
the emperor found the boxers,0
the president liked the grader,0
the sucker found the islamist,0
the vocalist served the loyalists,0
the speakers uncovered the exile,1
the rabbi carpeted the defendant,0
the engineers doused the spouses,1
the grader perceived the merchant,0
the emperor exposed the warlock,0
the rabbis injected the emperor,1
the suckers fed the exile,1
the homosexual choked the governors,0
the warlock bound the exiles,0
the rulers twirled the warlock,1
the sergeant taxed the enthusiasts,0
the graders taught the heroes,1
the fiances concealed the husband,1
the heroes taught the warlock,1
the martyrs lifted the engineer,1
the boxers refused the speakers,1
the parisians carried the englishman,1
the vocalists fed the shrinks,1
the englishmen refused the girlfriend,1
the warlock tipped the sergeant,0
the exile sliced the enthusiast,0
the homosexual considered the writer,0
the grader found the defendants,0
the  islamists tipped the spouses,1
the merchant choked the mariners,0
the graders mentioned the emperor,1
the fisherman burned the parisians,0
the  islamists deluged the fisherman,1
the enthusiasts drenched the mariner,1
the warlock exposed the vocalist,0
the violinist uncovered the technicians,0
the exiles found the spectator,1
the technician sliced the presidents,0
the president devoured the ruler,0
the graders tipped the spectator,1
the fiances told the sergeant,1
the spouses devoured the warlock,1
the suckers rubbed the husband,1
the writers anointed the programmers,1
the girlfriend hated the rabbi,0
the warlock mailed the mariners,0
the sergeants twirled the barbarians,1
the suckers showed the girlfriend,1
the sergeants washed the fishermen,1
the fishermen refused the programmer,1
the enthusiasts cleaned the ruler,1
the martyr choked the fiances,0
the defendants promised the  islamists,1
the fiances masked the warlock,1
the bartender sliced the presidents,0
the shrink fancied the scribes,0
the shrinks loved the bartender,1
the spectator deluged the hero,0
the boxers spared the martyr,1
the lovers splashed the spouses,1
the sergeant devoured the enthusiasts,0
the heroes mailed the violinist,1
the engineers drenched the rabbi,1
the speaker bound the exile,0
the bartender uncovered the spectator,0
the programmer sliced the ruler,0
the suckers choked the sergeant,1
the spectator decorated the fiances,0
the merchant kicked the graders,0
the bartender bathed the graders,0
the mariners named the husband,1
the vocalists charged the rabbis,1
the emperor showed the boxer,0
the defendant splashed the husband,0
the fisherman twirled the lecturers,0
the exile told the lover,0
the writers kicked the bartender,1
the engineers injected the girlfriends,1
the defendants served the sergeants,1
the rabbi fined the fisherman,0
the lover admired the girlfriends,0
the presidents watched the engineer,1
the rabbis liked the fiance,1
the speaker envied the spouses,0
the programmers hated the scribes,1
the rulers saw the shrink,1
the sergeant blanketed the rabbi,0
the rabbis liked the engineer,1
the fiances bound the englishman,1
the lovers exposed the islamist,1
the martyr begrudged the  islamists,0
the writer injected the governors,0
the lovers addressed the sergeants,1
the shrink deluged the merchants,0
the ruler smothered the husband,0
the spouses tainted the suckers,1
the spectators envied the sergeants,1
the heroes appointed the mariners,1
the lover choked the boxer,0
the parisian refused the parisians,0
the grader labeled the warlock,0
the girlfriend found the sucker,0
the loyalist taught the homosexuals,0
the rabbi saved the spouse,0
the warlock dirtied the homosexuals,0
the technicians spared the mariners,1
the writer spared the parisians,0
the parisian devoured the merchant,0
the hero forgave the homosexual,0
the parisian concealed the heroes,0
the fiances revealed the mariners,1
the rabbi elected the girlfriend,0
the barbarian appointed the  islamists,0
the governors served the exiles,1
the fisherman cleaned the englishmen,0
the emperor bandaged the husbands,0
the loyalists considered the vocalists,1
the heroes drenched the fisherman,1
the enthusiasts glimpsed the rabbi,1
the shrinks loved the loyalist,1
the enthusiasts labeled the scribes,1
the governors tipped the parisians,1
the mariners singed the homosexual,1
the suckers cleaned the grader,1
the violinist hated the spouse,0
the mariner fined the presidents,0
the spouse addressed the programmer,0
the fishermen cleaned the vocalist,1
the engineers taxed the graders,1
the governors moved the writer,1
the spectator hated the heroes,0
the exiles judged the suckers,1
the girlfriend moved the loyalists,0
the president dirtied the enthusiast,0
the vocalists stained the engineer,1
the englishmen anointed the shrink,1
the emperors spared the parisians,1
the fiance exposed the scribes,0
the scribes watched the vocalists,1
the girlfriend begrudged the programmer,0
the martyr liked the fiances,0
the enthusiasts injected the lecturers,1
the vocalists burned the husband,1
the ruler scorched the shrinks,0
the enthusiast burned the loyalist,0
the girlfriend uncovered the grader,0
the vocalists twirled the ruler,1
the programmers watched the exiles,1
the parisians anointed the writer,1
the warlocks twirled the exile,1
the presidents spared the merchants,1
the fishermen admired the engineer,1
the enthusiast elected the islamist,0
the enthusiasts masked the scribes,1
the fishermen named the rabbis,1
the martyr revealed the exiles,0
the lecturers taxed the spouse,1
the lovers kicked the violinist,1
the lovers contaminated the exile,1
the defendant saved the husbands,0
the lecturer mentioned the exile,0
the sucker bound the fisherman,0
the grader judged the violinists,0
the defendants splashed the englishman,1
the parisian smothered the martyr,0
the loyalist taxed the sucker,0
the boxers sliced the  islamists,1
the lovers fancied the heroes,1
the speaker exposed the rabbi,0
the defendant dirtied the merchants,0
the fiance saved the heroes,0
the merchants charged the speakers,1
the sergeants masked the writer,1
the warlock washed the shrinks,0
the bartender tipped the scribes,0
the emperors sliced the bartender,1
the speaker bound the vocalist,0
the husbands watched the warlock,1
the engineer addressed the loyalists,0
the loyalists begrudged the shrinks,1
the homosexuals admired the speakers,1
the boxer deluged the speaker,0
the suckers promised the lovers,1
the engineer liked the spectator,0
the writer glimpsed the islamist,0
the lecturer revealed the suckers,0
the martyr contaminated the girlfriends,0
the ruler contaminated the technicians,0
the graders judged the shrinks,1
the lovers injected the grader,1
the merchant promised the girlfriend,0
the emperor carried the rulers,0
the engineers liked the warlocks,1
the parisian considered the sergeant,0
the  islamists promised the defendants,1
the homosexuals burned the barbarians,1
the defendants rubbed the lecturer,1
the englishmen elected the barbarian,1
the engineer understood the fisherman,0
the presidents showed the englishmen,1
the enthusiasts concealed the technician,1
the sucker understood the vocalists,0
the rulers exposed the technician,1
the lecturer burned the speaker,0
the lover tainted the technician,0
the boxers splashed the graders,1
the vocalists exposed the president,1
the lecturers washed the rabbi,1
the islamist judged the programmer,0
the englishman charged the husband,0
the scribes scorched the spectators,1
the mariner named the technicians,0
the martyr bandaged the vocalist,0
the barbarian considered the mariner,0
the barbarian tipped the girlfriend,0
the writers charged the scribe,1
the warlock anointed the husbands,0
the governor concealed the loyalist,0
the loyalists contaminated the warlock,1
the vocalists burned the hero,1
the spouses moved the sergeants,1
the engineers exposed the homosexuals,1
the  islamists bathed the speaker,1
the englishmen liked the barbarian,1
the technician lifted the technicians,0
the ruler considered the englishman,0
the warlock contaminated the president,0
the programmer promised the lecturers,0
the technicians mentioned the bartender,1
the boxer restored the speaker,0
the violinist washed the loyalists,0
the exile lifted the lovers,0
the lovers saw the parisians,1
the technicians cut the parisian,1
the spouse doused the parisian,0
the shrinks rubbed the englishmen,1
the programmer revealed the lovers,0
the speaker masked the spectators,0
the shrink bandaged the graders,0
the suckers blanketed the loyalists,1
the speaker showed the spectator,0
the martyrs mentioned the ruler,1
the fiance promised the islamist,0
the writers immersed the mariner,1
the girlfriend labeled the presidents,0
the president exposed the lover,0
the girlfriends injected the violinist,1
the parisians fined the hero,1
the parisian showed the lover,0
the spouses smothered the exile,1
the engineer bathed the suckers,0
the spectators suggested the homosexual,1
the merchants refused the shrinks,1
the president taxed the graders,0
the husband watched the fiances,0
the warlocks showed the exile,1
the shrink dirtied the martyrs,0
the technician sliced the barbarian,0
the sucker dirtied the speaker,0
the girlfriends refused the technician,1
the  islamists blanketed the writer,1
the rulers masked the programmers,1
the girlfriend washed the englishman,0
the defendants dubbed the martyrs,1
the fishermen glimpsed the martyr,1
the spouse splashed the programmer,0
the fiance decorated the spectators,0
the violinist fed the exiles,0
the spectator glimpsed the husband,0
the fiance fancied the rabbis,0
the spouse charged the homosexual,0
the martyrs cleaned the martyr,1
the president taught the lover,0
the programmers choked the martyr,1
the shrink fancied the enthusiasts,0
the mariner dirtied the speaker,0
the merchant dragged the husband,0
the rabbis fed the boxers,1
the husbands masked the englishmen,1
the merchants kicked the husband,1
the emperors devoured the parisians,1
the islamist appointed the technician,0
the presidents considered the boxer,1
the defendants mailed the spectators,1
the husband burned the englishmen,0
the emperor washed the presidents,0
the rabbis refused the lecturer,1
the governors lifted the speaker,1
the governor twirled the girlfriends,0
the scribe splashed the violinist,0
the programmer dubbed the speaker,0
the englishman perceived the lecturer,0
the lecturer hated the fishermen,0
the husband dubbed the rabbi,0
the rabbi dubbed the emperor,0
the technicians washed the hero,1
the grader liked the fishermen,0
the merchants stained the spectator,1
the warlocks cut the homosexuals,1
the governor addressed the barbarian,0
the shrinks cut the violinists,1
the vocalist suggested the homosexual,0
the shrink mentioned the warlocks,0
the fiance choked the writer,0
the engineer envied the vocalists,0
the grader decorated the  islamists,0
the engineer promised the lecturers,0
the vocalists bathed the ruler,1
the heroes rubbed the graders,1
the exiles understood the lecturer,1
the mariners mentioned the merchants,1
the presidents washed the programmer,1
the lecturers ate the warlock,1
the bartender exposed the writer,0
the englishmen dirtied the suckers,1
the writer appointed the englishmen,0
the exile doused the governors,0
the ruler tipped the mariner,0
the spouse contaminated the spectator,0
the writers twirled the fishermen,1
the enthusiast pushed the shrinks,0
the programmers told the presidents,1
the suckers tipped the rabbis,1
the emperor anointed the martyr,0
the lover fined the boxer,0
the enthusiasts rubbed the parisians,1
the defendants anointed the merchants,1
the barbarians cut the grader,1
the vocalist pushed the spouse,0
the loyalist suggested the lecturer,0
the writer uncovered the rulers,0
the engineers perceived the heroes,1
the sergeant considered the spouse,0
the technicians contaminated the mariner,1
the graders bathed the violinists,1
the hero considered the fisherman,0
the warlocks rubbed the barbarian,1
the mariner deluged the fiance,0
the islamist bathed the husbands,0
the exiles restored the writers,1
the mariner bathed the parisian,0
the technician promised the rabbis,0
the spouse singed the homosexual,0
the grader perceived the vocalist,0
the presidents decorated the exiles,1
the lovers tainted the programmers,1
the husbands taught the parisians,1
the rabbis choked the lecturers,1
the mariners washed the presidents,1
