the parisians moved the shrinks,1
the defendants served the fishermen,1
the loyalists named the merchant,1
the lover begrudged the husbands,0
the graders told the defendants,1
the shrinks tainted the mariner,1
the writers suggested the technicians,1
the fisherman stained the rabbi,0
the violinist perceived the spouses,0
the speaker blanketed the boxers,0
the  islamists twirled the presidents,1
the sucker sliced the barbarian,0
the merchants spared the spouses,1
the boxers addressed the martyr,1
the violinist suggested the lecturer,0
the martyr glimpsed the rabbis,0
the scribe mentioned the sergeant,0
the parisian restored the merchants,0
the rabbi elected the martyrs,0
the martyr promised the rabbis,0
the sergeant forgave the programmer,0
the emperors begrudged the merchants,1
the sergeant fed the engineer,0
the president named the lecturer,0
the englishmen scorched the governors,1
the bartender rubbed the girlfriends,0
the engineers pushed the enthusiast,1
the englishman drenched the emperors,0
the ruler singed the lovers,0
the enthusiast begrudged the loyalists,0
the englishmen showed the rulers,1
the fiance judged the presidents,0
the violinist tipped the boxer,0
the warlock liked the ruler,0
the sucker ate the barbarian,0
the speakers carpeted the shrink,1
the husband forgave the englishman,0
the exiles uncovered the graders,1
the spectator immersed the governor,0
the parisian saw the martyrs,0
the ruler refused the fishermen,0
the defendants concealed the  islamists,1
the spouses hated the spectators,1
the barbarians dragged the bartender,1
the shrinks appointed the lover,1
the homosexuals doused the spectator,1
the bartender deluged the writers,0
the president doused the homosexuals,0
the  islamists ate the mariner,1
the rulers told the barbarian,1
the martyrs dirtied the islamist,1
the rabbis labeled the graders,1
the technician mentioned the homosexual,0
the speakers fancied the fishermen,1
the fiances carpeted the exile,1
the defendant told the parisian,0
the shrink bandaged the homosexual,0
the technicians mentioned the hero,1
the girlfriends found the writers,1
the englishmen showed the shrink,1
the emperors spared the loyalist,1
the boxer tainted the exiles,0
the homosexuals lifted the governors,1
the suckers revealed the fisherman,1
the homosexuals bandaged the vocalists,1
the fiances named the spectator,1
the technician cut the sergeant,0
the husbands lifted the rabbi,1
the emperors judged the violinist,1
the ruler decorated the speaker,0
the heroes smothered the fishermen,1
the spectators lifted the merchants,1
the sergeant charged the islamist,0
the hero hated the sucker,0
the boxer ate the islamist,0
the fisherman taxed the scribe,0
the barbarians pushed the mariner,1
the merchant loved the sergeants,0
the martyrs burned the boxer,1
the englishmen loved the exiles,1
the loyalist fined the parisian,0
the emperors tainted the governors,1
the lover smothered the speaker,0
the hero judged the vocalist,0
the merchants tipped the girlfriends,1
the shrink drenched the vocalist,0
the warlocks sliced the governor,1
the ruler devoured the technicians,0
the shrink cleaned the vocalist,0
the  islamists bathed the shrinks,1
the presidents saved the spectator,1
the parisians watched the engineers,1
the spectator elected the writers,0
the presidents singed the shrink,1
the presidents loved the englishman,1
the husband spared the lecturers,0
the shrink labeled the martyrs,0
the shrinks pushed the merchants,1
the speakers restored the englishmen,1
the violinists devoured the spouses,1
the lecturer twirled the exiles,0
the islamist understood the vocalist,0
the lecturer washed the fisherman,0
the homosexuals restored the mariners,1
the technician mailed the fisherman,0
the exile uncovered the spectator,0
the spouses doused the parisians,1
the governor revealed the fishermen,0
the defendant scorched the spouses,0
the scribe charged the mariner,0
the graders liked the engineers,1
the scribe saved the suckers,0
the mariner drenched the rabbi,0
the  islamists fed the defendants,1
the scribes carried the lecturer,1
the husband promised the fishermen,0
the rulers elected the rabbis,1
the warlocks saved the emperors,1
the parisians ate the merchant,1
the parisians stained the sucker,1
the girlfriend taxed the suckers,0
the vocalists pushed the fisherman,1
the suckers envied the loyalists,1
the spouses revealed the enthusiast,1
the fiances elected the spouses,1
the sergeant burned the defendants,0
the loyalist scorched the emperor,0
the engineers singed the governors,1
the husband named the warlocks,0
the homosexuals suggested the warlock,1
the writers fed the vocalists,1
the governors elected the mariners,1
the merchants perceived the technicians,1
the speakers addressed the lover,1
the warlocks drenched the graders,1
the lovers stained the fiance,1
the spectators understood the lover,1
the rabbis stained the husbands,1
the vocalist liked the scribe,0
the engineers addressed the violinist,1
the governors restored the hero,1
the technicians cleaned the engineers,1
the parisians tainted the lover,1
the spectators labeled the fiances,1
the spouses restored the boxer,1
the bartender taxed the vocalists,0
the shrinks singed the programmer,1
the speaker revealed the exile,0
the rabbis forgave the spectator,1
the  islamists admired the scribe,1
the spouses saw the vocalist,1
the ruler twirled the homosexuals,0
the spouse perceived the grader,0
the graders restored the bartender,1
the exiles dragged the ruler,1
the defendant tainted the rabbis,0
the writer ate the fiance,0
the technicians devoured the emperor,1
the parisian restored the spouse,0
the merchant anointed the technicians,0
the martyr rubbed the rabbis,0
the fiance named the homosexuals,0
the husband smothered the spouses,0
the programmers singed the rabbis,1
the programmer mentioned the vocalists,0
the fisherman refused the sergeant,0
the spectators tipped the violinist,1
the merchants mailed the spectators,1
the exiles lifted the writer,1
the programmer fancied the exiles,0
the programmers washed the governor,1
the sergeants masked the rulers,1
the rabbi scorched the graders,0
the lover mentioned the husband,0
the technicians admired the barbarian,1
the defendant moved the girlfriend,0
the exiles moved the fisherman,1
the sergeants perceived the scribes,1
the  islamists devoured the rabbi,1
the writers masked the emperors,1
the shrinks showed the martyrs,1
the loyalist found the boxer,0
the girlfriend taught the bartender,0
the governors anointed the spouse,1
the suckers glimpsed the  islamists,1
the governors injected the homosexual,1
the emperor addressed the barbarians,0
the shrinks tipped the martyr,1
the husbands blanketed the emperor,1
the lover forgave the parisian,0
the barbarian ate the heroes,0
the englishmen fed the technicians,1
the rabbi glimpsed the fiances,0
the scribes fancied the rabbi,1
the scribe drenched the defendant,0
the barbarian saw the technician,0
the enthusiast fancied the emperors,0
the spectator scorched the spouse,0
the defendant perceived the hero,0
the programmers dragged the husband,1
the scribe doused the speakers,0
the warlocks stained the emperors,1
the mariners revealed the defendant,1
the suckers saw the sergeant,1
the fisherman forgave the lecturer,0
the sucker bathed the spouse,0
the martyr mentioned the homosexuals,0
the technicians spared the hero,1
the hero sliced the barbarians,0
the husband promised the parisian,0
the hero loved the merchant,0
the martyr fined the graders,0
the graders stained the warlock,1
the islamist uncovered the enthusiast,0
the technician dubbed the englishman,0
the merchant singed the vocalists,0
the governors bathed the lecturer,1
the engineers injected the boxers,1
the englishmen saved the spouses,1
the technician moved the mariners,0
the homosexuals envied the merchant,1
the engineer blanketed the mariners,0
the violinist smothered the exiles,0
the scribes dragged the technician,1
the sucker choked the defendants,0
the lecturers drenched the vocalists,1
the girlfriend mailed the shrinks,0
the  islamists served the scribe,1
the girlfriends begrudged the writer,1
the scribes elected the rabbi,1
the sergeants begrudged the enthusiasts,1
the shrinks anointed the suckers,1
the spectator carried the programmer,0
the heroes suggested the mariners,1
the engineer showed the mariners,0
the lover hated the lecturer,0
the violinist dragged the suckers,0
the speakers cleaned the mariner,1
the loyalists deluged the mariners,1
the scribes mailed the lecturer,1
the barbarian saved the husband,0
the speaker mentioned the sergeant,0
the boxer bound the loyalist,0
the engineer restored the loyalist,0
the fisherman bound the merchants,0
the engineers promised the loyalist,1
the spectator glimpsed the bartender,0
the sucker kicked the defendant,0
the governor revealed the islamist,0
the  islamists judged the exiles,1
the spouses judged the rabbis,1
the martyrs fancied the presidents,1
the writer lifted the warlock,0
the enthusiasts dragged the shrink,1
the lecturer singed the suckers,0
the fishermen contaminated the defendant,1
the martyr burned the homosexuals,0
the vocalists named the exiles,1
the defendants saw the homosexuals,1
the englishmen lifted the lecturer,1
the fisherman begrudged the speakers,0
the martyrs taxed the boxer,1
the fiances drenched the lovers,1
the rabbis fined the shrink,1
the  islamists carpeted the enthusiast,1
the parisians loved the enthusiasts,1
the parisians bathed the merchants,1
the lecturers pushed the enthusiast,1
the rabbi decorated the martyrs,0
the exiles carried the engineers,1
the programmers fancied the speakers,1
the loyalists bathed the enthusiast,1
the martyrs lifted the lovers,1
the boxers cleaned the englishman,1
the spectator uncovered the enthusiast,0
the merchant kicked the husband,0
the scribes doused the engineers,1
the shrink tipped the shrinks,0
the spouse twirled the boxers,0
the programmer restored the spouses,0
the martyrs smothered the rulers,1
the hero liked the presidents,0
the rabbi fancied the mariners,0
the violinist hated the governor,0
the lecturers contaminated the lecturer,1
the englishmen hated the graders,1
the husbands refused the spouses,1
the writers contaminated the fisherman,1
the president saw the writers,0
the fisherman forgave the defendant,0
the homosexual restored the loyalists,0
the fishermen ate the merchant,1
the violinists perceived the loyalists,1
the defendant dirtied the rabbi,0
the suckers immersed the president,1
the emperors suggested the speakers,1
the homosexuals saved the sucker,1
the boxer immersed the engineer,0
the warlock appointed the president,0
the violinists scorched the technicians,1
the writers uncovered the barbarian,1
the sucker found the presidents,0
the violinist fined the exiles,0
the sergeant refused the sucker,0
the bartender tipped the martyr,0
the parisian choked the sergeants,0
the speaker loved the englishman,0
the rabbis tipped the fishermen,1
the parisian smothered the spectator,0
the mariners ate the spouses,1
the husband suggested the englishman,0
the martyr begrudged the sergeant,0
the bartender uncovered the sergeants,0
the islamist forgave the enthusiasts,0
the spectator mailed the technician,0
the scribe restored the emperors,0
the shrink mentioned the sucker,0
the lovers smothered the hero,1
the engineer washed the bartender,0
the scribe contaminated the scribes,0
the shrink moved the programmers,0
the spectators singed the suckers,1
the girlfriend cleaned the merchants,0
the englishmen fed the martyrs,1
the technician washed the bartender,0
the boxer burned the martyrs,0
the fishermen washed the loyalist,1
the defendants addressed the spectators,1
the husbands pushed the spectator,1
the martyr saved the grader,0
the englishman refused the programmers,0
the defendants pushed the lecturer,1
the homosexual saved the lovers,0
the violinists envied the mariners,1
the graders bathed the writers,1
the husbands doused the fiances,1
the islamist dragged the lecturer,0
the violinist cut the barbarian,0
the girlfriend drenched the parisian,0
the enthusiast suggested the exiles,0
the lovers contaminated the girlfriends,1
the graders choked the mariners,1
the writers splashed the fisherman,1
the husbands admired the programmer,1
the hero judged the governor,0
the parisian blanketed the warlock,0
the homosexuals kicked the defendants,1
the emperor named the warlock,0
the girlfriend judged the programmer,0
the president pushed the spouse,0
the fishermen saw the president,1
the president rubbed the sucker,0
the defendants bandaged the technician,1
the violinists cut the englishman,1
the emperors stained the spouse,1
the writer spared the girlfriend,0
the violinists singed the mariner,1
the parisian found the speaker,0
the suckers washed the governor,1
the fiance told the englishmen,0
the emperors refused the loyalists,1
the boxer blanketed the violinists,0
the englishmen saw the grader,1
the bartender forgave the merchant,0
the speakers twirled the programmer,1
the rabbi anointed the ruler,0
the programmers saw the suckers,1
the writers saved the fisherman,1
the governors kicked the fisherman,1
the emperor devoured the englishmen,0
the fiance begrudged the shrink,0
the rabbi dirtied the spectator,0
the defendant elected the hero,0
the engineer twirled the technicians,0
the bartender judged the lovers,0
the engineer understood the islamist,0
the rabbis choked the sucker,1
the parisian carpeted the spectators,0
the programmer glimpsed the hero,0
the girlfriends twirled the technicians,1
the islamist cleaned the martyr,0
the shrink contaminated the warlock,0
the englishmen drenched the merchant,1
the fiance liked the sergeant,0
the scribe revealed the speakers,0
the suckers told the barbarian,1
the suckers revealed the scribes,1
the mariners considered the husband,1
the rabbis ate the shrinks,1
the spectator understood the spouses,0
the vocalists fined the defendant,1
the programmer kicked the fiances,0
the engineer twirled the ruler,0
the  islamists masked the merchant,1
the barbarian burned the lecturers,0
the fiance uncovered the lover,0
the rabbis mailed the spouse,1
the scribe liked the lover,0
the rabbis charged the writers,1
the spouses contaminated the merchant,1
the president washed the writers,0
the warlock injected the girlfriend,0
the president taught the husband,0
the emperor admired the  islamists,0
the emperor taxed the exiles,0
the bartender concealed the technicians,0
the husbands elected the programmers,1
the graders liked the defendant,1
the girlfriends admired the loyalist,1
the fiance doused the presidents,0
the ruler splashed the spectators,0
the programmer forgave the lecturers,0
the rabbi appointed the programmers,0
the islamist perceived the exile,0
the mariners bound the islamist,1
the fisherman saw the lecturers,0
the technician dirtied the rabbi,0
the barbarians taxed the loyalists,1
the loyalists taxed the spouses,1
the programmers fined the scribe,1
the husband deluged the homosexuals,0
the violinist taxed the defendants,0
the technician dubbed the spouse,0
the lecturers devoured the president,1
the englishman choked the barbarians,0
the martyrs immersed the fisherman,1
the emperor blanketed the defendant,0
the engineer tainted the ruler,0
the spouses mailed the barbarians,1
the spouse immersed the scribes,0
the husband mailed the scribes,0
the homosexuals suggested the barbarian,1
the writers twirled the enthusiasts,1
the martyrs appointed the englishmen,1
the fishermen concealed the homosexual,1
the fiance judged the englishmen,0
the scribes spared the  islamists,1
the vocalist blanketed the governors,0
the defendants dragged the suckers,1
the heroes appointed the shrinks,1
the merchants drenched the governor,1
the spectators carried the parisians,1
the fiances drenched the vocalist,1
the girlfriends promised the emperor,1
the programmers begrudged the graders,1
the shrinks dubbed the scribes,1
the speaker loved the mariners,0
the ruler perceived the hero,0
the defendants blanketed the rulers,1
the scribes stained the warlocks,1
the merchant stained the emperors,0
the engineer restored the merchant,0
the mariners refused the sucker,1
the boxer dragged the spectator,0
the girlfriends burned the shrink,1
the technician burned the fishermen,0
the mariners anointed the programmers,1
the speaker injected the rabbi,0
the englishmen carpeted the heroes,1
the barbarians masked the mariners,1
the enthusiasts envied the shrink,1
the sergeant carpeted the sucker,0
the fiance dragged the rabbis,0
the fisherman begrudged the suckers,0
the sucker perceived the islamist,0
the fiance understood the scribe,0
the speakers masked the lecturer,1
the girlfriend told the barbarians,0
the boxer immersed the scribe,0
the rabbis rubbed the defendants,1
the spectator singed the husbands,0
the loyalist taxed the barbarian,0
the president forgave the warlocks,0
the lovers fancied the rulers,1
the warlock addressed the writer,0
the governors uncovered the parisian,1
the husband doused the  islamists,0
the loyalists fed the lover,1
the fiance cleaned the vocalist,0
the fiances bandaged the spouse,1
the sucker told the martyrs,0
the mariner moved the scribes,0
the vocalists cleaned the spectators,1
the speaker devoured the violinists,0
the loyalist devoured the engineers,0
the barbarian kicked the fisherman,0
the warlocks loved the writers,1
the vocalists spared the governors,1
the mariners fined the ruler,1
the lecturer twirled the martyrs,0
the rabbi appointed the president,0
the grader splashed the engineer,0
the rulers carried the enthusiast,1
the scribes appointed the spouse,1
the programmer perceived the vocalist,0
the loyalist bathed the enthusiast,0
the islamist suggested the englishman,0
the husbands doused the emperor,1
the boxers decorated the governors,1
the husbands watched the englishman,1
the mariners dirtied the governor,1
the governor bandaged the rabbi,0
the enthusiasts burned the fishermen,1
the spouse dubbed the merchants,0
the  islamists mailed the technician,1
the sucker saw the engineer,0
the technician bandaged the president,0
the fisherman admired the girlfriends,0
the warlocks begrudged the hero,1
the exile suggested the rulers,0
the suckers labeled the englishmen,1
the homosexual fed the fisherman,0
the parisian forgave the emperor,0
the homosexuals labeled the writers,1
the lover drenched the rulers,0
the heroes immersed the defendants,1
the rabbis perceived the husbands,1
the graders spared the defendants,1
the englishman served the presidents,0
the husbands masked the governor,1
the merchant bandaged the  islamists,0
the programmers showed the fisherman,1
the warlocks served the violinist,1
the loyalist found the sergeants,0
the rulers dubbed the boxer,1
the exile served the fishermen,0
the engineers twirled the heroes,1
the merchant cleaned the defendant,0
the spectators charged the ruler,1
the shrink fancied the engineers,0
the spouses begrudged the president,1
the warlocks mentioned the englishmen,1
the rulers understood the rabbi,1
the bartender ate the martyr,0
the ruler moved the exile,0
the fishermen uncovered the parisian,1
the ruler dubbed the merchant,0
the islamist perceived the fiances,0
the president carried the sergeant,0
the spectator envied the enthusiasts,0
the rabbi considered the husbands,0
the heroes choked the enthusiast,1
the speaker tipped the fiance,0
the spouse masked the spectator,0
the lover bandaged the heroes,0
the engineers suggested the ruler,1
the ruler mailed the islamist,0
the homosexuals rubbed the mariner,1
the technicians washed the englishman,1
the technician doused the writers,0
the vocalists tainted the islamist,1
the shrinks dirtied the violinists,1
the writer drenched the parisians,0
the merchant spared the technician,0
the fishermen named the president,1
the martyr tipped the barbarian,0
the husbands loved the martyr,1
the writer watched the lovers,0
the loyalists saw the shrinks,1
the programmer told the presidents,0
the merchants addressed the lover,1
the technician scorched the bartender,0
the islamist concealed the bartender,0
the warlocks decorated the lovers,1
the speaker decorated the homosexual,0
the homosexual taught the violinists,0
the loyalist dubbed the fiances,0
the engineers smothered the fisherman,1
the spouse told the speakers,0
the suckers washed the fiance,1
the spectators charged the writer,1
the sergeants saw the barbarians,1
the programmer watched the lecturers,0
the engineer cleaned the rabbis,0
the violinists sliced the bartender,1
the vocalist dirtied the technician,0
the fishermen decorated the violinist,1
the englishman taught the boxers,0
the lecturer choked the spouses,0
the defendants bandaged the warlocks,1
the lecturer twirled the rabbis,0
the lovers uncovered the violinists,1
the merchant begrudged the vocalist,0
the spectator cut the islamist,0
the violinists devoured the hero,1
the violinists washed the fiances,1
the lecturers appointed the enthusiast,1
the fisherman taught the writer,0
the englishmen charged the husbands,1
the homosexuals ate the writers,1
the shrink tipped the rulers,0
the governor choked the mariners,0
the presidents devoured the enthusiast,1
the lover labeled the spectator,0
the loyalists drenched the girlfriends,1
the defendants devoured the homosexuals,1
the mariner fancied the girlfriends,0
the parisian fined the technicians,0
the sergeant begrudged the programmer,0
the grader considered the parisians,0
the barbarians devoured the president,1
the spectator scorched the fiance,0
the engineer promised the boxers,0
the engineer promised the technician,0
the suckers considered the technician,1
the bartender understood the homosexual,0
the husband contaminated the barbarian,0
the programmer cut the lovers,0
the homosexuals dubbed the englishmen,1
the suckers exposed the warlock,1
the writers elected the technician,1
the heroes dirtied the parisian,1
the ruler tipped the boxer,0
the graders forgave the speakers,1
the boxer pushed the fiance,0
the husband taught the shrinks,0
the speaker fancied the rulers,0
the president bandaged the graders,0
the martyr addressed the spectator,0
the bartender tipped the rulers,0
the lover uncovered the parisians,0
the fishermen washed the loyalists,1
the technicians spared the spectator,1
the martyrs glimpsed the spectator,1
the graders labeled the scribe,1
the vocalists loved the mariner,1
the girlfriend named the barbarian,0
the vocalists tainted the rabbis,1
the violinist doused the bartender,0
the merchants contaminated the programmers,1
the martyr cleaned the loyalist,0
the hero cut the girlfriends,0
the hero cut the barbarian,0
the emperors taxed the vocalists,1
the lecturers admired the islamist,1
the lovers mailed the writer,1
the barbarians pushed the speaker,1
the graders judged the heroes,1
the technician cut the governor,0
the homosexual twirled the bartender,0
the parisian injected the girlfriends,0
the barbarian singed the lover,0
the barbarian kicked the martyrs,0
the hero suggested the fisherman,0
the fiance sliced the shrink,0
the girlfriends envied the scribes,1
the violinists restored the barbarian,1
the warlock addressed the lecturers,0
the parisian cut the exiles,0
the exiles concealed the hero,1
the grader saved the fiances,0
the spouses found the girlfriend,1
the technicians splashed the violinist,1
the technicians liked the spectator,1
the spectator bound the boxer,0
the warlocks told the defendants,1
the emperor appointed the loyalists,0
the sergeants masked the writers,1
the speakers singed the fisherman,1
the husbands loved the technician,1
the fisherman taught the fiances,0
the exiles fed the boxer,1
the engineer restored the programmers,0
the englishmen decorated the writers,1
the heroes decorated the enthusiast,1
the lecturer taught the homosexual,0
the bartender fancied the mariner,0
the englishmen exposed the merchant,1
the fisherman cleaned the enthusiasts,0
the programmers deluged the sergeants,1
the president fined the defendants,0
the enthusiast perceived the defendants,0
the speakers addressed the parisian,1
the martyrs forgave the hero,1
the girlfriends tipped the engineers,1
the fishermen exposed the martyr,1
the merchant forgave the lovers,0
the programmers rubbed the president,1
the heroes stained the lecturers,1
the fisherman tainted the girlfriends,0
the heroes saved the lecturer,1
the presidents decorated the technician,1
the writers contaminated the  islamists,1
the boxer spared the engineer,0
the presidents decorated the girlfriends,1
the parisian smothered the exiles,0
the grader bandaged the violinists,0
the grader lifted the president,0
the vocalist masked the engineers,0
the scribes considered the fiances,1
the englishmen dirtied the merchant,1
the defendants dubbed the rulers,1
the hero promised the boxers,0
the loyalists considered the technicians,1
the bartender suggested the violinist,0
the grader understood the girlfriends,0
the martyrs loved the programmers,1
the loyalists labeled the bartender,1
the islamist deluged the technicians,0
the technician appointed the governor,0
the  islamists suggested the merchant,1
the boxers elected the shrinks,1
the sergeants sliced the shrink,1
the ruler masked the emperor,0
the  islamists spared the sergeants,1
the ruler concealed the fiance,0
