the martyr watched the homosexuals,0
the programmer twirled the emperor,0
the girlfriend twirled the warlock,0
the spouses loved the enthusiast,1
the spouses told the mariner,1
the sergeants watched the lecturers,1
the islamist hated the violinist,0
the violinists perceived the boxers,1
the rulers sliced the engineer,1
the warlocks fed the enthusiasts,1
the president liked the heroes,0
the governor spared the mariners,0
the sergeant showed the parisian,0
the programmer stained the violinists,0
the scribe decorated the ruler,0
the merchants tainted the programmers,1
the homosexual moved the writer,0
the heroes liked the engineer,1
the vocalist taught the writer,0
the writer suggested the boxer,0
the violinist watched the sergeant,0
the enthusiast suggested the loyalist,0
the fiances dirtied the engineer,1
the fiance suggested the barbarian,0
the engineers appointed the barbarian,1
the parisians cut the scribes,1
the husbands masked the lover,1
the lovers labeled the president,1
the defendant revealed the emperors,0
the vocalists forgave the boxer,1
the rabbi decorated the defendants,0
the enthusiasts taught the shrinks,1
the speaker bandaged the programmers,0
the husband dirtied the heroes,0
the barbarian considered the lecturers,0
the speaker carried the shrink,0
the governors concealed the shrinks,1
the fisherman decorated the martyrs,0
the mariners refused the graders,1
the writers showed the hero,1
the vocalist washed the writer,0
the  islamists burned the fisherman,1
the sergeant drenched the rulers,0
the vocalist burned the boxer,0
the suckers tainted the writer,1
the husband appointed the barbarians,0
the mariners dirtied the englishmen,1
the lecturer judged the enthusiasts,0
the rulers moved the technician,1
the spectator promised the president,0
the fiance admired the loyalist,0
the fiance envied the warlock,0
the girlfriends showed the mariners,1
the homosexuals judged the englishmen,1
the mariner smothered the boxers,0
the girlfriends tainted the violinist,1
the hero tainted the grader,0
the warlock charged the scribes,0
the technician judged the englishman,0
the loyalist taught the boxer,0
the sergeants envied the merchants,1
the homosexuals anointed the violinists,1
the rabbi envied the violinist,0
the loyalists bandaged the presidents,1
the programmers saved the technician,1
the parisian kicked the programmers,0
the mariners restored the defendant,1
the lecturers charged the governor,1
the warlock injected the boxers,0
the lovers burned the boxers,1
the technicians showed the engineer,1
the warlock forgave the englishman,0
the rabbi mailed the governor,0
the writers blanketed the spectators,1
the president showed the enthusiasts,0
the mariners mailed the exile,1
the merchant kicked the ruler,0
the defendant dragged the programmers,0
the enthusiasts fed the emperor,1
the warlocks bandaged the martyr,1
the hero charged the writers,0
the rabbi pushed the graders,0
the husband taught the rulers,0
the spectator rubbed the vocalist,0
the loyalist liked the enthusiast,0
the warlocks moved the fisherman,1
the violinist envied the lover,0
the lovers immersed the barbarian,1
the islamist promised the warlock,0
the writers cleaned the homosexuals,1
the programmer singed the englishmen,0
the scribe hated the warlock,0
the parisians begrudged the fisherman,1
the presidents judged the homosexual,1
the husbands revealed the lecturers,1
the  islamists sliced the englishman,1
the governors kicked the violinists,1
the ruler watched the writers,0
the speakers devoured the heroes,1
the husband judged the programmer,0
the homosexual devoured the parisians,0
the vocalist taught the technician,0
the loyalist twirled the emperors,0
the governor dragged the martyrs,0
the shrinks deluged the spectators,1
the governor scorched the spouse,0
the heroes served the homosexuals,1
the rulers named the martyr,1
the shrinks immersed the mariners,1
the warlock admired the girlfriend,0
the girlfriends liked the warlocks,1
the merchant labeled the exile,0
the barbarian splashed the heroes,0
the violinist injected the bartender,0
the homosexual mailed the lovers,0
the sergeants cleaned the emperor,1
the englishman pushed the sucker,0
the lecturer addressed the rabbi,0
the emperors labeled the sucker,1
the graders contaminated the enthusiast,1
the merchants glimpsed the mariner,1
the merchant rubbed the technician,0
the grader smothered the speaker,0
the spouses elected the lecturer,1
the graders kicked the homosexual,1
the exile named the violinist,0
the husbands bandaged the lover,1
the husbands served the spectators,1
the warlock carpeted the girlfriend,0
the vocalist decorated the loyalist,0
the graders smothered the vocalists,1
the barbarians lifted the sucker,1
the presidents begrudged the mariner,1
the fiance cleaned the boxers,0
the merchant blanketed the shrinks,0
the boxers uncovered the mariner,1
the boxers saw the technician,1
the technician judged the exiles,0
the warlocks watched the programmer,1
the programmer loved the programmers,0
the spectators cleaned the parisian,1
the heroes promised the ruler,1
the ruler deluged the parisian,0
the spouses served the fishermen,1
the shrink labeled the mariners,0
the englishmen revealed the parisians,1
the spouses choked the engineer,1
the fishermen tipped the defendant,1
the boxer burned the shrink,0
the exile served the fiance,0
the scribes decorated the suckers,1
the grader devoured the scribe,0
the rabbis tainted the englishman,1
the martyrs scorched the spouse,1
the englishmen bound the shrink,1
the rabbi perceived the warlocks,0
the defendants saved the martyr,1
the hero taxed the barbarians,0
the bartender judged the parisians,0
the enthusiasts immersed the spectator,1
the programmer saw the technicians,0
the bartender bound the defendants,0
the technicians told the ruler,1
the fishermen bathed the merchants,1
the engineer elected the programmer,0
the sergeant liked the lover,0
the violinist immersed the speakers,0
the governor twirled the rabbi,0
the spouse appointed the englishman,0
the hero dragged the programmers,0
the scribe labeled the spouses,0
the lecturers stained the barbarians,1
the exiles rubbed the girlfriend,1
the boxer understood the president,0
the sergeants understood the girlfriend,1
the husbands bandaged the girlfriends,1
the writers appointed the warlocks,1
the scribes fined the loyalists,1
the husbands tainted the mariner,1
the violinists stained the spouses,1
the engineer revealed the boxers,0
the governors labeled the governor,1
the warlocks tainted the grader,1
the vocalists singed the rabbi,1
the englishman pushed the merchants,0
the spouse exposed the martyr,0
the lovers dubbed the husband,1
the speakers begrudged the parisian,1
the defendants twirled the husband,1
the scribes mailed the boxers,1
the defendant decorated the englishmen,0
the parisians tipped the barbarian,1
the shrink loved the sergeant,0
the girlfriend sliced the programmers,0
the vocalists choked the merchant,1
the violinists taught the lecturers,1
the shrinks decorated the grader,1
the loyalist stained the girlfriend,0
the sergeants choked the barbarians,1
the grader blanketed the ruler,0
the rabbi scorched the martyr,0
the rulers singed the shrinks,1
the exiles charged the graders,1
the loyalists appointed the martyr,1
the heroes smothered the parisian,1
the husband concealed the emperors,0
the exile drenched the shrinks,0
the barbarians anointed the engineers,1
the speakers washed the exile,1
the rabbis splashed the speaker,1
the martyr bathed the sucker,0
the presidents suggested the shrinks,1
the violinist splashed the boxers,0
the englishmen burned the loyalists,1
the lovers washed the violinist,1
the martyrs fancied the technician,1
the violinists injected the  islamists,1
the violinists served the shrinks,1
the emperors fined the writers,1
the spectators taxed the barbarian,1
the technician liked the boxers,0
the homosexual blanketed the programmers,0
the loyalists envied the boxers,1
the vocalists fed the engineer,1
the enthusiast promised the presidents,0
the girlfriends hated the sergeant,1
the rabbi admired the  islamists,0
the sergeants perceived the merchant,1
the englishmen fancied the technician,1
the graders suggested the shrink,1
the shrinks elected the exile,1
the parisians labeled the rulers,1
the sucker charged the enthusiast,0
the presidents found the loyalists,1
the governors fancied the programmer,1
the suckers refused the bartender,1
the scribes kicked the englishmen,1
the islamist saw the violinists,0
the graders liked the engineer,1
the merchants showed the spectators,1
the violinists taught the martyr,1
the mariner burned the rulers,0
the presidents kicked the emperors,1
the parisians immersed the barbarians,1
the mariners told the bartender,1
the writer fed the engineer,0
the boxer elected the sucker,0
the fisherman uncovered the speakers,0
the sergeants saw the heroes,1
the shrinks elected the warlocks,1
the vocalist forgave the rabbis,0
the lovers immersed the programmer,1
the barbarians dirtied the hero,1
the violinists fancied the fisherman,1
the emperors singed the islamist,1
the writer tainted the husbands,0
the enthusiasts revealed the engineer,1
the presidents saved the fiance,1
the bartender injected the defendant,0
the president promised the heroes,0
the islamist elected the parisian,0
the fisherman taught the defendant,0
the englishman decorated the martyrs,0
the lover promised the emperor,0
the barbarian charged the fiances,0
the martyr fancied the exiles,0
the loyalist charged the presidents,0
the exile labeled the technicians,0
the homosexuals injected the fiance,1
the governor fancied the writer,0
the writer kicked the englishmen,0
the rulers exposed the engineer,1
the writer mentioned the graders,0
the homosexual masked the martyr,0
the exile injected the englishmen,0
the lover sliced the boxers,0
the fiance sliced the boxers,0
the lover cleaned the sergeants,0
the spouse fined the violinist,0
the suckers perceived the ruler,1
the shrinks dragged the englishmen,1
the presidents sliced the exiles,1
the speakers glimpsed the boxers,1
the husbands deluged the husband,1
the vocalists cut the rulers,1
the engineer singed the barbarians,0
the fiances showed the barbarian,1
the warlocks admired the defendants,1
the bartender burned the parisians,0
the rulers doused the exiles,1
the spouse sliced the englishman,0
the martyrs burned the husband,1
the barbarian forgave the suckers,0
the spectators bound the rabbis,1
the girlfriends named the  islamists,1
the grader anointed the scribe,0
the parisian named the englishmen,0
the homosexual drenched the engineers,0
the exiles bound the parisian,1
the rulers contaminated the speaker,1
the merchant perceived the defendant,0
the girlfriends mailed the enthusiast,1
the merchant mentioned the merchants,0
the suckers promised the enthusiast,1
the technician saved the governor,0
the defendants charged the writers,1
the loyalists contaminated the emperor,1
the barbarian lifted the fiances,0
the warlocks bathed the ruler,1
the shrinks taxed the grader,1
the spectator deluged the spouse,0
the programmer kicked the writer,0
the  islamists splashed the englishmen,1
the violinists washed the governor,1
the barbarians exposed the loyalists,1
the fiance exposed the programmers,0
the warlocks injected the programmers,1
the sergeants dragged the sucker,1
the mariner showed the husbands,0
the spouse showed the defendant,0
the mariners tainted the engineers,1
the scribes forgave the martyr,1
the fisherman cut the shrink,0
the suckers envied the sergeants,1
the violinist dubbed the president,0
the engineers blanketed the violinist,1
the sergeants fed the husband,1
the lovers suggested the speaker,1
the sergeant masked the programmers,0
the lover washed the islamist,0
the martyr judged the engineers,0
the rabbi singed the fiances,0
the lover appointed the emperor,0
the barbarians stained the spouse,1
the enthusiasts loved the scribe,1
the lovers named the engineers,1
the defendant washed the parisians,0
the vocalists choked the rabbis,1
the violinists sliced the programmers,1
the martyr charged the merchant,0
the emperors exposed the shrinks,1
the speaker splashed the sergeants,0
the fiance appointed the spouse,0
the violinist cleaned the emperor,0
the  islamists masked the fiance,1
the  islamists suggested the writer,1
the presidents burned the writers,1
the sergeants fed the martyr,1
the parisian masked the writer,0
the shrink scorched the spouse,0
the sergeant taxed the ruler,0
the shrinks injected the defendants,1
the engineers moved the technicians,1
the loyalists tainted the speakers,1
the lovers cut the president,1
the  islamists devoured the scribes,1
the rabbis masked the lecturer,1
the warlock moved the boxer,0
the violinist elected the engineers,0
the boxers anointed the writers,1
the writer saw the emperors,0
the rabbi burned the islamist,0
the speakers appointed the defendant,1
the governor anointed the programmer,0
the programmer mailed the programmers,0
the barbarians taught the writers,1
the spectators told the emperor,1
the technician dragged the boxers,0
the rabbi deluged the spectators,0
the presidents appointed the engineers,1
the fiance taught the husband,0
the exiles found the defendant,1
the loyalists forgave the programmer,1
the girlfriend labeled the rabbi,0
the grader hated the ruler,0
the lovers loved the vocalists,1
the bartender begrudged the warlock,0
the technician mailed the spectators,0
the fisherman blanketed the vocalist,0
the islamist scorched the violinists,0
the grader dragged the warlocks,0
the vocalist splashed the enthusiast,0
the sucker uncovered the shrink,0
the hero stained the martyr,0
the ruler saw the parisian,0
the rabbis exposed the mariners,1
the vocalist taxed the heroes,0
the heroes injected the technician,1
the governor ate the speaker,0
the parisian scorched the engineer,0
the loyalist bathed the merchants,0
the loyalist concealed the bartender,0
the lover fined the englishmen,0
the violinists found the writer,1
the rabbis ate the barbarian,1
the sucker perceived the engineer,0
the martyr drenched the sucker,0
the girlfriends fancied the defendant,1
the loyalists addressed the vocalists,1
the emperor watched the presidents,0
the martyrs injected the homosexuals,1
the sergeants labeled the spouses,1
the spouses dragged the spouse,1
the loyalists sliced the graders,1
the fishermen found the islamist,1
the governor labeled the vocalist,0
the warlock doused the presidents,0
the rabbi charged the exile,0
the exiles fined the mariner,1
the merchant contaminated the girlfriend,0
the englishmen dubbed the emperors,1
the barbarians begrudged the hero,1
the warlocks anointed the governors,1
the boxer watched the martyrs,0
the speaker uncovered the sergeant,0
the fiances liked the merchant,1
the violinist tipped the governor,0
the ruler appointed the fiances,0
the programmer exposed the boxers,0
the programmers carpeted the defendant,1
the exiles suggested the enthusiast,1
the sergeant singed the lover,0
the husband rubbed the lecturers,0
the defendants bound the technicians,1
the lover watched the englishmen,0
the engineers found the lovers,1
the loyalists bathed the fiance,1
the engineer served the homosexuals,0
the rabbis drenched the rabbi,1
the loyalists understood the husbands,1
the enthusiast cut the lecturer,0
the warlocks saved the englishmen,1
the girlfriends kicked the spouse,1
the husband dirtied the fisherman,0
the boxers restored the fisherman,1
the rabbis showed the spouses,1
the rabbis taxed the  islamists,1
the lecturer singed the loyalist,0
the homosexuals stained the enthusiasts,1
the enthusiast injected the husbands,0
the boxers doused the girlfriend,1
the rabbi twirled the grader,0
the shrinks mailed the rabbi,1
the mariners spared the scribe,1
the writers choked the presidents,1
the violinist stained the defendant,0
the violinists told the boxers,1
the hero deluged the graders,0
the violinists dirtied the exile,1
the warlocks cut the lovers,1
the lover glimpsed the homosexual,0
the violinists moved the spectator,1
the merchants addressed the lecturers,1
the merchant judged the merchants,0
the enthusiasts suggested the rabbis,1
the spectator choked the girlfriend,0
the hero pushed the speaker,0
the vocalist mailed the programmer,0
the writers concealed the governor,1
the governors rubbed the enthusiast,1
the spectator decorated the englishmen,0
the enthusiast smothered the lecturers,0
the violinists bathed the suckers,1
the governors mentioned the barbarians,1
the homosexuals begrudged the technicians,1
the husband sliced the boxer,0
the husband splashed the suckers,0
the ruler splashed the speakers,0
the writers tainted the scribes,1
the writers rubbed the engineers,1
the barbarians taxed the violinist,1
the president charged the exile,0
the fiances contaminated the barbarians,1
the governor found the martyrs,0
the emperors blanketed the shrink,1
the graders smothered the programmers,1
the mariner served the islamist,0
the shrink spared the speaker,0
the barbarians mailed the martyr,1
the fisherman showed the spectator,0
the girlfriend considered the rulers,0
the spouse splashed the president,0
the husband envied the writers,0
the governors injected the grader,1
the defendant told the graders,0
the programmers loved the merchant,1
the emperor watched the spectators,0
the grader liked the islamist,0
the governors tipped the rabbi,1
the merchants dirtied the homosexuals,1
the suckers envied the scribes,1
the spouse dubbed the speaker,0
the lovers cut the emperors,1
the homosexuals carpeted the violinist,1
the writers dirtied the parisians,1
the speaker restored the martyrs,0
the engineer watched the girlfriend,0
the bartender twirled the president,0
the boxer cut the programmers,0
the ruler tipped the defendant,0
the exiles revealed the rabbis,1
the governor glimpsed the emperors,0
the barbarians labeled the defendant,1
the defendants told the spectator,1
the programmer saved the heroes,0
the writers cleaned the graders,1
the programmers refused the spouse,1
the homosexuals carpeted the parisians,1
the writer served the warlocks,0
the sergeants mentioned the graders,1
the spectator revealed the barbarians,0
the mariner taught the speakers,0
the hero twirled the rabbi,0
the defendants taxed the martyr,1
the lover bathed the scribe,0
the sergeants revealed the exiles,1
the governor saved the violinist,0
the vocalist served the lover,0
the emperors showed the presidents,1
the lovers pushed the warlocks,1
the governor considered the parisian,0
the homosexuals tainted the shrink,1
the engineer masked the boxer,0
the parisian smothered the lover,0
the shrinks uncovered the exiles,1
the lecturers deluged the sergeants,1
the hero served the  islamists,0
the loyalists named the exile,1
the bartender moved the defendant,0
the exile showed the shrink,0
the spouses exposed the violinist,1
the speakers masked the lovers,1
the sucker carried the martyrs,0
the emperor sliced the parisian,0
the engineers judged the writer,1
the sergeant admired the sucker,0
the rulers anointed the lecturer,1
the lecturers forgave the governors,1
the writers smothered the violinists,1
the loyalists concealed the homosexuals,1
the warlock envied the exile,0
the technician envied the scribe,0
the lecturers decorated the englishmen,1
the graders addressed the merchants,1
the technician hated the girlfriends,0
the rulers masked the spectator,1
the boxer choked the martyrs,0
the bartender liked the fisherman,0
the writer loved the merchants,0
the writers tipped the merchants,1
the speaker considered the shrink,0
the lovers masked the lecturers,1
the mariner carried the violinists,0
the lecturer cut the spouses,0
the fiances carpeted the girlfriends,1
the spouse addressed the shrinks,0
the lecturers named the loyalists,1
the girlfriends saw the loyalists,1
the bartender deluged the emperor,0
the mariners told the governor,1
the vocalist anointed the sucker,0
the technicians addressed the lecturers,1
the lover ate the writers,0
the warlocks appointed the lecturer,1
the spectator decorated the scribes,0
the parisian ate the exiles,0
the martyr told the ruler,0
the merchants deluged the homosexual,1
the merchants taught the parisians,1
the boxers rubbed the mariners,1
the engineers devoured the hero,1
the presidents burned the exiles,1
the emperor addressed the merchant,0
the girlfriends fancied the warlock,1
the martyrs blanketed the fiances,1
the president choked the hero,0
the merchants labeled the homosexual,1
the fiance named the enthusiast,0
the writers perceived the warlock,1
the violinists revealed the rabbis,1
the technician found the sergeant,0
the programmer devoured the girlfriend,0
the governors pushed the barbarian,1
the mariner sliced the barbarians,0
the martyrs singed the fishermen,1
the writers considered the violinist,1
the sergeants exposed the  islamists,1
the parisians blanketed the boxers,1
the shrink taught the rulers,0
the programmers tipped the hero,1
the spectators lifted the lecturer,1
the rabbis perceived the warlock,1
the heroes liked the parisian,1
the heroes ate the homosexuals,1
the homosexual considered the scribe,0
the ruler mentioned the presidents,0
the warlock washed the writer,0
the loyalist stained the homosexual,0
the rulers blanketed the presidents,1
the englishmen liked the enthusiast,1
the suckers cut the englishman,1
the vocalist served the merchants,0
the husbands devoured the defendants,1
the spectator carpeted the girlfriends,0
the programmers carpeted the spectators,1
the homosexuals drenched the grader,1
the islamist lifted the vocalists,0
the programmer named the rulers,0
the violinist drenched the spouses,0
the fiance ate the defendant,0
the programmer bound the martyr,0
the merchant refused the graders,0
the loyalists hated the programmers,1
the spouses immersed the vocalist,1
the sucker washed the technician,0
the martyr considered the defendants,0
the shrinks saved the husbands,1
the martyr named the rabbi,0
the spectators cut the violinist,1
the vocalist elected the merchant,0
the programmer lifted the writers,0
the technicians ate the spectator,1
the violinist lifted the barbarians,0
the spectators perceived the shrink,1
the lecturers cut the islamist,1
the engineer exposed the merchant,0
the writers devoured the emperors,1
the engineers judged the lecturers,1
the sergeant told the parisians,0
the mariners burned the speakers,1
the programmer kicked the boxers,0
the fiance washed the engineers,0
the warlocks liked the fiances,1
the governors liked the writers,1
the mariner dubbed the mariners,0
the violinist anointed the speaker,0
the grader injected the emperor,0
the martyrs hated the governor,1
the speaker bathed the exiles,0
the enthusiasts pushed the heroes,1
the spectators stained the loyalist,1
the fishermen labeled the president,1
the shrink saw the programmers,0
the ruler elected the martyr,0
the warlock taxed the lecturer,0
the barbarians dirtied the vocalist,1
the fishermen ate the homosexuals,1
the bartender rubbed the emperors,0
the hero told the suckers,0
the scribe fed the graders,0
the  islamists contaminated the barbarians,1
the merchants suggested the warlocks,1
the technicians spared the violinist,1
the spouse labeled the rabbis,0
the technicians stained the  islamists,1
the speaker drenched the enthusiasts,0
the exiles showed the loyalist,1
the sergeants drenched the writer,1
the fiances charged the englishmen,1
the bartender tainted the mariner,0
the mariners revealed the shrinks,1
the scribes blanketed the girlfriend,1
the writer smothered the fiances,0
the engineers saved the boxers,1
the barbarians taught the martyrs,1
the speakers loved the emperors,1
the parisian kicked the engineer,0
the rulers masked the lovers,1
the lovers smothered the scribes,1
the lecturers scorched the grader,1
the  islamists refused the exile,1
the fishermen fancied the spouses,1
the parisians singed the vocalist,1
the martyr tipped the writer,0
the spouse revealed the girlfriend,0
the vocalist taxed the engineer,0
the speakers twirled the englishmen,1
the grader watched the violinists,0
the defendant masked the lovers,0
the barbarians rubbed the rulers,1
the governors tipped the lover,1
the bartender kicked the spouses,0
the writers stained the president,1
the husband fancied the heroes,0
the rulers restored the lover,1
the enthusiast watched the violinists,0
the parisians twirled the sergeant,1
the governors saw the speakers,1
the englishman injected the shrinks,0
the writer labeled the governor,0
the suckers dirtied the fiances,1
the fisherman bandaged the speaker,0
the programmers bound the programmer,1
the scribes glimpsed the speakers,1
the martyrs liked the president,1
the scribes appointed the graders,1
the suckers choked the warlocks,1
the violinist loved the barbarian,0
the lecturer watched the englishmen,0
the enthusiasts washed the sergeants,1
the lover refused the barbarian,0
the vocalists twirled the merchant,1
the exile saved the mariners,0
the merchants splashed the fiance,1
the defendant rubbed the shrink,0
the englishman carried the parisian,0
the engineer mentioned the defendants,0
the hero masked the emperors,0
the lover contaminated the boxers,0
the spectator doused the girlfriend,0
